library/src/blas3/Tensile/Logic/asm_full/arcturus_Cijk_Ailk_Bjlk_HBH.yaml
- {MinimumRequiredVersion: 4.23.0}
- arcturus
- gfx908
- [Device 7380, Device 7388, Device 738c, Device 7390]
    SolutionIndex: 0
    SolutionNameMin: Cijk_Ailk_Bjlk_HBH_MT64x64x16_MI32x32x8x1_SE_AF0EM8_GRVW2_SU0_SUS256_SRVW4_TT1_32_WG64_4_1_WGM1
    SolutionIndex: 1
    SolutionNameMin: Cijk_Ailk_Bjlk_HBH_MT32x32x16_MI16x16x16x1_SE_AF0EM8_GRVW2_SU0_SUS256_SRVW4_TT1_16_WG32_8_1_WGM1
    SolutionIndex: 2
    SolutionNameMin: Cijk_Ailk_Bjlk_HBH_MT32x32x32_MI16x16x16x1_SE_AF0EM8_GRVW2_SU0_SUS256_SRVW4_TT1_16_WG32_8_1_WGM1
    SolutionIndex: 3
    SolutionNameMin: Cijk_Ailk_Bjlk_HBH_MT32x32x32_MI16x16x16x1_SE_AF0EM8_GRVW4_SU0_SUS256_SRVW4_TT1_16_WG32_8_1_WGM1
    SolutionIndex: 4
    SolutionNameMin: Cijk_Ailk_Bjlk_HBH_MT128x288x32_MI32x32x8x1_SE_AF0EM8_GRVW4_SU0_SUS256_SRVW4_TT1_288_WG128_2_1_WGM1
    SolutionIndex: 5
    SolutionNameMin: Cijk_Ailk_Bjlk_HBH_MT256x160x32_MI32x32x8x1_SE_AF0EM8_GRVW4_SU0_SUS256_SRVW4_TT2_160_WG128_2_1_WGM1
    SolutionIndex: 6
    SolutionNameMin: Cijk_Ailk_Bjlk_HBH_MT32x32x64_MI16x16x16x1_SE_AF0EM8_GRVW4_SU0_SUS256_SRVW4_TT1_16_WG32_8_1_WGM1
    SolutionIndex: 7
    SolutionNameMin: Cijk_Ailk_Bjlk_HBH_MT64x32x64_MI16x16x16x1_SE_AF0EM8_GRVW4_SU0_SUS256_SRVW4_TT2_16_WG32_8_1_WGM1
    SolutionIndex: 8
    SolutionNameMin: Cijk_Ailk_Bjlk_HBH_MT32x32x32_MI16x16x16x1_SE_AF0EM8_GRVW8_SU0_SUS256_SRVW4_TT1_16_WG32_8_1_WGM1
    SolutionIndex: 9
    SolutionNameMin: Cijk_Ailk_Bjlk_HBH_MT64x64x64_MI32x32x8x1_SE_AF0EM8_GRVW8_SU0_SUS256_SRVW4_TT1_32_WG64_4_1_WGM1
    SolutionIndex: 10
    SolutionNameMin: Cijk_Ailk_Bjlk_HBH_MT32x32x64_MI16x16x16x1_SE_AF0EM8_GRVW8_SU0_SUS256_SRVW4_TT1_16_WG32_8_1_WGM1
    SolutionIndex: 11
    SolutionNameMin: Cijk_Ailk_Bjlk_HBH_MT64x32x64_MI16x16x16x1_SE_AF0EM8_GRVW8_SU0_SUS256_SRVW4_TT2_16_WG32_8_1_WGM1
    SolutionIndex: 12
    SolutionNameMin: Cijk_Ailk_Bjlk_HBH_MT64x32x16_MI16x16x16x1_SE_AF0EM8_GRVW2_SU32_SUS128_SRVW4_TT2_16_WG32_8_1_WGM1
    SolutionIndex: 13
    SolutionNameMin: Cijk_Ailk_Bjlk_HBH_MT160x256x32_MI32x32x8x1_SE_AF0EM8_GRVW4_SU32_SUS128_SRVW0_TT5_64_WG32_8_1_WGM1
    SolutionIndex: 14
    SolutionNameMin: Cijk_Ailk_Bjlk_HBH_MT32x32x16_MI16x16x16x1_SE_AF0EM8_GRVW8_SU32_SUS128_SRVW4_TT1_16_WG32_8_1_WGM1
    SolutionIndex: 15
    SolutionNameMin: Cijk_Ailk_Bjlk_HBH_MT64x64x64_MI32x32x8x1_SE_AF0EM8_GRVW8_SU32_SUS128_SRVW4_TT1_32_WG64_4_1_WGM1
    SolutionIndex: 16
    SolutionNameMin: Cijk_Ailk_Bjlk_HBH_MT64x32x64_MI16x16x16x1_SE_AF0EM8_GRVW8_SU32_SUS128_SRVW4_TT2_16_WG32_8_1_WGM1
    SolutionIndex: 17
    SolutionNameMin: Cijk_Ailk_Bjlk_HBH_MT256x128x32_MI32x32x8x1_SE_AF0EM8_GRVW8_SU32_SUS256_SRVW4_TT4_64_WG64_4_1_WGM1
    SolutionIndex: 18
    SolutionNameMin: Cijk_Ailk_Bjlk_HBH_MT64x64x64_MI32x32x8x1_SE_AF0EM8_GRVW8_SU32_SUS256_SRVW4_TT1_32_WG64_4_1_WGM1
    SolutionIndex: 19
    SolutionNameMin: Cijk_Ailk_Bjlk_HBH_MT64x32x64_MI16x16x16x1_SE_AF0EM8_GRVW8_SU32_SUS256_SRVW4_TT2_16_WG32_8_1_WGM1
    SolutionIndex: 20
    SolutionNameMin: Cijk_Ailk_Bjlk_HBH_MT32x32x32_MI16x16x16x1_SE_AF0EM8_GRVW4_SU0_SUS256_SRVW4_TT1_16_WG32_8_1_WGM2
    SolutionIndex: 21
    SolutionNameMin: Cijk_Ailk_Bjlk_HBH_MT256x256x32_MI32x32x8x1_SE_AF0EM8_GRVW8_SU0_SUS256_SRVW4_TT4_128_WG64_4_1_WGM2
    SolutionIndex: 22
    SolutionNameMin: Cijk_Ailk_Bjlk_HBH_MT64x64x64_MI32x32x8x1_SE_AF0EM8_GRVW8_SU0_SUS256_SRVW4_TT1_32_WG64_4_1_WGM2
    SolutionIndex: 23
    SolutionNameMin: Cijk_Ailk_Bjlk_HBH_MT32x32x64_MI16x16x16x1_SE_AF0EM8_GRVW8_SU0_SUS256_SRVW4_TT1_16_WG32_8_1_WGM2
    SolutionIndex: 24
    SolutionNameMin: Cijk_Ailk_Bjlk_HBH_MT64x32x64_MI16x16x16x1_SE_AF0EM8_GRVW8_SU0_SUS256_SRVW4_TT2_16_WG32_8_1_WGM2
    SolutionIndex: 25
    SolutionNameMin: Cijk_Ailk_Bjlk_HBH_MT128x96x64_MI32x32x8x1_SE_AF0EM8_GRVW8_SU0_SUS256_SRVW4_TT1_96_WG128_2_1_WGM2
    SolutionIndex: 26
    SolutionNameMin: Cijk_Ailk_Bjlk_HBH_MT32x32x64_MI16x16x16x1_SE_AF0EM8_GRVW8_SU32_SUS128_SRVW4_TT1_16_WG32_8_1_WGM2
    SolutionIndex: 27
    SolutionNameMin: Cijk_Ailk_Bjlk_HBH_MT32x64x64_MI16x16x16x1_SE_AF0EM8_GRVW8_SU32_SUS128_SRVW4_TT1_32_WG32_8_1_WGM2
    SolutionIndex: 28
    SolutionNameMin: Cijk_Ailk_Bjlk_HBH_MT32x64x64_MI16x16x16x1_SE_AF0EM8_GRVW2_SU32_SUS256_SRVW4_TT1_32_WG32_8_1_WGM2
    SolutionIndex: 29
    SolutionNameMin: Cijk_Ailk_Bjlk_HBH_MT32x32x64_MI16x16x16x1_SE_AF0EM8_GRVW4_SU32_SUS256_SRVW4_TT1_16_WG32_8_1_WGM2
    SolutionIndex: 30
    SolutionNameMin: Cijk_Ailk_Bjlk_HBH_MT64x64x16_MI32x32x8x1_SE_AF0EM8_GRVW2_SU0_SUS256_SRVW4_TT1_32_WG64_4_1_WGM15
    SolutionIndex: 31
    SolutionNameMin: Cijk_Ailk_Bjlk_HBH_MT256x160x32_MI32x32x8x1_SE_AF0EM8_GRVW4_SU0_SUS256_SRVW4_TT2_160_WG128_2_1_WGM15
    SolutionIndex: 32
    SolutionNameMin: Cijk_Ailk_Bjlk_HBH_MT32x32x64_MI16x16x16x1_SE_AF0EM8_GRVW4_SU0_SUS256_SRVW4_TT1_16_WG32_8_1_WGM15
    SolutionIndex: 33
    SolutionNameMin: Cijk_Ailk_Bjlk_HBH_MT64x64x64_MI32x32x8x1_SE_AF0EM8_GRVW8_SU0_SUS256_SRVW4_TT1_32_WG64_4_1_WGM15
    SolutionIndex: 34
    SolutionNameMin: Cijk_Ailk_Bjlk_HBH_MT32x32x64_MI16x16x16x1_SE_AF0EM8_GRVW8_SU0_SUS256_SRVW4_TT1_16_WG32_8_1_WGM15
    SolutionIndex: 35
    SolutionNameMin: Cijk_Ailk_Bjlk_HBH_MT64x32x16_MI16x16x16x1_SE_AF0EM8_GRVW2_SU32_SUS256_SRVW4_TT2_16_WG32_8_1_WGM15
    SolutionIndex: 36
    SolutionNameMin: Cijk_Ailk_Bjlk_HBH_MT64x64x64_MI32x32x8x1_SE_AF0EM8_GRVW8_SU32_SUS256_SRVW4_TT1_32_WG64_4_1_WGM15
    SolutionIndex: 37
    SolutionNameMin: Cijk_Ailk_Bjlk_HBH_MT32x64x64_MI16x16x16x1_SE_AF0EM8_GRVW8_SU32_SUS256_SRVW4_TT1_32_WG32_8_1_WGM15
    SolutionIndex: 38
    SolutionNameMin: Cijk_Ailk_Bjlk_HBH_MT128x96x64_MI32x32x8x1_SE_AF0EM8_GRVW8_SU32_SUS256_SRVW4_TT1_96_WG128_2_1_WGM15
    SolutionIndex: 39
    SolutionNameMin: Cijk_Ailk_Bjlk_HBH_MT256x256x32_MI32x32x8x1_SE_AF0EM8_GRVW8_SU0_SUS256_SRVW4_TT4_128_WG64_4_1_WGM2
    SolutionIndex: 40
    SolutionNameMin: Cijk_Ailk_Bjlk_HBH_MT256x256x16_MI32x32x8x1_SE_AF0EM8_GRVW8_SU32_SUS128_SRVW4_TT4_128_WG64_4_1_WGM2
    SolutionIndex: 41
    SolutionNameMin: Cijk_Ailk_Bjlk_HBH_MT128x64x64_MI32x32x8x1_SE_AF0EM8_GRVW8_SU0_SUS256_SRVW0_TT2_32_WG64_4_1_WGM1
    SolutionIndex: 42
    SolutionNameMin: Cijk_Ailk_Bjlk_HBH_MT64x128x64_MI32x32x8x1_SE_AF0EM8_GRVW8_SU32_SUS128_SRVW0_TT1_64_WG64_4_1_WGM1
    SolutionIndex: 43
    SolutionNameMin: Cijk_Ailk_Bjlk_HBH_MT64x64x64_MI32x32x8x1_SE_AF0EM8_GRVW8_SU0_SUS256_SRVW0_TT1_32_WG64_4_1_WGM1
    SolutionIndex: 44
    SolutionNameMin: Cijk_Ailk_Bjlk_HBH_MT128x64x64_MI32x32x8x1_SE_AF0EM8_GRVW8_SU0_SUS256_SRVW0_TT2_32_WG64_4_1_WGM1
    SolutionIndex: 45
    SolutionNameMin: Cijk_Ailk_Bjlk_HBH_MT128x64x64_MI32x32x8x1_SE_AF0EM8_GRVW4_SU32_SUS256_SRVW0_TT2_32_WG64_4_1_WGM1
    SolutionIndex: 46
    SolutionNameMin: Cijk_Ailk_Bjlk_HBH_MT64x64x64_MI32x32x8x1_SE_AF0EM8_GRVW8_SU0_SUS256_SRVW0_TT1_32_WG64_4_1_WGM2
    SolutionIndex: 47
    SolutionNameMin: Cijk_Ailk_Bjlk_HBH_MT64x64x64_MI32x32x8x1_SE_AF0EM8_GRVW8_SU32_SUS128_SRVW0_TT1_32_WG64_4_1_WGM2
    SolutionIndex: 48
    SolutionNameMin: Cijk_Ailk_Bjlk_HBH_MT64x128x64_MI32x32x8x1_SE_AF0EM8_GRVW8_SU32_SUS128_SRVW0_TT1_64_WG64_4_1_WGM2
    SolutionIndex: 49
    SolutionNameMin: Cijk_Ailk_Bjlk_HBH_MT64x64x64_MI32x32x8x1_SE_AF0EM8_GRVW8_SU32_SUS256_SRVW0_TT1_32_WG64_4_1_WGM2
    SolutionIndex: 50
    SolutionNameMin: Cijk_Ailk_Bjlk_HBH_MT64x64x64_MI32x32x8x1_SE_AF0EM8_GRVW8_SU32_SUS128_SRVW0_TT1_32_WG64_4_1_WGM15
    SolutionIndex: 51
    SolutionNameMin: Cijk_Ailk_Bjlk_HBH_MT32x32x64_MI16x16x16x1_SE_AF0EM8_GRVW2_SU0_SUS256_SRVW0_TT1_16_WG32_8_1_WGM1
    SolutionIndex: 52
    SolutionNameMin: Cijk_Ailk_Bjlk_HBH_MT64x64x64_MI32x32x8x1_SE_AF0EM8_GRVW8_SU0_SUS256_SRVW0_TT1_32_WG64_4_1_WGM1
    SolutionIndex: 53
    SolutionNameMin: Cijk_Ailk_Bjlk_HBH_MT32x32x64_MI16x16x16x1_SE_AF0EM8_GRVW8_SU0_SUS256_SRVW0_TT1_16_WG32_8_1_WGM1
    SolutionIndex: 54
    SolutionNameMin: Cijk_Ailk_Bjlk_HBH_MT64x32x64_MI16x16x16x1_SE_AF0EM8_GRVW8_SU0_SUS256_SRVW0_TT2_16_WG32_8_1_WGM1
    SolutionIndex: 55
    SolutionNameMin: Cijk_Ailk_Bjlk_HBH_MT32x32x64_MI16x16x16x1_SE_AF0EM8_GRVW4_SU32_SUS128_SRVW0_TT1_16_WG32_8_1_WGM1
    SolutionIndex: 56
    SolutionNameMin: Cijk_Ailk_Bjlk_HBH_MT64x64x64_MI32x32x8x1_SE_AF0EM8_GRVW8_SU32_SUS128_SRVW0_TT1_32_WG64_4_1_WGM1
    SolutionIndex: 57
    SolutionNameMin: Cijk_Ailk_Bjlk_HBH_MT32x32x64_MI16x16x16x1_SE_AF0EM8_GRVW8_SU32_SUS128_SRVW0_TT1_16_WG32_8_1_WGM1
    SolutionIndex: 58
    SolutionNameMin: Cijk_Ailk_Bjlk_HBH_MT32x64x64_MI16x16x16x1_SE_AF0EM8_GRVW8_SU32_SUS128_SRVW0_TT1_32_WG32_8_1_WGM1
    SolutionIndex: 59
    SolutionNameMin: Cijk_Ailk_Bjlk_HBH_MT64x64x64_MI32x32x8x1_SE_AF0EM8_GRVW8_SU32_SUS256_SRVW0_TT1_32_WG64_4_1_WGM1
    SolutionIndex: 60
    SolutionNameMin: Cijk_Ailk_Bjlk_HBH_MT32x32x64_MI16x16x16x1_SE_AF0EM8_GRVW8_SU32_SUS256_SRVW0_TT1_16_WG32_8_1_WGM1
    SolutionIndex: 61
    SolutionNameMin: Cijk_Ailk_Bjlk_HBH_MT32x32x64_MI16x16x16x1_SE_AF0EM8_GRVW4_SU0_SUS256_SRVW0_TT1_16_WG32_8_1_WGM2
    SolutionIndex: 62
    SolutionNameMin: Cijk_Ailk_Bjlk_HBH_MT256x64x32_MI32x32x8x1_SE_AF0EM8_GRVW8_SU0_SUS256_SRVW0_TT4_32_WG64_4_1_WGM2
    SolutionIndex: 63
    SolutionNameMin: Cijk_Ailk_Bjlk_HBH_MT64x64x64_MI32x32x8x1_SE_AF0EM8_GRVW8_SU0_SUS256_SRVW0_TT1_32_WG64_4_1_WGM2
    SolutionIndex: 64
    SolutionNameMin: Cijk_Ailk_Bjlk_HBH_MT128x64x64_MI32x32x8x1_SE_AF0EM8_GRVW8_SU0_SUS256_SRVW0_TT2_32_WG64_4_1_WGM2
    SolutionIndex: 65
    SolutionNameMin: Cijk_Ailk_Bjlk_HBH_MT32x32x64_MI16x16x16x1_SE_AF0EM8_GRVW8_SU0_SUS256_SRVW0_TT1_16_WG32_8_1_WGM2
    SolutionIndex: 66
    SolutionNameMin: Cijk_Ailk_Bjlk_HBH_MT64x128x64_MI32x32x8x1_SE_AF0EM8_GRVW8_SU32_SUS128_SRVW0_TT1_64_WG64_4_1_WGM2
    SolutionIndex: 67
    SolutionNameMin: Cijk_Ailk_Bjlk_HBH_MT32x64x64_MI16x16x16x1_SE_AF0EM8_GRVW8_SU32_SUS128_SRVW0_TT1_32_WG32_8_1_WGM2
    SolutionIndex: 68
    SolutionNameMin: Cijk_Ailk_Bjlk_HBH_MT64x64x64_MI32x32x8x1_SE_AF0EM8_GRVW8_SU32_SUS128_SRVW0_TT1_32_WG64_4_1_WGM15
    SolutionIndex: 69
    SolutionNameMin: Cijk_Ailk_Bjlk_HBH_MT32x64x64_MI16x16x16x1_SE_AF0EM8_GRVW8_SU32_SUS128_SRVW0_TT1_32_WG32_8_1_WGM15
    SolutionIndex: 70
    SolutionNameMin: Cijk_Ailk_Bjlk_HBH_MT64x256x32_MI32x32x8x1_SE_AF0EM8_GRVW8_SU32_SUS256_SRVW0_TT1_128_WG64_4_1_WGM15
    SolutionIndex: 71
    SolutionNameMin: Cijk_Ailk_Bjlk_HBH_MT64x64x64_MI32x32x8x1_SE_AF0EM8_GRVW8_SU0_SUS256_SRVW0_TT1_32_WG64_4_1_WGM1
    SolutionIndex: 72
    SolutionNameMin: Cijk_Ailk_Bjlk_HBH_MT32x32x64_MI16x16x16x1_SE_AF0EM8_GRVW8_SU0_SUS256_SRVW0_TT1_16_WG32_8_1_WGM1
    SolutionIndex: 73
    SolutionNameMin: Cijk_Ailk_Bjlk_HBH_MT64x64x64_MI32x32x8x1_SE_AF0EM8_GRVW8_SU32_SUS128_SRVW0_TT1_32_WG64_4_1_WGM1
    SolutionIndex: 74
    SolutionNameMin: Cijk_Ailk_Bjlk_HBH_MT32x32x64_MI16x16x16x1_SE_AF0EM8_GRVW8_SU32_SUS128_SRVW0_TT1_16_WG32_8_1_WGM1
    SolutionIndex: 75
    SolutionNameMin: Cijk_Ailk_Bjlk_HBH_MT128x64x64_MI32x32x8x1_SE_AF0EM8_GRVW8_SU32_SUS256_SRVW0_TT2_32_WG64_4_1_WGM1
    SolutionIndex: 76
    SolutionNameMin: Cijk_Ailk_Bjlk_HBH_MT32x32x64_MI16x16x16x1_SE_AF0EM8_GRVW8_SU32_SUS128_SRVW0_TT1_16_WG32_8_1_WGM2
    SolutionIndex: 77
    SolutionNameMin: Cijk_Ailk_Bjlk_HBH_MT32x32x64_MI16x16x16x1_SE_AF0EM8_GRVW4_SU0_SUS256_SRVW0_TT1_16_WG32_8_1_WGM15
    SolutionIndex: 78
    SolutionNameMin: Cijk_Ailk_Bjlk_HBH_MT32x32x64_MI16x16x16x1_SE_AF0EM8_GRVW8_SU0_SUS256_SRVW0_TT1_16_WG32_8_1_WGM15
    SolutionIndex: 79
    SolutionNameMin: Cijk_Ailk_Bjlk_HBH_MT64x128x64_MI32x32x8x1_SE_AF0EM8_GRVW4_SU32_SUS128_SRVW0_TT1_64_WG64_4_1_WGM15
    SolutionIndex: 80
    SolutionNameMin: Cijk_Ailk_Bjlk_HBH_MT32x32x16_MI16x16x16x1_SE_AF0EM1_GRVW2_SU0_SUS256_SRVW4_TT1_16_WG32_8_1_WGM1
    SolutionIndex: 81
    SolutionNameMin: Cijk_Ailk_Bjlk_HBH_MT32x32x32_MI16x16x16x1_SE_AF0EM1_GRVW4_SU0_SUS256_SRVW4_TT1_16_WG32_8_1_WGM1
    SolutionIndex: 82
    SolutionNameMin: Cijk_Ailk_Bjlk_HBH_MT32x32x16_MI16x16x16x1_SE_AF0EM1_GRVW8_SU0_SUS256_SRVW4_TT1_16_WG32_8_1_WGM1
    SolutionIndex: 83
    SolutionNameMin: Cijk_Ailk_Bjlk_HBH_MT32x32x16_MI16x16x16x1_SE_AF0EM1_GRVW2_SU32_SUS256_SRVW4_TT1_16_WG32_8_1_WGM1
    SolutionIndex: 84
    SolutionNameMin: Cijk_Ailk_Bjlk_HBH_MT64x64x16_MI32x32x8x1_SE_AF0EM1_GRVW2_SU0_SUS256_SRVW4_TT1_32_WG64_4_1_WGM2
    SolutionIndex: 85
    SolutionNameMin: Cijk_Ailk_Bjlk_HBH_MT32x32x32_MI16x16x16x1_SE_AF0EM1_GRVW2_SU0_SUS256_SRVW4_TT1_16_WG32_8_1_WGM2
    SolutionIndex: 86
    SolutionNameMin: Cijk_Ailk_Bjlk_HBH_MT32x64x16_MI16x16x16x1_SE_AF0EM1_GRVW2_SU32_SUS256_SRVW4_TT1_32_WG32_8_1_WGM2
    SolutionIndex: 87
    SolutionNameMin: Cijk_Ailk_Bjlk_HBH_MT16x16x64_MI16x16x16x1_SE_AF0EM8_GRVW8_SU0_SUS256_SRVW0_TT1_16_WG16_4_1_WGM1
    SolutionIndex: 88
    SolutionNameMin: Cijk_Ailk_Bjlk_HBH_MT16x16x64_MI16x16x16x1_SE_AF0EM8_GRVW8_SU32_SUS128_SRVW0_TT1_16_WG16_4_1_WGM1
    SolutionIndex: 89
    SolutionNameMin: Cijk_Ailk_Bjlk_HBH_MT16x64x32_MI16x16x16x1_SE_AF0EM8_GRVW8_SU0_SUS256_SRVW0_TT1_16_WG16_16_1_WGM2
    SolutionIndex: 90
    SolutionNameMin: Cijk_Ailk_Bjlk_HBH_MT256x256x32_MI32x32x8x1_SE_AF0EM8_EPS1_GRVW8_GSU1_PGR1_SU0_SUS256_SRVW4_TT4_128_VAW2_WG64_4_1_WGM1
    SolutionIndex: 91
    SolutionNameMin: Cijk_Ailk_Bjlk_HBH_MT128x256x32_MI32x32x8x1_SE_AF0EM8_EPS0_GRVW4_GSU1_PGR2_SU0_SUS256_SRVW4_TT2_128_VAW2_WG64_4_1_WGM2
    SolutionIndex: 92
    SolutionNameMin: Cijk_Ailk_Bjlk_HBH_MT64x128x64_MI32x32x8x1_SE_AF0EM8_EPS0_GRVW8_GSU1_PGR2_SU32_SUS256_SRVW4_TT1_64_VAW2_WG64_4_1_WGM15
    SolutionIndex: 93
    SolutionNameMin: Cijk_Ailk_Bjlk_HBH_MT32x64x64_MI16x16x16x1_SE_AF0EM8_EPS0_GRVW8_GSU1_PGR2_SU0_SUS256_SRVW4_TT1_32_VAW2_WG32_8_1_WGM1
    SolutionIndex: 94
    SolutionNameMin: Cijk_Ailk_Bjlk_HBH_MT128x256x16_MI32x32x8x1_SE_AF0EM8_EPS0_GRVW8_GSU1_PGR2_SU32_SUS128_SRVW4_TT2_128_VAW2_WG64_4_1_WGM15
    SolutionIndex: 95
    SolutionNameMin: Cijk_Ailk_Bjlk_HBH_MT256x256x32_MI32x32x8x1_SE_AF0EM8_EPS1_GRVW8_GSU1_PGR1_SU0_SUS256_SRVW4_TT4_128_VAW2_WG64_4_1_WGM2
    SolutionIndex: 96
    SolutionNameMin: Cijk_Ailk_Bjlk_HBH_MT256x128x32_MI32x32x8x1_SE_AF0EM8_EPS0_GRVW4_GSU1_PGR2_SU0_SUS256_SRVW4_TT4_64_VAW2_WG64_4_1_WGM15
    SolutionIndex: 97
    SolutionNameMin: Cijk_Ailk_Bjlk_HBH_MT128x64x64_MI32x32x8x1_SE_AF0EM8_EPS0_GRVW2_GSU1_PGR2_SU0_SUS256_SRVW4_TT2_32_VAW2_WG64_4_1_WGM15
    SolutionIndex: 98
    SolutionNameMin: Cijk_Ailk_Bjlk_HBH_MT64x32x64_MI16x16x16x1_SE_AF0EM8_EPS0_GRVW4_GSU1_PGR2_SU0_SUS256_SRVW4_TT2_16_VAW2_WG32_8_1_WGM15
    SolutionIndex: 99
    SolutionNameMin: Cijk_Ailk_Bjlk_HBH_MT128x192x16_MI32x32x8x1_SE_AF0EM8_EPS0_GRVW4_GSU1_PGR2_SU32_SUS128_SRVW4_TT2_96_VAW2_WG64_4_1_WGM2
    SolutionIndex: 100
    SolutionNameMin: Cijk_Ailk_Bjlk_HBH_MT256x144x32_MI16x16x16x1_SE_AF0EM8_EPS0_GRVW2_GSU1_PGR2_SU0_SUS256_SRVW4_TT4_144_VAW2_WG64_4_1_WGM15
    SolutionIndex: 101
    SolutionNameMin: Cijk_Ailk_Bjlk_HBH_MT192x64x32_MI32x32x8x1_SE_AF0EM8_EPS0_GRVW8_GSU1_PGR2_SU0_SUS256_SRVW0_TT3_32_VAW2_WG64_4_1_WGM15
    SolutionIndex: 102
    SolutionNameMin: Cijk_Ailk_Bjlk_HBH_MT64x64x32_MI32x32x8x1_SE_AF0EM8_EPS0_GRVW8_GSU1_PGR2_SU0_SUS256_SRVW4_TT1_32_VAW2_WG64_4_1_WGM2
    SolutionIndex: 103
    SolutionNameMin: Cijk_Ailk_Bjlk_HBH_MT64x64x32_MI32x32x8x1_SE_AF0EM8_EPS0_GRVW8_GSU1_PGR2_SU32_SUS128_SRVW4_TT1_32_VAW2_WG64_4_1_WGM1
    SolutionIndex: 104
    SolutionNameMin: Cijk_Ailk_Bjlk_HBH_MT4x64x32_MI4x4x4x16_SE_AF0EM1_EPS1_GRVW2_GSU1_PGR1_SU0_SUS256_SRVW0_TT1_4_VAW2_WG4_16_1_WGM1
    SolutionIndex: 105
    SolutionNameMin: Cijk_Ailk_Bjlk_HBH_MT16x16x64_MI16x16x16x1_SE_AF0EM8_EPS0_GRVW2_GSU2_PGR2_SU0_SUS256_SRVW4_TT1_16_VAW1_WG16_4_1_WGM15
    SolutionIndex: 106
    SolutionNameMin: Cijk_Ailk_Bjlk_HBH_MT64x64x16_MI32x32x8x1_SE_AF0EM8_EPS1_GRVW4_GSU1_PGR1_SU0_SUS256_SRVW4_TT1_32_VAW2_WG64_4_1_WGM2
    SolutionIndex: 107
    SolutionNameMin: Cijk_Ailk_Bjlk_HBH_MT64x64x16_MI32x32x8x1_SE_AF0EM8_EPS0_GRVW2_GSU1_PGR2_SU32_SUS128_SRVW4_TT1_32_VAW2_WG64_4_1_WGM15
    SolutionIndex: 108
    SolutionNameMin: Cijk_Ailk_Bjlk_HBH_MT64x64x16_MI32x32x8x1_SE_AF0EM8_EPS0_GRVW8_GSU1_PGR2_SU32_SUS128_SRVW4_TT1_32_VAW2_WG64_4_1_WGM15
    SolutionIndex: 109
    SolutionNameMin: Cijk_Ailk_Bjlk_HBH_MT128x288x16_MI32x32x8x1_SE_AF0EM8_EPS0_GRVW2_GSU1_PGR2_SU0_SUS256_SRVW4_TT1_288_VAW2_WG128_2_1_WGM15
    SolutionIndex: 110
    SolutionNameMin: Cijk_Ailk_Bjlk_HBH_MT128x96x16_MI32x32x8x1_SE_AF0EM8_EPS0_GRVW2_GSU1_PGR2_SU0_SUS256_SRVW4_TT1_96_VAW2_WG128_2_1_WGM15
    SolutionIndex: 111
    SolutionNameMin: Cijk_Ailk_Bjlk_HBH_MT128x160x16_MI32x32x8x1_SE_AF0EM8_EPS0_GRVW2_GSU1_PGR2_SU32_SUS128_SRVW4_TT1_160_VAW2_WG128_2_1_WGM15
    SolutionIndex: 112
    SolutionNameMin: Cijk_Ailk_Bjlk_HBH_MT64x64x16_MI32x32x8x1_SE_AF0EM8_EPS0_GRVW4_GSU1_PGR2_SU0_SUS256_SRVW4_TT1_32_VAW2_WG64_4_1_WGM1
    SolutionIndex: 113
    SolutionNameMin: Cijk_Ailk_Bjlk_HBH_MT16x64x32_MI16x16x16x1_SE_AF0EM8_EPS1_GRVW2_GSU1_PGR1_SU0_SUS256_SRVW0_TT1_16_VAW2_WG16_16_1_WGM1
    SolutionIndex: 114
    SolutionNameMin: Cijk_Ailk_Bjlk_HBH_MT16x16x32_MI16x16x16x1_SE_AF0EM8_EPS0_GRVW2_GSU5_PGR2_SU0_SUS256_SRVW0_TT1_16_VAW1_WG16_4_1_WGM1
    SolutionIndex: 115
    SolutionNameMin: Cijk_Ailk_Bjlk_HBH_MT64x32x16_MI16x16x16x1_SE_AF0EM8_EPS0_GRVW2_GSU1_PGR2_SU0_SUS256_SRVW4_TT2_16_VAW2_WG32_8_1_WGM15
    SolutionIndex: 116
    SolutionNameMin: Cijk_Ailk_Bjlk_HBH_MT64x64x16_MI32x32x8x1_SE_AF0EM8_EPS0_GRVW4_GSU1_PGR2_SU0_SUS256_SRVW4_TT1_32_VAW2_WG64_4_1_WGM15
    SolutionIndex: 117
    SolutionNameMin: Cijk_Ailk_Bjlk_HBH_MT128x96x64_MI32x32x8x1_SE_AF0EM8_EPS0_GRVW8_GSU1_PGR2_SU0_SUS256_SRVW4_TT1_96_VAW2_WG128_2_1_WGM1
    SolutionIndex: 118
    SolutionNameMin: Cijk_Ailk_Bjlk_HBH_MT128x288x32_MI32x32x8x1_SE_AF0EM8_EPS0_GRVW4_GSU1_PGR2_SU0_SUS256_SRVW4_TT1_288_VAW2_WG128_2_1_WGM15
    SolutionIndex: 119
    SolutionNameMin: Cijk_Ailk_Bjlk_HBH_MT128x256x16_MI32x32x8x1_SE_AF0EM8_EPS0_GRVW8_GSU1_PGR2_SU0_SUS256_SRVW4_TT2_128_VAW2_WG64_4_1_WGM15
    SolutionIndex: 120
    SolutionNameMin: Cijk_Ailk_Bjlk_HBH_MT144x256x32_MI16x16x16x1_SE_AF0EM8_EPS0_GRVW2_GSU1_PGR2_SU0_SUS256_SRVW0_TT9_64_VAW2_WG16_16_1_WGM1
    SolutionIndex: 121
    SolutionNameMin: Cijk_Ailk_Bjlk_HBH_MT64x64x16_MI32x32x8x1_SE_AF0EM8_EPS0_GRVW2_GSU1_PGR2_SU32_SUS256_SRVW4_TT1_32_VAW2_WG64_4_1_WGM15
    SolutionIndex: 122
    SolutionNameMin: Cijk_Ailk_Bjlk_HBH_MT64x16x64_MI16x16x16x1_SE_AF0EM8_EPS0_GRVW2_GSU7_PGR2_SU0_SUS256_SRVW0_TT1_16_VAW1_WG64_4_1_WGM1
    SolutionIndex: 123
    SolutionNameMin: Cijk_Ailk_Bjlk_HBH_MT64x64x16_MI32x32x8x1_SE_AF0EM8_EPS0_GRVW2_GSU1_PGR2_SU0_SUS256_SRVW4_TT1_32_VAW2_WG64_4_1_WGM15
    SolutionIndex: 124
    SolutionNameMin: Cijk_Ailk_Bjlk_HBH_MT64x192x32_MI32x32x8x1_SE_AF0EM8_EPS0_GRVW8_GSU1_PGR2_SU0_SUS256_SRVW4_TT1_96_VAW2_WG64_4_1_WGM1
    SolutionIndex: 125
    SolutionNameMin: Cijk_Ailk_Bjlk_HBH_MT128x160x32_MI32x32x8x1_SE_AF0EM8_EPS0_GRVW4_GSU2_PGR2_SU0_SUS256_SRVW4_TT1_160_VAW1_WG128_2_1_WGM15
    SolutionIndex: 126
    SolutionNameMin: Cijk_Ailk_Bjlk_HBH_MT128x288x32_MI32x32x8x1_SE_AF0EM8_EPS0_GRVW2_GSU1_PGR2_SU0_SUS256_SRVW4_TT1_288_VAW2_WG128_2_1_WGM15
    SolutionIndex: 127
    SolutionNameMin: Cijk_Ailk_Bjlk_HBH_MT128x256x16_MI32x32x8x1_SE_AF0EM8_EPS0_GRVW8_GSU1_PGR2_SU0_SUS256_SRVW4_TT2_128_VAW2_WG64_4_1_WGM15
    SolutionIndex: 128
    SolutionNameMin: Cijk_Ailk_Bjlk_HBH_MT144x256x32_MI16x16x16x1_SE_AF0EM8_EPS0_GRVW2_GSU1_PGR2_SU32_SUS128_SRVW0_TT9_64_VAW2_WG16_16_1_WGM15
    SolutionIndex: 129
    SolutionNameMin: Cijk_Ailk_Bjlk_HBH_MT64x128x16_MI32x32x8x1_SE_AF0EM8_EPS0_GRVW2_GSU1_PGR2_SU0_SUS256_SRVW4_TT1_64_VAW2_WG64_4_1_WGM2
    SolutionIndex: 130
    SolutionNameMin: Cijk_Ailk_Bjlk_HBH_MT32x32x16_MI16x16x16x1_SE_AF0EM8_EPS1_GRVW2_GSU1_PGR1_SU0_SUS256_SRVW4_TT1_16_VAW2_WG32_8_1_WGM1
    SolutionIndex: 131
    SolutionNameMin: Cijk_Ailk_Bjlk_HBH_MT64x16x64_MI16x16x16x1_SE_AF0EM8_EPS0_GRVW2_GSU7_PGR2_SU32_SUS256_SRVW4_TT1_16_VAW1_WG64_4_1_WGM1
    SolutionIndex: 132
    SolutionNameMin: Cijk_Ailk_Bjlk_HBH_MT64x64x16_MI32x32x8x1_SE_AF0EM8_EPS1_GRVW2_GSU1_PGR1_SU0_SUS256_SRVW4_TT1_32_VAW2_WG64_4_1_WGM2
    SolutionIndex: 133
    SolutionNameMin: Cijk_Ailk_Bjlk_HBH_MT128x96x64_MI32x32x8x1_SE_AF0EM8_EPS0_GRVW8_GSU1_PGR2_SU0_SUS256_SRVW4_TT1_96_VAW2_WG128_2_1_WGM2
    SolutionIndex: 134
    SolutionNameMin: Cijk_Ailk_Bjlk_HBH_MT64x64x16_MI32x32x8x1_SE_AF0EM8_EPS0_GRVW8_GSU1_PGR2_SU0_SUS256_SRVW4_TT1_32_VAW2_WG64_4_1_WGM1
    SolutionIndex: 135
    SolutionNameMin: Cijk_Ailk_Bjlk_HBH_MT64x16x64_MI16x16x16x1_SE_AF0EM8_EPS0_GRVW2_GSU7_PGR2_SU32_SUS256_SRVW0_TT1_16_VAW1_WG64_4_1_WGM2
    SolutionIndex: 136
    SolutionNameMin: Cijk_Ailk_Bjlk_HBH_MT128x96x32_MI32x32x8x1_SE_AF0EM8_EPS0_GRVW4_GSU1_PGR2_SU0_SUS256_SRVW4_TT1_96_VAW2_WG128_2_1_WGM2
    SolutionIndex: 137
    SolutionNameMin: Cijk_Ailk_Bjlk_HBH_MT128x160x32_MI32x32x8x1_SE_AF0EM8_EPS0_GRVW4_GSU2_PGR2_SU0_SUS256_SRVW4_TT1_160_VAW1_WG128_2_1_WGM2
    SolutionIndex: 138
    SolutionNameMin: Cijk_Ailk_Bjlk_HBH_MT256x256x16_MI32x32x8x1_SE_AF0EM8_EPS0_GRVW8_GSU1_PGR2_SU0_SUS256_SRVW4_TT4_128_VAW2_WG64_4_1_WGM1
    SolutionIndex: 139
    SolutionNameMin: Cijk_Ailk_Bjlk_HBH_MT64x64x16_MI32x32x8x1_SE_AF0EM8_EPS0_GRVW8_GSU1_PGR2_SU0_SUS256_SRVW4_TT1_32_VAW2_WG64_4_1_WGM15
    SolutionIndex: 140
    SolutionNameMin: Cijk_Ailk_Bjlk_HBH_MT64x64x16_MI32x32x8x1_SE_AF0EM8_EPS1_GRVW2_GSU1_PGR1_SU0_SUS256_SRVW4_TT1_32_VAW2_WG64_4_1_WGM15
    SolutionIndex: 141
    SolutionNameMin: Cijk_Ailk_Bjlk_HBH_MT64x192x32_MI32x32x8x1_SE_AF0EM8_EPS0_GRVW4_GSU1_PGR2_SU0_SUS256_SRVW4_TT1_96_VAW2_WG64_4_1_WGM1
    SolutionIndex: 142
    SolutionNameMin: Cijk_Ailk_Bjlk_HBH_MT128x256x32_MI32x32x8x1_SE_AF0EM8_EPS0_GRVW2_GSU3_PGR2_SU0_SUS256_SRVW4_TT2_128_VAW1_WG64_4_1_WGM2
    SolutionIndex: 143
    SolutionNameMin: Cijk_Ailk_Bjlk_HBH_MT128x256x16_MI32x32x8x1_SE_AF0EM8_EPS0_GRVW4_GSU1_PGR2_SU0_SUS256_SRVW4_TT2_128_VAW2_WG64_4_1_WGM2
    SolutionIndex: 144
    SolutionNameMin: Cijk_Ailk_Bjlk_HBH_MT64x128x16_MI32x32x8x1_SE_AF0EM8_EPS0_GRVW2_GSU1_PGR2_SU32_SUS256_SRVW4_TT1_64_VAW2_WG64_4_1_WGM1
    SolutionIndex: 145
    SolutionNameMin: Cijk_Ailk_Bjlk_HBH_MT64x16x64_MI16x16x16x1_SE_AF0EM8_EPS0_GRVW2_GSU7_PGR2_SU32_SUS256_SRVW0_TT1_16_VAW1_WG64_4_1_WGM1
    SolutionIndex: 146
    SolutionNameMin: Cijk_Ailk_Bjlk_HBH_MT64x64x16_MI32x32x8x1_SE_AF0EM8_EPS0_GRVW4_GSU1_PGR2_SU32_SUS128_SRVW4_TT1_32_VAW2_WG64_4_1_WGM15
    SolutionIndex: 147
    SolutionNameMin: Cijk_Ailk_Bjlk_HBH_MT128x256x16_MI32x32x8x1_SE_AF0EM8_EPS0_GRVW8_GSU1_PGR2_SU32_SUS128_SRVW4_TT2_128_VAW2_WG64_4_1_WGM15
    SolutionIndex: 148
    SolutionNameMin: Cijk_Ailk_Bjlk_HBH_MT64x256x16_MI32x32x8x1_SE_AF0EM8_EPS1_GRVW8_GSU1_PGR1_SU32_SUS256_SRVW4_TT1_128_VAW2_WG64_4_1_WGM1
    SolutionIndex: 149
    SolutionNameMin: Cijk_Ailk_Bjlk_HBH_MT16x16x16_MI16x16x16x1_SE_AF0EM8_EPS1_GRVW2_GSU1_PGR1_SU0_SUS256_SRVW0_TT1_16_VAW2_WG16_4_1_WGM1
    SolutionIndex: 150
    SolutionNameMin: Cijk_Ailk_Bjlk_HBH_MT64x16x64_MI16x16x16x1_SE_AF0EM8_EPS0_GRVW2_GSU7_PGR2_SU32_SUS128_SRVW0_TT1_16_VAW1_WG64_4_1_WGM1
    SolutionIndex: 151
    SolutionNameMin: Cijk_Ailk_Bjlk_HBH_MT64x64x16_MI32x32x8x1_SE_AF0EM8_EPS0_GRVW2_GSU1_PGR2_SU0_SUS256_SRVW4_TT1_32_VAW2_WG64_4_1_WGM2
    SolutionIndex: 152
    SolutionNameMin: Cijk_Ailk_Bjlk_HBH_MT128x96x64_MI32x32x8x1_SE_AF0EM8_EPS0_GRVW4_GSU1_PGR2_SU32_SUS128_SRVW4_TT1_96_VAW2_WG128_2_1_WGM2
    SolutionIndex: 153
    SolutionNameMin: Cijk_Ailk_Bjlk_HBH_MT16x16x64_MI16x16x16x1_SE_AF0EM8_EPS0_GRVW2_GSU3_PGR2_SU0_SUS256_SRVW0_TT1_16_VAW1_WG16_4_1_WGM1
    SolutionIndex: 154
    SolutionNameMin: Cijk_Ailk_Bjlk_HBH_MT128x256x16_MI32x32x8x1_SE_AF0EM8_EPS0_GRVW4_GSU1_PGR2_SU32_SUS128_SRVW4_TT2_128_VAW2_WG64_4_1_WGM15
    SolutionIndex: 155
    SolutionNameMin: Cijk_Ailk_Bjlk_HBH_MT256x160x32_MI32x32x8x1_SE_AF0EM8_EPS1_GRVW4_GSU1_PGR1_SU0_SUS256_SRVW4_TT2_160_VAW2_WG128_2_1_WGM2
    SolutionIndex: 156
    SolutionNameMin: Cijk_Ailk_Bjlk_HBH_MT64x64x16_MI32x32x8x1_SE_AF0EM8_EPS0_GRVW8_GSU1_PGR2_SU32_SUS256_SRVW4_TT1_32_VAW2_WG64_4_1_WGM1
    SolutionIndex: 157
    SolutionNameMin: Cijk_Ailk_Bjlk_HBH_MT16x16x64_MI16x16x16x1_SE_AF0EM8_EPS0_GRVW2_GSU3_PGR2_SU0_SUS256_SRVW0_TT1_16_VAW1_WG16_4_1_WGM15
    SolutionIndex: 158
    SolutionNameMin: Cijk_Ailk_Bjlk_HBH_MT64x32x16_MI16x16x16x1_SE_AF0EM8_EPS1_GRVW2_GSU1_PGR1_SU0_SUS256_SRVW4_TT2_16_VAW2_WG32_8_1_WGM15
    SolutionIndex: 159
    SolutionNameMin: Cijk_Ailk_Bjlk_HBH_MT64x64x32_MI32x32x8x1_SE_AF0EM8_EPS0_GRVW8_GSU15_PGR2_SU0_SUS256_SRVW4_TT1_32_VAW1_WG64_4_1_WGM15
    SolutionIndex: 160
    SolutionNameMin: Cijk_Ailk_Bjlk_HBH_MT64x64x16_MI32x32x8x1_SE_AF0EM8_EPS1_GRVW2_GSU1_PGR1_SU0_SUS256_SRVW4_TT1_32_VAW2_WG64_4_1_WGM1
    SolutionIndex: 161
    SolutionNameMin: Cijk_Ailk_Bjlk_HBH_MT128x128x32_MI32x32x8x1_SE_AF0EM8_EPS0_GRVW2_GSU15_PGR2_SU32_SUS128_SRVW4_TT2_64_VAW1_WG64_4_1_WGM15
    SolutionIndex: 162
    SolutionNameMin: Cijk_Ailk_Bjlk_HBH_MT128x256x32_MI32x32x8x1_SE_AF0EM8_EPS0_GRVW8_GSU7_PGR2_SU0_SUS256_SRVW4_TT2_128_VAW1_WG64_4_1_WGM1
    SolutionIndex: 163
    SolutionNameMin: Cijk_Ailk_Bjlk_HBH_MT256x256x32_MI32x32x8x1_SE_AF0EM8_EPS1_GRVW8_GSU7_PGR1_SU0_SUS256_SRVW0_TT4_128_VAW1_WG64_4_1_WGM1
    SolutionIndex: 164
    SolutionNameMin: Cijk_Ailk_Bjlk_HBH_MT64x64x32_MI32x32x8x1_SE_AF0EM8_EPS0_GRVW4_GSU1_PGR2_SU32_SUS128_SRVW4_TT1_32_VAW2_WG64_4_1_WGM2
    SolutionIndex: 165
    SolutionNameMin: Cijk_Ailk_Bjlk_HBH_MT64x64x16_MI32x32x8x1_SE_AF0EM8_EPS0_GRVW2_GSU1_PGR2_SU32_SUS256_SRVW4_TT1_32_VAW2_WG64_4_1_WGM2
    SolutionIndex: 166
    SolutionNameMin: Cijk_Ailk_Bjlk_HBH_MT4x64x32_MI4x4x4x16_SE_AF0EM8_EPS1_GRVW2_GSU1_PGR1_SU0_SUS256_SRVW0_TT1_4_VAW2_WG4_16_1_WGM1
    SolutionIndex: 167
    SolutionNameMin: Cijk_Ailk_Bjlk_HBH_MT64x64x32_MI32x32x8x1_SE_AF0EM8_EPS0_GRVW8_GSU1_PGR2_SU32_SUS128_SRVW4_TT1_32_VAW2_WG64_4_1_WGM15
    SolutionIndex: 168
    SolutionNameMin: Cijk_Ailk_Bjlk_HBH_MT256x256x32_MI32x32x8x1_SE_AF0EM8_EPS1_GRVW8_GSU1_PGR1_SU32_SUS256_SRVW4_TT4_128_VAW2_WG64_4_1_WGM1
    SolutionIndex: 169
    SolutionNameMin: Cijk_Ailk_Bjlk_HBH_MT144x256x32_MI16x16x16x1_SE_AF0EM8_EPS0_GRVW2_GSU1_PGR2_SU32_SUS256_SRVW0_TT9_64_VAW2_WG16_16_1_WGM2
    SolutionIndex: 170
    SolutionNameMin: Cijk_Ailk_Bjlk_HBH_MT128x64x16_MI32x32x8x1_SE_AF0EM8_EPS0_GRVW8_GSU1_PGR2_SU32_SUS128_SRVW4_TT2_32_VAW2_WG64_4_1_WGM1
    SolutionIndex: 171
    SolutionNameMin: Cijk_Ailk_Bjlk_HBH_MT128x160x32_MI32x32x8x1_SE_AF0EM8_EPS0_GRVW4_GSU2_PGR2_SU32_SUS128_SRVW4_TT1_160_VAW1_WG128_2_1_WGM15
    SolutionIndex: 172
    SolutionNameMin: Cijk_Ailk_Bjlk_HBH_MT256x160x32_MI32x32x8x1_SE_AF0EM8_EPS1_GRVW4_GSU1_PGR1_SU0_SUS256_SRVW4_TT2_160_VAW2_WG128_2_1_WGM15
    SolutionIndex: 173
    SolutionNameMin: Cijk_Ailk_Bjlk_HBH_MT128x256x16_MI32x32x8x1_SE_AF0EM8_EPS0_GRVW8_GSU1_PGR2_SU0_SUS256_SRVW4_TT2_128_VAW2_WG64_4_1_WGM2
    SolutionIndex: 174
    SolutionNameMin: Cijk_Ailk_Bjlk_HBH_MT144x256x32_MI16x16x16x1_SE_AF0EM8_EPS0_GRVW2_GSU1_PGR2_SU32_SUS256_SRVW0_TT9_64_VAW2_WG16_16_1_WGM1
    SolutionIndex: 175
    SolutionNameMin: Cijk_Ailk_Bjlk_HBH_MT128x256x16_MI32x32x8x1_SE_AF0EM8_EPS0_GRVW4_GSU7_PGR2_SU0_SUS256_SRVW4_TT2_128_VAW1_WG64_4_1_WGM15
    SolutionIndex: 176
    SolutionNameMin: Cijk_Ailk_Bjlk_HBH_MT128x256x32_MI32x32x8x1_SE_AF0EM8_EPS0_GRVW8_GSU7_PGR2_SU0_SUS256_SRVW4_TT2_128_VAW1_WG64_4_1_WGM2
    SolutionIndex: 177
    SolutionNameMin: Cijk_Ailk_Bjlk_HBH_MT128x256x32_MI32x32x8x1_SE_AF0EM8_EPS0_GRVW4_GSU7_PGR2_SU0_SUS256_SRVW4_TT2_128_VAW1_WG64_4_1_WGM2
    SolutionIndex: 178
    SolutionNameMin: Cijk_Ailk_Bjlk_HBH_MT128x96x64_MI32x32x8x1_SE_AF0EM8_EPS0_GRVW4_GSU1_PGR2_SU0_SUS256_SRVW4_TT1_96_VAW2_WG128_2_1_WGM2
    SolutionIndex: 179
    SolutionNameMin: Cijk_Ailk_Bjlk_HBH_MT128x288x32_MI32x32x8x1_SE_AF0EM8_EPS0_GRVW2_GSU1_PGR2_SU32_SUS128_SRVW4_TT1_288_VAW2_WG128_2_1_WGM15
    SolutionIndex: 180
    SolutionNameMin: Cijk_Ailk_Bjlk_HBH_MT256x160x32_MI32x32x8x1_SE_AF0EM8_EPS1_GRVW4_GSU1_PGR1_SU32_SUS128_SRVW4_TT2_160_VAW2_WG128_2_1_WGM15
    SolutionIndex: 181
    SolutionNameMin: Cijk_Ailk_Bjlk_HBH_MT288x128x32_MI32x32x8x1_SE_AF0EM8_EPS0_GRVW2_GSU1_PGR2_SU0_SUS256_SRVW0_TT9_32_VAW2_WG32_8_1_WGM1
    SolutionIndex: 182
    SolutionNameMin: Cijk_Ailk_Bjlk_HBH_MT32x64x16_MI16x16x16x1_SE_AF0EM8_EPS0_GRVW2_GSU1_PGR2_SU32_SUS256_SRVW4_TT1_32_VAW2_WG32_8_1_WGM15
    SolutionIndex: 183
    SolutionNameMin: Cijk_Ailk_Bjlk_HBH_MT32x64x16_MI16x16x16x1_SE_AF0EM8_EPS0_GRVW8_GSU1_PGR2_SU32_SUS256_SRVW4_TT1_32_VAW2_WG32_8_1_WGM2
    SolutionIndex: 184
    SolutionNameMin: Cijk_Ailk_Bjlk_HBH_MT16x16x16_MI16x16x16x1_SE_AF0EM8_EPS0_GRVW2_GSU1_PGR2_SU32_SUS256_SRVW0_TT1_16_VAW2_WG16_4_1_WGM2
    SolutionIndex: 185
    SolutionNameMin: Cijk_Ailk_Bjlk_HBH_MT64x32x16_MI16x16x16x1_SE_AF0EM8_EPS1_GRVW2_GSU1_PGR1_SU32_SUS128_SRVW4_TT2_16_VAW2_WG32_8_1_WGM1
    SolutionIndex: 186
    SolutionNameMin: Cijk_Ailk_Bjlk_HBH_MT64x32x16_MI16x16x16x1_SE_AF0EM8_EPS0_GRVW8_GSU1_PGR2_SU32_SUS128_SRVW4_TT2_16_VAW2_WG32_8_1_WGM2
    SolutionIndex: 187
    SolutionNameMin: Cijk_Ailk_Bjlk_HBH_MT64x32x16_MI16x16x16x1_SE_AF0EM8_EPS0_GRVW8_GSU1_PGR2_SU32_SUS256_SRVW4_TT2_16_VAW2_WG32_8_1_WGM15
    SolutionIndex: 188
    SolutionNameMin: Cijk_Ailk_Bjlk_HBH_MT64x32x16_MI16x16x16x1_SE_AF0EM8_EPS1_GRVW8_GSU1_PGR1_SU32_SUS256_SRVW4_TT2_16_VAW2_WG32_8_1_WGM15
    SolutionIndex: 189
    SolutionNameMin: Cijk_Ailk_Bjlk_HBH_MT64x32x16_MI16x16x16x1_SE_AF0EM8_EPS1_GRVW8_GSU1_PGR1_SU32_SUS128_SRVW4_TT2_16_VAW2_WG32_8_1_WGM2
    SolutionIndex: 190
    SolutionNameMin: Cijk_Ailk_Bjlk_HBH_MT64x32x16_MI16x16x16x1_SE_AF0EM8_EPS0_GRVW2_GSU1_PGR2_SU32_SUS256_SRVW4_TT2_16_VAW2_WG32_8_1_WGM2
    SolutionIndex: 191
    SolutionNameMin: Cijk_Ailk_Bjlk_HBH_MT64x32x16_MI16x16x16x1_SE_AF0EM8_EPS0_GRVW2_GSU1_PGR2_SU32_SUS256_SRVW4_TT2_16_VAW2_WG32_8_1_WGM2
    SolutionIndex: 192
    SolutionNameMin: Cijk_Ailk_Bjlk_HBH_MT64x32x16_MI16x16x16x1_SE_AF0EM8_EPS1_GRVW2_GSU1_PGR1_SU32_SUS128_SRVW4_TT2_16_VAW2_WG32_8_1_WGM2
    SolutionIndex: 193
    SolutionNameMin: Cijk_Ailk_Bjlk_HBH_MT64x32x16_MI16x16x16x1_SE_AF0EM8_EPS0_GRVW2_GSU1_PGR2_SU32_SUS128_SRVW4_TT2_16_VAW2_WG32_8_1_WGM2
    SolutionIndex: 194
    SolutionNameMin: Cijk_Ailk_Bjlk_HBH_MT64x32x16_MI16x16x16x1_SE_AF0EM8_EPS0_GRVW4_GSU1_PGR2_SU32_SUS128_SRVW4_TT2_16_VAW2_WG32_8_1_WGM15
    SolutionIndex: 195
    SolutionNameMin: Cijk_Ailk_Bjlk_HBH_MT64x32x16_MI16x16x16x1_SE_AF0EM8_EPS0_GRVW2_GSU1_PGR2_SU32_SUS128_SRVW4_TT2_16_VAW2_WG32_8_1_WGM1
    SolutionIndex: 196
    SolutionNameMin: Cijk_Ailk_Bjlk_HBH_MT32x32x64_MI16x16x16x1_SE_AF0EM8_EPS0_GRVW8_GSU1_PGR2_SU0_SUS256_SRVW4_TT1_16_VAW2_WG32_8_1_WGM15
    SolutionIndex: 197
    SolutionNameMin: Cijk_Ailk_Bjlk_HBH_MT32x32x64_MI16x16x16x1_SE_AF0EM8_EPS0_GRVW8_GSU1_PGR2_SU0_SUS256_SRVW4_TT1_16_VAW2_WG32_8_1_WGM1
    SolutionIndex: 198
    SolutionNameMin: Cijk_Ailk_Bjlk_HBH_MT32x32x32_MI16x16x16x1_SE_AF0EM8_EPS0_GRVW4_GSU1_PGR2_SU0_SUS256_SRVW4_TT1_16_VAW2_WG32_8_1_WGM1
    SolutionIndex: 199
    SolutionNameMin: Cijk_Ailk_Bjlk_HBH_MT256x144x32_MI16x16x16x1_SE_AF0EM8_EPS0_GRVW2_GSU1_PGR2_SU32_SUS256_SRVW4_TT4_144_VAW2_WG64_4_1_WGM15
    SolutionIndex: 200
    SolutionNameMin: Cijk_Ailk_Bjlk_HBH_MT32x32x64_MI16x16x16x1_SE_AF0EM8_EPS0_GRVW4_GSU1_PGR2_SU0_SUS256_SRVW4_TT1_16_VAW2_WG32_8_1_WGM2
    SolutionIndex: 201
    SolutionNameMin: Cijk_Ailk_Bjlk_HBH_MT128x128x32_MI32x32x8x1_SE_AF0EM8_EPS0_GRVW8_GSU1_PGR2_SU0_SUS256_SRVW4_TT2_64_VAW2_WG64_4_1_WGM15
    SolutionIndex: 202
    SolutionNameMin: Cijk_Ailk_Bjlk_HBH_MT32x32x32_MI16x16x16x1_SE_AF0EM8_EPS0_GRVW8_GSU5_PGR2_SU0_SUS256_SRVW4_TT1_16_VAW1_WG32_8_1_WGM1
    SolutionIndex: 203
    SolutionNameMin: Cijk_Ailk_Bjlk_HBH_MT128x64x64_MI32x32x8x1_SE_AF0EM8_EPS0_GRVW8_GSU1_PGR2_SU0_SUS256_SRVW4_TT2_32_VAW2_WG64_4_1_WGM2
    SolutionIndex: 204
    SolutionNameMin: Cijk_Ailk_Bjlk_HBH_MT64x64x16_MI32x32x8x1_SE_AF0EM8_EPS1_GRVW4_GSU1_PGR1_SU32_SUS256_SRVW4_TT1_32_VAW2_WG64_4_1_WGM1
    SolutionIndex: 205
    SolutionNameMin: Cijk_Ailk_Bjlk_HBH_MT128x96x64_MI32x32x8x1_SE_AF0EM8_EPS1_GRVW8_GSU5_PGR1_SU0_SUS256_SRVW4_TT1_96_VAW1_WG128_2_1_WGM15
    SolutionIndex: 206
    SolutionNameMin: Cijk_Ailk_Bjlk_HBH_MT128x160x32_MI32x32x8x1_SE_AF0EM8_EPS0_GRVW4_GSU7_PGR2_SU0_SUS256_SRVW4_TT1_160_VAW1_WG128_2_1_WGM1
    SolutionIndex: 207
    SolutionNameMin: Cijk_Ailk_Bjlk_HBH_MT128x128x32_MI32x32x8x1_SE_AF0EM8_EPS0_GRVW8_GSU3_PGR2_SU32_SUS128_SRVW4_TT2_64_VAW1_WG64_4_1_WGM2
    SolutionIndex: 208
    SolutionNameMin: Cijk_Ailk_Bjlk_HBH_MT128x256x16_MI32x32x8x1_SE_AF0EM8_EPS0_GRVW4_GSU5_PGR2_SU0_SUS256_SRVW4_TT2_128_VAW1_WG64_4_1_WGM15
    SolutionIndex: 209
    SolutionNameMin: Cijk_Ailk_Bjlk_HBH_MT128x128x32_MI32x32x8x1_SE_AF0EM8_EPS0_GRVW4_GSU2_PGR2_SU0_SUS256_SRVW4_TT2_64_VAW1_WG64_4_1_WGM15
    SolutionIndex: 210
    SolutionNameMin: Cijk_Ailk_Bjlk_HBH_MT128x192x32_MI32x32x8x1_SE_AF0EM8_EPS0_GRVW4_GSU3_PGR2_SU0_SUS256_SRVW4_TT2_96_VAW1_WG64_4_1_WGM1
    SolutionIndex: 211
    SolutionNameMin: Cijk_Ailk_Bjlk_HBH_MT128x192x16_MI32x32x8x1_SE_AF0EM8_EPS0_GRVW4_GSU3_PGR2_SU0_SUS256_SRVW4_TT2_96_VAW1_WG64_4_1_WGM2
    SolutionIndex: 212
    SolutionNameMin: Cijk_Ailk_Bjlk_HBH_MT128x256x16_MI32x32x8x1_SE_AF0EM8_EPS0_GRVW4_GSU3_PGR2_SU0_SUS256_SRVW4_TT2_128_VAW1_WG64_4_1_WGM2
    SolutionIndex: 213
    SolutionNameMin: Cijk_Ailk_Bjlk_HBH_MT128x256x32_MI32x32x8x1_SE_AF0EM8_EPS1_GRVW8_GSU3_PGR1_SU0_SUS256_SRVW4_TT2_128_VAW1_WG64_4_1_WGM15
    SolutionIndex: 214
    SolutionNameMin: Cijk_Ailk_Bjlk_HBH_MT128x192x32_MI32x32x8x1_SE_AF0EM8_EPS0_GRVW4_GSU2_PGR2_SU0_SUS256_SRVW4_TT2_96_VAW1_WG64_4_1_WGM15
    SolutionIndex: 215
    SolutionNameMin: Cijk_Ailk_Bjlk_HBH_MT256x160x32_MI32x32x8x1_SE_AF0EM8_EPS1_GRVW4_GSU3_PGR1_SU32_SUS256_SRVW4_TT2_160_VAW1_WG128_2_1_WGM2
    SolutionIndex: 216
    SolutionNameMin: Cijk_Ailk_Bjlk_HBH_MT128x128x32_MI32x32x8x1_SE_AF0EM8_EPS0_GRVW4_GSU1_PGR2_SU0_SUS256_SRVW4_TT2_64_VAW2_WG64_4_1_WGM15
    SolutionIndex: 217
    SolutionNameMin: Cijk_Ailk_Bjlk_HBH_MT128x288x32_MI32x32x8x1_SE_AF0EM8_EPS0_GRVW4_GSU2_PGR2_SU0_SUS256_SRVW4_TT1_288_VAW1_WG128_2_1_WGM15
    SolutionIndex: 218
    SolutionNameMin: Cijk_Ailk_Bjlk_HBH_MT128x160x32_MI32x32x8x1_SE_AF0EM8_EPS0_GRVW4_GSU1_PGR2_SU0_SUS256_SRVW4_TT1_160_VAW2_WG128_2_1_WGM2
    SolutionIndex: 219
    SolutionNameMin: Cijk_Ailk_Bjlk_HBH_MT128x192x32_MI32x32x8x1_SE_AF0EM8_EPS0_GRVW4_GSU1_PGR2_SU0_SUS256_SRVW4_TT2_96_VAW2_WG64_4_1_WGM15
    SolutionIndex: 220
    SolutionNameMin: Cijk_Ailk_Bjlk_HBH_MT128x192x32_MI32x32x8x1_SE_AF0EM8_EPS0_GRVW4_GSU1_PGR2_SU0_SUS256_SRVW4_TT2_96_VAW2_WG64_4_1_WGM1
    SolutionIndex: 221
    SolutionNameMin: Cijk_Ailk_Bjlk_HBH_MT128x192x32_MI32x32x8x1_SE_AF0EM8_EPS0_GRVW4_GSU1_PGR2_SU0_SUS256_SRVW4_TT2_96_VAW2_WG64_4_1_WGM2
    SolutionIndex: 222
    SolutionNameMin: Cijk_Ailk_Bjlk_HBH_MT128x256x32_MI32x32x8x1_SE_AF0EM8_EPS1_GRVW4_GSU1_PGR1_SU0_SUS256_SRVW4_TT2_128_VAW2_WG64_4_1_WGM1
    SolutionIndex: 223
    SolutionNameMin: Cijk_Ailk_Bjlk_HBH_MT128x256x32_MI32x32x8x1_SE_AF0EM8_EPS1_GRVW8_GSU1_PGR1_SU0_SUS256_SRVW4_TT2_128_VAW2_WG64_4_1_WGM15
    SolutionIndex: 224
    SolutionNameMin: Cijk_Ailk_Bjlk_HBH_MT256x128x32_MI32x32x8x1_SE_AF0EM8_EPS1_GRVW8_GSU1_PGR1_SU32_SUS256_SRVW4_TT4_64_VAW2_WG64_4_1_WGM15
    SolutionIndex: 225
    SolutionNameMin: Cijk_Ailk_Bjlk_HBH_MT256x128x32_MI32x32x8x1_SE_AF0EM8_EPS1_GRVW8_GSU1_PGR1_SU32_SUS256_SRVW4_TT4_64_VAW2_WG64_4_1_WGM2
    SolutionIndex: 226
    SolutionNameMin: Cijk_Ailk_Bjlk_HBH_MT256x128x32_MI32x32x8x1_SE_AF0EM8_EPS1_GRVW8_GSU1_PGR1_SU0_SUS256_SRVW4_TT4_64_VAW2_WG64_4_1_WGM1
    SolutionIndex: 227
    SolutionNameMin: Cijk_Ailk_Bjlk_HBH_MT128x288x32_MI32x32x8x1_SE_AF0EM8_EPS1_GRVW4_GSU1_PGR1_SU0_SUS256_SRVW4_TT1_288_VAW2_WG128_2_1_WGM2
    SolutionIndex: 228
    SolutionNameMin: Cijk_Ailk_Bjlk_HBH_MT128x288x32_MI32x32x8x1_SE_AF0EM8_EPS1_GRVW4_GSU1_PGR1_SU0_SUS256_SRVW4_TT1_288_VAW2_WG128_2_1_WGM15
    SolutionIndex: 229
    SolutionNameMin: Cijk_Ailk_Bjlk_HBH_MT256x160x32_MI32x32x8x1_SE_AF0EM8_EPS1_GRVW4_GSU1_PGR1_SU32_SUS128_SRVW4_TT2_160_VAW2_WG128_2_1_WGM1
    SolutionIndex: 230
    SolutionNameMin: Cijk_Ailk_Bjlk_HBH_MT256x192x16_MI32x32x8x1_SE_AF0EM8_EPS1_GRVW4_GSU1_PGR1_SU32_SUS256_SRVW4_TT4_96_VAW2_WG64_4_1_WGM2
    SolutionIndex: 231
    SolutionNameMin: Cijk_Ailk_Bjlk_HBH_MT256x192x32_MI32x32x8x1_SE_AF0EM8_EPS1_GRVW8_GSU1_PGR1_SU32_SUS256_SRVW4_TT4_96_VAW2_WG64_4_1_WGM2
    SolutionIndex: 232
    SolutionNameMin: Cijk_Ailk_Bjlk_HBH_MT256x192x32_MI32x32x8x1_SE_AF0EM8_EPS1_GRVW8_GSU1_PGR1_SU32_SUS128_SRVW4_TT4_96_VAW2_WG64_4_1_WGM2
    SolutionIndex: 233
    SolutionNameMin: Cijk_Ailk_Bjlk_HBH_MT256x192x16_MI32x32x8x1_SE_AF0EM8_EPS1_GRVW4_GSU1_PGR1_SU32_SUS128_SRVW4_TT4_96_VAW2_WG64_4_1_WGM2
    SolutionIndex: 234
    SolutionNameMin: Cijk_Ailk_Bjlk_HBH_MT256x192x16_MI32x32x8x1_SE_AF0EM8_EPS1_GRVW4_GSU1_PGR1_SU32_SUS256_SRVW4_TT4_96_VAW2_WG64_4_1_WGM15
    SolutionIndex: 235
    SolutionNameMin: Cijk_Ailk_Bjlk_HBH_MT256x256x16_MI32x32x8x1_SE_AF0EM8_EPS1_GRVW4_GSU1_PGR1_SU32_SUS128_SRVW4_TT4_128_VAW2_WG64_4_1_WGM2
    SolutionIndex: 236
    SolutionNameMin: Cijk_Ailk_Bjlk_HBH_MT128x192x16_MI32x32x8x1_SE_AF0EM8_EPS0_GRVW4_GSU1_PGR2_SU0_SUS256_SRVW4_TT2_96_VAW2_WG64_4_1_WGM15
    SolutionIndex: 237
    SolutionNameMin: Cijk_Ailk_Bjlk_HBH_MT256x192x32_MI32x32x8x1_SE_AF0EM8_EPS1_GRVW8_GSU1_PGR1_SU32_SUS256_SRVW4_TT4_96_VAW2_WG64_4_1_WGM2
    SolutionIndex: 238
    SolutionNameMin: Cijk_Ailk_Bjlk_HBH_MT128x256x32_MI32x32x8x1_SE_AF0EM8_EPS1_GRVW8_GSU7_PGR1_SU0_SUS256_SRVW4_TT2_128_VAW1_WG64_4_1_WGM1
    SolutionIndex: 239
    SolutionNameMin: Cijk_Ailk_Bjlk_HBH_MT32x32x32_MI16x16x16x1_SE_AF0EM8_EPS0_GRVW8_GSU1_PGR2_SU0_SUS256_SRVW4_TT1_16_VAW2_WG32_8_1_WGM1
    SolutionIndex: 240
    SolutionNameMin: Cijk_Ailk_Bjlk_HBH_MT64x64x32_MI32x32x8x1_SE_AF0EM8_EPS0_GRVW8_GSU1_PGR2_SU0_SUS256_SRVW4_TT1_32_VAW2_WG64_4_1_WGM1
    SolutionIndex: 241
    SolutionNameMin: Cijk_Ailk_Bjlk_HBH_MT128x64x16_MI32x32x8x1_SE_AF0EM8_EPS0_GRVW4_GSU1_PGR2_SU0_SUS256_SRVW4_TT2_32_VAW2_WG64_4_1_WGM2
    SolutionIndex: 242
    SolutionNameMin: Cijk_Ailk_Bjlk_HBH_MT32x32x64_MI16x16x16x1_SE_AF0EM8_EPS0_GRVW4_GSU1_PGR2_SU0_SUS256_SRVW4_TT1_16_VAW2_WG32_8_1_WGM1
    SolutionIndex: 243
    SolutionNameMin: Cijk_Ailk_Bjlk_HBH_MT64x64x64_MI32x32x8x1_SE_AF0EM8_EPS0_GRVW8_GSU1_PGR2_SU32_SUS256_SRVW4_TT1_32_VAW2_WG64_4_1_WGM1
    SolutionIndex: 244
    SolutionNameMin: Cijk_Ailk_Bjlk_HBH_MT64x64x64_MI32x32x8x1_SE_AF0EM8_EPS0_GRVW8_GSU1_PGR2_SU0_SUS256_SRVW4_TT1_32_VAW2_WG64_4_1_WGM2
    SolutionIndex: 245
    SolutionNameMin: Cijk_Ailk_Bjlk_HBH_MT128x128x32_MI32x32x8x1_SE_AF0EM8_EPS0_GRVW8_GSU7_PGR2_SU32_SUS128_SRVW4_TT2_64_VAW1_WG64_4_1_WGM15
    SolutionIndex: 246
    SolutionNameMin: Cijk_Ailk_Bjlk_HBH_MT128x128x32_MI32x32x8x1_SE_AF0EM8_EPS0_GRVW8_GSU7_PGR2_SU0_SUS256_SRVW4_TT2_64_VAW1_WG64_4_1_WGM1
    SolutionIndex: 247
    SolutionNameMin: Cijk_Ailk_Bjlk_HBH_MT128x128x32_MI32x32x8x1_SE_AF0EM8_EPS0_GRVW2_GSU7_PGR2_SU0_SUS256_SRVW4_TT2_64_VAW1_WG64_4_1_WGM1
    SolutionIndex: 248
    SolutionNameMin: Cijk_Ailk_Bjlk_HBH_MT128x128x32_MI32x32x8x1_SE_AF0EM8_EPS0_GRVW8_GSU7_PGR2_SU32_SUS128_SRVW4_TT2_64_VAW1_WG64_4_1_WGM2
    SolutionIndex: 249
    SolutionNameMin: Cijk_Ailk_Bjlk_HBH_MT128x128x32_MI32x32x8x1_SE_AF0EM8_EPS0_GRVW4_GSU7_PGR2_SU32_SUS256_SRVW4_TT2_64_VAW1_WG64_4_1_WGM15
    SolutionIndex: 250
    SolutionNameMin: Cijk_Ailk_Bjlk_HBH_MT128x128x64_MI32x32x8x1_SE_AF0EM8_EPS0_GRVW8_GSU7_PGR2_SU0_SUS256_SRVW4_TT2_64_VAW1_WG64_4_1_WGM2
    SolutionIndex: 251
    SolutionNameMin: Cijk_Ailk_Bjlk_HBH_MT128x128x64_MI32x32x8x1_SE_AF0EM8_EPS0_GRVW8_GSU7_PGR2_SU32_SUS256_SRVW4_TT2_64_VAW1_WG64_4_1_WGM15
    SolutionIndex: 252
    SolutionNameMin: Cijk_Ailk_Bjlk_HBH_MT128x128x64_MI32x32x8x1_SE_AF0EM8_EPS0_GRVW8_GSU7_PGR2_SU32_SUS128_SRVW4_TT2_64_VAW1_WG64_4_1_WGM1
    SolutionIndex: 253
    SolutionNameMin: Cijk_Ailk_Bjlk_HBH_MT128x128x64_MI32x32x8x1_SE_AF0EM8_EPS0_GRVW8_GSU7_PGR2_SU32_SUS256_SRVW4_TT2_64_VAW1_WG64_4_1_WGM2
    SolutionIndex: 254
    SolutionNameMin: Cijk_Ailk_Bjlk_HBH_MT128x128x32_MI32x32x8x1_SE_AF0EM8_EPS0_GRVW2_GSU7_PGR2_SU32_SUS256_SRVW4_TT2_64_VAW1_WG64_4_1_WGM15
    SolutionIndex: 255
    SolutionNameMin: Cijk_Ailk_Bjlk_HBH_MT128x128x32_MI32x32x8x1_SE_AF0EM8_EPS0_GRVW2_GSU7_PGR2_SU32_SUS128_SRVW4_TT2_64_VAW1_WG64_4_1_WGM2
    SolutionIndex: 256
    SolutionNameMin: Cijk_Ailk_Bjlk_HBH_MT128x128x64_MI32x32x8x1_SE_AF0EM8_EPS0_GRVW4_GSU7_PGR2_SU32_SUS128_SRVW4_TT2_64_VAW1_WG64_4_1_WGM1
    SolutionIndex: 257
    SolutionNameMin: Cijk_Ailk_Bjlk_HBH_MT128x128x64_MI32x32x8x1_SE_AF0EM8_EPS0_GRVW8_GSU7_PGR2_SU32_SUS128_SRVW4_TT2_64_VAW1_WG64_4_1_WGM15
    SolutionIndex: 258
    SolutionNameMin: Cijk_Ailk_Bjlk_HBH_MT128x128x64_MI32x32x8x1_SE_AF0EM8_EPS0_GRVW8_GSU7_PGR2_SU32_SUS128_SRVW4_TT2_64_VAW1_WG64_4_1_WGM2
    SolutionIndex: 259
    SolutionNameMin: Cijk_Ailk_Bjlk_HBH_MT128x128x64_MI32x32x8x1_SE_AF0EM8_EPS0_GRVW8_GSU7_PGR2_SU0_SUS256_SRVW4_TT2_64_VAW1_WG64_4_1_WGM15
    SolutionIndex: 260
    SolutionNameMin: Cijk_Ailk_Bjlk_HBH_MT128x256x32_MI32x32x8x1_SE_AF0EM8_EPS1_GRVW8_GSU15_PGR1_SU0_SUS256_SRVW4_TT2_128_VAW1_WG64_4_1_WGM15
    SolutionIndex: 261
    SolutionNameMin: Cijk_Ailk_Bjlk_HBH_MT128x256x32_MI32x32x8x1_SE_AF0EM8_EPS1_GRVW8_GSU15_PGR1_SU0_SUS256_SRVW4_TT2_128_VAW1_WG64_4_1_WGM1
    SolutionIndex: 262
    SolutionNameMin: Cijk_Ailk_Bjlk_HBH_MT128x256x16_MI32x32x8x1_SE_AF0EM8_EPS0_GRVW8_GSU15_PGR2_SU0_SUS256_SRVW4_TT2_128_VAW1_WG64_4_1_WGM2
    SolutionIndex: 263
    SolutionNameMin: Cijk_Ailk_Bjlk_HBH_MT128x256x32_MI32x32x8x1_SE_AF0EM8_EPS0_GRVW8_GSU15_PGR2_SU0_SUS256_SRVW4_TT2_128_VAW1_WG64_4_1_WGM2
    SolutionIndex: 264
    SolutionNameMin: Cijk_Ailk_Bjlk_HBH_MT128x256x32_MI32x32x8x1_SE_AF0EM8_EPS0_GRVW4_GSU15_PGR2_SU0_SUS256_SRVW4_TT2_128_VAW1_WG64_4_1_WGM15
    SolutionIndex: 265
    SolutionNameMin: Cijk_Ailk_Bjlk_HBH_MT128x128x32_MI32x32x8x1_SE_AF0EM8_EPS0_GRVW8_GSU1_PGR2_SU0_SUS256_SRVW4_TT2_64_VAW2_WG64_4_1_WGM2
    SolutionIndex: 266
    SolutionNameMin: Cijk_Ailk_Bjlk_HBH_MT64x64x32_MI32x32x8x1_SE_AF0EM8_EPS0_GRVW8_GSU1_PGR2_SU32_SUS256_SRVW4_TT1_32_VAW2_WG64_4_1_WGM2
    SolutionIndex: 267
    SolutionNameMin: Cijk_Ailk_Bjlk_HBH_MT128x256x16_MI32x32x8x1_SE_AF0EM8_EPS0_GRVW4_GSU1_PGR2_SU32_SUS256_SRVW4_TT2_128_VAW2_WG64_4_1_WGM15
    SolutionIndex: 268
    SolutionNameMin: Cijk_Ailk_Bjlk_HBH_MT256x192x32_MI32x32x8x1_SE_AF0EM8_EPS0_GRVW8_GSU1_PGR2_SU0_SUS256_SRVW4_TT4_96_VAW2_WG64_4_1_WGM2
    SolutionIndex: 269
    SolutionNameMin: Cijk_Ailk_Bjlk_HBH_MT128x128x16_MI32x32x8x1_SE_AF0EM8_EPS0_GRVW4_GSU1_PGR2_SU32_SUS256_SRVW4_TT2_64_VAW2_WG64_4_1_WGM1
    SolutionIndex: 270
    SolutionNameMin: Cijk_Ailk_Bjlk_HBH_MT128x128x32_MI32x32x8x1_SE_AF0EM8_EPS0_GRVW4_GSU1_PGR2_SU0_SUS256_SRVW4_TT2_64_VAW2_WG64_4_1_WGM2
    SolutionIndex: 271
    SolutionNameMin: Cijk_Ailk_Bjlk_HBH_MT128x256x16_MI32x32x8x1_SE_AF0EM8_EPS0_GRVW4_GSU1_PGR2_SU0_SUS256_SRVW4_TT2_128_VAW2_WG64_4_1_WGM15
    SolutionIndex: 272
    SolutionNameMin: Cijk_Ailk_Bjlk_HBH_MT128x256x16_MI32x32x8x1_SE_AF0EM8_EPS0_GRVW8_GSU1_PGR2_SU32_SUS256_SRVW4_TT2_128_VAW2_WG64_4_1_WGM2
    SolutionIndex: 273
    SolutionNameMin: Cijk_Ailk_Bjlk_HBH_MT16x16x16_MI16x16x16x1_SE_AF0EM8_EPS0_GRVW2_GSU1_PGR2_SU0_SUS256_SRVW0_TT1_16_VAW2_WG16_4_1_WGM1
    SolutionIndex: 274
    SolutionNameMin: Cijk_Ailk_Bjlk_HBH_MT256x128x32_MI32x32x8x1_SE_AF0EM8_EPS1_GRVW8_GSU1_PGR1_SU0_SUS256_SRVW4_TT4_64_VAW2_WG64_4_1_WGM15
    SolutionIndex: 275
    SolutionNameMin: Cijk_Ailk_Bjlk_HBH_MT128x64x16_MI32x32x8x1_SE_AF0EM8_EPS1_GRVW2_GSU1_PGR1_SU0_SUS256_SRVW4_TT2_32_VAW2_WG64_4_1_WGM1
    SolutionIndex: 276
    SolutionNameMin: Cijk_Ailk_Bjlk_HBH_MT64x128x32_MI32x32x8x1_SE_AF0EM8_EPS1_GRVW8_GSU1_PGR1_SU0_SUS256_SRVW4_TT1_64_VAW2_WG64_4_1_WGM15
    SolutionIndex: 277
    SolutionNameMin: Cijk_Ailk_Bjlk_HBH_MT128x256x32_MI32x32x8x1_SE_AF0EM8_EPS1_GRVW8_GSU1_PGR1_SU0_SUS256_SRVW4_TT2_128_VAW2_WG64_4_1_WGM2
    SolutionIndex: 278
    SolutionNameMin: Cijk_Ailk_Bjlk_HBH_MT128x64x32_MI32x32x8x1_SE_AF0EM8_EPS0_GRVW2_GSU1_PGR2_SU0_SUS256_SRVW4_TT2_32_VAW2_WG64_4_1_WGM2
    SolutionIndex: 279
    SolutionNameMin: Cijk_Ailk_Bjlk_HBH_MT64x128x32_MI32x32x8x1_SE_AF0EM8_EPS0_GRVW2_GSU1_PGR2_SU0_SUS256_SRVW4_TT1_64_VAW2_WG64_4_1_WGM2
    SolutionIndex: 280
    SolutionNameMin: Cijk_Ailk_Bjlk_HBH_MT16x16x16_MI16x16x16x1_SE_AF0EM1_EPS1_GRVW2_GSU1_PGR1_SU0_SUS256_SRVW0_TT1_16_VAW2_WG16_4_1_WGM1
    SolutionIndex: 281
    SolutionNameMin: Cijk_Ailk_Bjlk_HBH_MT128x256x16_MI32x32x8x1_SE_AF0EM8_EPS0_GRVW4_GSU1_PGR2_SU0_SUS256_SRVW4_TT2_128_VAW2_WG64_4_1_WGM1
    SolutionIndex: 282
    SolutionNameMin: Cijk_Ailk_Bjlk_HBH_MT128x128x64_MI32x32x8x1_SE_AF0EM8_EPS0_GRVW4_GSU1_PGR2_SU32_SUS256_SRVW4_TT2_64_VAW2_WG64_4_1_WGM15
    SolutionIndex: 283
    SolutionNameMin: Cijk_Ailk_Bjlk_HBH_MT128x64x16_MI32x32x8x1_SE_AF0EM8_EPS0_GRVW4_GSU1_PGR2_SU0_SUS256_SRVW4_TT2_32_VAW2_WG64_4_1_WGM1
    SolutionIndex: 284
    SolutionNameMin: Cijk_Ailk_Bjlk_HBH_MT64x128x16_MI32x32x8x1_SE_AF0EM8_EPS0_GRVW4_GSU1_PGR2_SU0_SUS256_SRVW4_TT1_64_VAW2_WG64_4_1_WGM2
    SolutionIndex: 285
    SolutionNameMin: Cijk_Ailk_Bjlk_HBH_MT128x160x32_MI32x32x8x1_SE_AF0EM8_EPS0_GRVW4_GSU1_PGR2_SU0_SUS256_SRVW4_TT1_160_VAW2_WG128_2_1_WGM15
    SolutionIndex: 286
    SolutionNameMin: Cijk_Ailk_Bjlk_HBH_MT256x256x32_MI32x32x8x1_SE_AF0EM8_EPS1_GRVW8_GSU1_PGR1_SU32_SUS128_SRVW4_TT4_128_VAW2_WG64_4_1_WGM1
    SolutionIndex: 287
    SolutionNameMin: Cijk_Ailk_Bjlk_HBH_MT256x160x32_MI32x32x8x1_SE_AF0EM8_EPS1_GRVW4_GSU1_PGR1_SU32_SUS128_SRVW4_TT2_160_VAW2_WG128_2_1_WGM2
    SolutionIndex: 288
    SolutionNameMin: Cijk_Ailk_Bjlk_HBH_MT128x96x32_MI32x32x8x1_SE_AF0EM8_EPS0_GRVW2_GSU1_PGR2_SU0_SUS256_SRVW4_TT1_96_VAW2_WG128_2_1_WGM15
    SolutionIndex: 289
    SolutionNameMin: Cijk_Ailk_Bjlk_HBH_MT96x128x32_MI32x32x8x1_SE_AF0EM8_EPS0_GRVW4_GSU1_PGR2_SU32_SUS128_SRVW0_TT3_32_VAW2_WG32_8_1_WGM2
    SolutionIndex: 290
    SolutionNameMin: Cijk_Ailk_Bjlk_HBH_MT128x128x16_MI32x32x8x1_SE_AF0EM8_EPS0_GRVW8_GSU1_PGR2_SU0_SUS256_SRVW4_TT2_64_VAW2_WG64_4_1_WGM1
    SolutionIndex: 291
    SolutionNameMin: Cijk_Ailk_Bjlk_HBH_MT128x256x32_MI32x32x8x1_SE_AF0EM8_EPS0_GRVW8_GSU7_PGR2_SU0_SUS256_SRVW4_TT2_128_VAW1_WG64_4_1_WGM15
    SolutionIndex: 292
    SolutionNameMin: Cijk_Ailk_Bjlk_HBH_MT256x192x32_MI32x32x8x1_SE_AF0EM8_EPS1_GRVW8_GSU1_PGR1_SU32_SUS128_SRVW4_TT4_96_VAW2_WG64_4_1_WGM15
    SolutionIndex: 293
    SolutionNameMin: Cijk_Ailk_Bjlk_HBH_MT256x160x32_MI32x32x8x1_SE_AF0EM8_EPS0_GRVW2_GSU1_PGR2_SU0_SUS256_SRVW4_TT2_160_VAW2_WG128_2_1_WGM15
    SolutionIndex: 294
    SolutionNameMin: Cijk_Ailk_Bjlk_HBH_MT64x256x32_MI32x32x8x1_SE_AF0EM8_EPS0_GRVW2_GSU1_PGR2_SU0_SUS256_SRVW4_TT1_128_VAW2_WG64_4_1_WGM1
    SolutionIndex: 295
    SolutionNameMin: Cijk_Ailk_Bjlk_HBH_MT128x64x16_MI32x32x8x1_SE_AF0EM8_EPS0_GRVW2_GSU1_PGR2_SU0_SUS256_SRVW4_TT2_32_VAW2_WG64_4_1_WGM2
    SolutionIndex: 296
    SolutionNameMin: Cijk_Ailk_Bjlk_HBH_MT64x128x16_MI32x32x8x1_SE_AF0EM8_EPS0_GRVW8_GSU1_PGR2_SU32_SUS128_SRVW4_TT1_64_VAW2_WG64_4_1_WGM2
    SolutionIndex: 297
    SolutionNameMin: Cijk_Ailk_Bjlk_HBH_MT256x192x32_MI32x32x8x1_SE_AF0EM8_EPS1_GRVW8_GSU1_PGR1_SU0_SUS256_SRVW4_TT4_96_VAW2_WG64_4_1_WGM2
    SolutionIndex: 298
    SolutionNameMin: Cijk_Ailk_Bjlk_HBH_MT128x64x32_MI32x32x8x1_SE_AF0EM8_EPS0_GRVW2_GSU1_PGR2_SU0_SUS256_SRVW4_TT2_32_VAW2_WG64_4_1_WGM1
    SolutionIndex: 299
    SolutionNameMin: Cijk_Ailk_Bjlk_HBH_MT256x192x32_MI32x32x8x1_SE_AF0EM8_EPS1_GRVW8_GSU1_PGR1_SU32_SUS256_SRVW4_TT4_96_VAW2_WG64_4_1_WGM15
    SolutionIndex: 300
    SolutionNameMin: Cijk_Ailk_Bjlk_HBH_MT128x64x16_MI32x32x8x1_SE_AF0EM8_EPS0_GRVW2_GSU1_PGR2_SU0_SUS256_SRVW4_TT2_32_VAW2_WG64_4_1_WGM1
    SolutionIndex: 301
    SolutionNameMin: Cijk_Ailk_Bjlk_HBH_MT64x128x32_MI32x32x8x1_SE_AF0EM8_EPS0_GRVW2_GSU1_PGR2_SU32_SUS128_SRVW4_TT1_64_VAW2_WG64_4_1_WGM1
    SolutionIndex: 302
    SolutionNameMin: Cijk_Ailk_Bjlk_HBH_MT64x64x16_MI32x32x8x1_SE_AF0EM8_EPS0_GRVW8_GSU1_PGR2_SU32_SUS128_SRVW4_TT1_32_VAW2_WG64_4_1_WGM2
    SolutionIndex: 303
    SolutionNameMin: Cijk_Ailk_Bjlk_HBH_MT64x128x16_MI32x32x8x1_SE_AF0EM8_EPS0_GRVW2_GSU1_PGR2_SU32_SUS128_SRVW4_TT1_64_VAW2_WG64_4_1_WGM15
    SolutionIndex: 304
    SolutionNameMin: Cijk_Ailk_Bjlk_HBH_MT128x64x16_MI32x32x8x1_SE_AF0EM8_EPS1_GRVW2_GSU1_PGR1_SU32_SUS128_SRVW4_TT2_32_VAW2_WG64_4_1_WGM15
    SolutionIndex: 305
    SolutionNameMin: Cijk_Ailk_Bjlk_HBH_MT128x96x32_MI32x32x8x1_SE_AF0EM8_EPS0_GRVW4_GSU1_PGR2_SU0_SUS256_SRVW4_TT1_96_VAW2_WG128_2_1_WGM15
    SolutionIndex: 306
    SolutionNameMin: Cijk_Ailk_Bjlk_HBH_MT128x128x32_MI32x32x8x1_SE_AF0EM8_EPS0_GRVW4_GSU3_PGR2_SU0_SUS256_SRVW4_TT2_64_VAW1_WG64_4_1_WGM15
    SolutionIndex: 307
    SolutionNameMin: Cijk_Ailk_Bjlk_HBH_MT128x128x32_MI32x32x8x1_SE_AF0EM8_EPS0_GRVW8_GSU3_PGR2_SU0_SUS256_SRVW4_TT2_64_VAW1_WG64_4_1_WGM15
    SolutionIndex: 308
    SolutionNameMin: Cijk_Ailk_Bjlk_HBH_MT128x192x32_MI32x32x8x1_SE_AF0EM8_EPS0_GRVW4_GSU5_PGR2_SU0_SUS256_SRVW4_TT2_96_VAW1_WG64_4_1_WGM2
    SolutionIndex: 309
    SolutionNameMin: Cijk_Ailk_Bjlk_HBH_MT64x64x32_MI32x32x8x1_SE_AF0EM8_EPS0_GRVW8_GSU1_PGR2_SU32_SUS128_SRVW4_TT1_32_VAW2_WG64_4_1_WGM2
    SolutionIndex: 310
    SolutionNameMin: Cijk_Ailk_Bjlk_HBH_MT32x64x64_MI16x16x16x1_SE_AF0EM8_EPS0_GRVW8_GSU7_PGR2_SU0_SUS256_SRVW4_TT1_32_VAW1_WG32_8_1_WGM2
    SolutionIndex: 311
    SolutionNameMin: Cijk_Ailk_Bjlk_HBH_MT64x64x32_MI32x32x8x1_SE_AF0EM8_EPS0_GRVW4_GSU15_PGR2_SU32_SUS256_SRVW4_TT1_32_VAW1_WG64_4_1_WGM1
    SolutionIndex: 312
    SolutionNameMin: Cijk_Ailk_Bjlk_HBH_MT64x64x64_MI32x32x8x1_SE_AF0EM8_EPS0_GRVW2_GSU15_PGR2_SU32_SUS128_SRVW4_TT1_32_VAW1_WG64_4_1_WGM1
    SolutionIndex: 313
    SolutionNameMin: Cijk_Ailk_Bjlk_HBH_MT64x64x64_MI32x32x8x1_SE_AF0EM8_EPS0_GRVW8_GSU15_PGR2_SU32_SUS128_SRVW4_TT1_32_VAW1_WG64_4_1_WGM1
    SolutionIndex: 314
    SolutionNameMin: Cijk_Ailk_Bjlk_HBH_MT32x32x32_MI16x16x16x1_SE_AF0EM8_EPS0_GRVW4_GSU3_PGR2_SU32_SUS256_SRVW4_TT1_16_VAW1_WG32_8_1_WGM1
    SolutionIndex: 315
    SolutionNameMin: Cijk_Ailk_Bjlk_HBH_MT64x32x16_MI16x16x16x1_SE_AF0EM8_EPS1_GRVW2_GSU1_PGR1_SU0_SUS256_SRVW4_TT2_16_VAW2_WG32_8_1_WGM1
    SolutionIndex: 316
    SolutionNameMin: Cijk_Ailk_Bjlk_HBH_MT64x32x16_MI16x16x16x1_SE_AF0EM8_EPS0_GRVW4_GSU1_PGR2_SU0_SUS256_SRVW4_TT2_16_VAW2_WG32_8_1_WGM1
    SolutionIndex: 317
    SolutionNameMin: Cijk_Ailk_Bjlk_HBH_MT96x128x64_MI32x32x8x1_SE_AF0EM8_EPS0_GRVW2_GSU3_PGR2_SU0_SUS256_SRVW0_TT3_32_VAW1_WG32_8_1_WGM15
    SolutionIndex: 318
    SolutionNameMin: Cijk_Ailk_Bjlk_HBH_MT160x128x32_MI32x32x8x1_SE_AF0EM8_EPS0_GRVW2_GSU5_PGR2_SU32_SUS256_SRVW0_TT5_32_VAW1_WG32_8_1_WGM1
    SolutionIndex: 319
    SolutionNameMin: Cijk_Ailk_Bjlk_HBH_MT160x128x32_MI32x32x8x1_SE_AF0EM8_EPS0_GRVW2_GSU5_PGR2_SU32_SUS128_SRVW0_TT5_32_VAW1_WG32_8_1_WGM1
    SolutionIndex: 320
    SolutionNameMin: Cijk_Ailk_Bjlk_HBH_MT64x64x32_MI32x32x8x1_SE_AF0EM8_EPS0_GRVW8_GSU1_PGR2_SU0_SUS256_SRVW4_TT1_32_VAW2_WG64_4_1_WGM15
    SolutionIndex: 321
    SolutionNameMin: Cijk_Ailk_Bjlk_HBH_MT64x128x32_MI32x32x8x1_SE_AF0EM8_EPS0_GRVW4_GSU7_PGR2_SU32_SUS256_SRVW4_TT1_64_VAW1_WG64_4_1_WGM2
    SolutionIndex: 322
    SolutionNameMin: Cijk_Ailk_Bjlk_HBH_MT64x128x32_MI32x32x8x1_SE_AF0EM8_EPS0_GRVW4_GSU7_PGR2_SU0_SUS256_SRVW4_TT1_64_VAW1_WG64_4_1_WGM1
    SolutionIndex: 323
    SolutionNameMin: Cijk_Ailk_Bjlk_HBH_MT128x128x64_MI32x32x8x1_SE_AF0EM8_EPS0_GRVW8_GSU15_PGR2_SU0_SUS256_SRVW4_TT2_64_VAW1_WG64_4_1_WGM2
    SolutionIndex: 324
    SolutionNameMin: Cijk_Ailk_Bjlk_HBH_MT64x128x32_MI32x32x8x1_SE_AF0EM8_EPS0_GRVW4_GSU7_PGR2_SU32_SUS256_SRVW4_TT1_64_VAW1_WG64_4_1_WGM15
    SolutionIndex: 325
    SolutionNameMin: Cijk_Ailk_Bjlk_HBH_MT32x32x32_MI16x16x16x1_SE_AF0EM8_EPS0_GRVW4_GSU1_PGR2_SU32_SUS128_SRVW4_TT1_16_VAW2_WG32_8_1_WGM15
    SolutionIndex: 326
    SolutionNameMin: Cijk_Ailk_Bjlk_HBH_MT256x256x16_MI32x32x8x1_SE_AF0EM8_EPS1_GRVW8_GSU1_PGR1_SU0_SUS256_SRVW4_TT4_128_VAW2_WG64_4_1_WGM15
    SolutionIndex: 327
    SolutionNameMin: Cijk_Ailk_Bjlk_HBH_MT64x128x16_MI32x32x8x1_SE_AF0EM8_EPS1_GRVW2_GSU1_PGR1_SU32_SUS256_SRVW4_TT1_64_VAW2_WG64_4_1_WGM1
    SolutionIndex: 328
    SolutionNameMin: Cijk_Ailk_Bjlk_HBH_MT128x64x16_MI32x32x8x1_SE_AF0EM8_EPS0_GRVW2_GSU1_PGR2_SU32_SUS256_SRVW4_TT2_32_VAW2_WG64_4_1_WGM15
    SolutionIndex: 329
    SolutionNameMin: Cijk_Ailk_Bjlk_HBH_MT16x16x16_MI16x16x16x1_SE_AF0EM8_EPS1_GRVW2_GSU1_PGR1_SU0_SUS256_SRVW0_TT1_16_VAW2_WG16_4_1_WGM2
    SolutionIndex: 330
    SolutionNameMin: Cijk_Ailk_Bjlk_HBH_MT128x64x16_MI32x32x8x1_SE_AF0EM8_EPS0_GRVW2_GSU1_PGR2_SU32_SUS128_SRVW4_TT2_32_VAW2_WG64_4_1_WGM15
    SolutionIndex: 331
    SolutionNameMin: Cijk_Ailk_Bjlk_HBH_MT64x128x16_MI32x32x8x1_SE_AF0EM8_EPS1_GRVW2_GSU1_PGR1_SU32_SUS128_SRVW4_TT1_64_VAW2_WG64_4_1_WGM15
    SolutionIndex: 332
    SolutionNameMin: Cijk_Ailk_Bjlk_HBH_MT128x256x16_MI32x32x8x1_SE_AF0EM8_EPS0_GRVW8_GSU1_PGR2_SU32_SUS128_SRVW4_TT2_128_VAW2_WG64_4_1_WGM2
    SolutionIndex: 333
    SolutionNameMin: Cijk_Ailk_Bjlk_HBH_MT64x128x16_MI32x32x8x1_SE_AF0EM8_EPS1_GRVW2_GSU1_PGR1_SU0_SUS256_SRVW4_TT1_64_VAW2_WG64_4_1_WGM1
    SolutionIndex: 334
    SolutionNameMin: Cijk_Ailk_Bjlk_HBH_MT128x64x32_MI32x32x8x1_SE_AF0EM8_EPS1_GRVW8_GSU1_PGR1_SU0_SUS256_SRVW4_TT2_32_VAW2_WG64_4_1_WGM1
    SolutionIndex: 335
    SolutionNameMin: Cijk_Ailk_Bjlk_HBH_MT128x64x16_MI32x32x8x1_SE_AF0EM8_EPS0_GRVW8_GSU1_PGR2_SU0_SUS256_SRVW4_TT2_32_VAW2_WG64_4_1_WGM2
    SolutionIndex: 336
    SolutionNameMin: Cijk_Ailk_Bjlk_HBH_MT128x128x16_MI32x32x8x1_SE_AF0EM8_EPS0_GRVW2_GSU1_PGR2_SU0_SUS256_SRVW4_TT2_64_VAW2_WG64_4_1_WGM2
    SolutionIndex: 337
    SolutionNameMin: Cijk_Ailk_Bjlk_HBH_MT128x256x16_MI32x32x8x1_SE_AF0EM8_EPS0_GRVW8_GSU1_PGR2_SU0_SUS256_SRVW4_TT2_128_VAW2_WG64_4_1_WGM1
    SolutionIndex: 338
    SolutionNameMin: Cijk_Ailk_Bjlk_HBH_MT128x256x16_MI32x32x8x1_SE_AF0EM8_EPS0_GRVW8_GSU1_PGR2_SU0_SUS256_SRVW4_TT2_128_VAW2_WG64_4_1_WGM1
    SolutionIndex: 339
    SolutionNameMin: Cijk_Ailk_Bjlk_HBH_MT64x64x32_MI32x32x8x1_SE_AF0EM8_EPS0_GRVW4_GSU1_PGR2_SU0_SUS256_SRVW4_TT1_32_VAW2_WG64_4_1_WGM1
    SolutionIndex: 340
    SolutionNameMin: Cijk_Ailk_Bjlk_HBH_MT128x128x32_MI32x32x8x1_SE_AF0EM8_EPS0_GRVW8_GSU1_PGR2_SU0_SUS256_SRVW4_TT2_64_VAW2_WG64_4_1_WGM1
    SolutionIndex: 341
    SolutionNameMin: Cijk_Ailk_Bjlk_HBH_MT128x128x32_MI32x32x8x1_SE_AF0EM8_EPS1_GRVW8_GSU1_PGR1_SU0_SUS256_SRVW4_TT2_64_VAW2_WG64_4_1_WGM1
    SolutionIndex: 342
    SolutionNameMin: Cijk_Ailk_Bjlk_HBH_MT128x128x16_MI32x32x8x1_SE_AF0EM8_EPS0_GRVW8_GSU1_PGR2_SU32_SUS256_SRVW4_TT2_64_VAW2_WG64_4_1_WGM2
    SolutionIndex: 343
    SolutionNameMin: Cijk_Ailk_Bjlk_HBH_MT128x128x16_MI32x32x8x1_SE_AF0EM8_EPS1_GRVW8_GSU1_PGR1_SU0_SUS256_SRVW4_TT2_64_VAW2_WG64_4_1_WGM1
    SolutionIndex: 344
    SolutionNameMin: Cijk_Ailk_Bjlk_HBH_MT128x256x16_MI32x32x8x1_SE_AF0EM8_EPS0_GRVW8_GSU1_PGR2_SU32_SUS256_SRVW4_TT2_128_VAW2_WG64_4_1_WGM1
    SolutionIndex: 345
    SolutionNameMin: Cijk_Ailk_Bjlk_HBH_MT64x64x32_MI32x32x8x1_SE_AF0EM8_EPS0_GRVW2_GSU1_PGR2_SU0_SUS256_SRVW4_TT1_32_VAW2_WG64_4_1_WGM15
    SolutionIndex: 346
    SolutionNameMin: Cijk_Ailk_Bjlk_HBH_MT64x192x16_MI32x32x8x1_SE_AF0EM8_EPS1_GRVW2_GSU1_PGR1_SU0_SUS256_SRVW4_TT1_96_VAW2_WG64_4_1_WGM2
    SolutionIndex: 347
    SolutionNameMin: Cijk_Ailk_Bjlk_HBH_MT64x192x16_MI32x32x8x1_SE_AF0EM8_EPS1_GRVW2_GSU1_PGR1_SU0_SUS256_SRVW4_TT1_96_VAW2_WG64_4_1_WGM1
    SolutionIndex: 348
    SolutionNameMin: Cijk_Ailk_Bjlk_HBH_MT64x192x16_MI32x32x8x1_SE_AF0EM8_EPS1_GRVW2_GSU1_PGR1_SU32_SUS256_SRVW4_TT1_96_VAW2_WG64_4_1_WGM15
    SolutionIndex: 349
    SolutionNameMin: Cijk_Ailk_Bjlk_HBH_MT64x192x16_MI32x32x8x1_SE_AF0EM8_EPS1_GRVW4_GSU1_PGR1_SU32_SUS256_SRVW4_TT1_96_VAW2_WG64_4_1_WGM2
    SolutionIndex: 350
    SolutionNameMin: Cijk_Ailk_Bjlk_HBH_MT64x256x16_MI32x32x8x1_SE_AF0EM8_EPS0_GRVW2_GSU1_PGR2_SU0_SUS256_SRVW4_TT1_128_VAW2_WG64_4_1_WGM15
    SolutionIndex: 351
    SolutionNameMin: Cijk_Ailk_Bjlk_HBH_MT64x256x16_MI32x32x8x1_SE_AF0EM8_EPS0_GRVW2_GSU1_PGR2_SU32_SUS256_SRVW4_TT1_128_VAW2_WG64_4_1_WGM1
    SolutionIndex: 352
    SolutionNameMin: Cijk_Ailk_Bjlk_HBH_MT64x256x16_MI32x32x8x1_SE_AF0EM8_EPS0_GRVW4_GSU1_PGR2_SU32_SUS256_SRVW4_TT1_128_VAW2_WG64_4_1_WGM15
    SolutionIndex: 353
    SolutionNameMin: Cijk_Ailk_Bjlk_HBH_MT64x128x32_MI32x32x8x1_SE_AF0EM8_EPS0_GRVW2_GSU1_PGR2_SU0_SUS256_SRVW4_TT1_64_VAW2_WG64_4_1_WGM15
    SolutionIndex: 354
    SolutionNameMin: Cijk_Ailk_Bjlk_HBH_MT64x256x16_MI32x32x8x1_SE_AF0EM8_EPS0_GRVW8_GSU1_PGR2_SU32_SUS128_SRVW4_TT1_128_VAW2_WG64_4_1_WGM1
    SolutionIndex: 355
    SolutionNameMin: Cijk_Ailk_Bjlk_HBH_MT64x128x16_MI32x32x8x1_SE_AF0EM8_EPS0_GRVW8_GSU1_PGR2_SU32_SUS128_SRVW4_TT1_64_VAW2_WG64_4_1_WGM1
    SolutionIndex: 356
    SolutionNameMin: Cijk_Ailk_Bjlk_HBH_MT64x128x16_MI32x32x8x1_SE_AF0EM8_EPS0_GRVW4_GSU1_PGR2_SU32_SUS128_SRVW4_TT1_64_VAW2_WG64_4_1_WGM1
    SolutionIndex: 357
    SolutionNameMin: Cijk_Ailk_Bjlk_HBH_MT64x128x16_MI32x32x8x1_SE_AF0EM8_EPS0_GRVW4_GSU1_PGR2_SU0_SUS256_SRVW4_TT1_64_VAW2_WG64_4_1_WGM1
    SolutionIndex: 358
    SolutionNameMin: Cijk_Ailk_Bjlk_HBH_MT64x192x16_MI32x32x8x1_SE_AF0EM8_EPS1_GRVW4_GSU1_PGR1_SU0_SUS256_SRVW4_TT1_96_VAW2_WG64_4_1_WGM2
    SolutionIndex: 359
    SolutionNameMin: Cijk_Ailk_Bjlk_HBH_MT64x192x16_MI32x32x8x1_SE_AF0EM8_EPS1_GRVW4_GSU1_PGR1_SU0_SUS256_SRVW4_TT1_96_VAW2_WG64_4_1_WGM15
    SolutionIndex: 360
    SolutionNameMin: Cijk_Ailk_Bjlk_HBH_MT64x192x16_MI32x32x8x1_SE_AF0EM8_EPS1_GRVW4_GSU1_PGR1_SU32_SUS128_SRVW4_TT1_96_VAW2_WG64_4_1_WGM2
    SolutionIndex: 361
    SolutionNameMin: Cijk_Ailk_Bjlk_HBH_MT256x128x32_MI32x32x8x1_SE_AF0EM8_EPS1_GRVW8_GSU1_PGR1_SU32_SUS128_SRVW4_TT4_64_VAW2_WG64_4_1_WGM15
    SolutionIndex: 362
    SolutionNameMin: Cijk_Ailk_Bjlk_HBH_MT256x144x32_MI16x16x16x1_SE_AF0EM8_EPS0_GRVW2_GSU2_PGR2_SU0_SUS256_SRVW4_TT4_144_VAW1_WG64_4_1_WGM15
    SolutionIndex: 363
    SolutionNameMin: Cijk_Ailk_Bjlk_HBH_MT256x144x32_MI16x16x16x1_SE_AF0EM8_EPS0_GRVW2_GSU2_PGR2_SU0_SUS256_SRVW4_TT4_144_VAW1_WG64_4_1_WGM2
    SolutionIndex: 364
    SolutionNameMin: Cijk_Ailk_Bjlk_HBH_MT64x32x16_MI16x16x16x1_SE_AF0EM8_EPS1_GRVW2_GSU1_PGR1_SU32_SUS256_SRVW4_TT2_16_VAW2_WG32_8_1_WGM2
    SolutionIndex: 365
    SolutionNameMin: Cijk_Ailk_Bjlk_HBH_MT128x256x16_MI32x32x8x1_SE_AF0EM8_EPS0_GRVW8_GSU1_PGR2_SU32_SUS128_SRVW4_TT2_128_VAW2_WG64_4_1_WGM2
    SolutionIndex: 366
    SolutionNameMin: Cijk_Ailk_Bjlk_HBH_MT64x192x16_MI32x32x8x1_SE_AF0EM8_EPS0_GRVW4_GSU1_PGR2_SU0_SUS256_SRVW4_TT1_96_VAW2_WG64_4_1_WGM15
    SolutionIndex: 367
    SolutionNameMin: Cijk_Ailk_Bjlk_HBH_MT64x128x32_MI32x32x8x1_SE_AF0EM8_EPS0_GRVW4_GSU1_PGR2_SU32_SUS256_SRVW4_TT1_64_VAW2_WG64_4_1_WGM15
    SolutionIndex: 368
    SolutionNameMin: Cijk_Ailk_Bjlk_HBH_MT128x256x16_MI32x32x8x1_SE_AF0EM8_EPS0_GRVW8_GSU1_PGR2_SU32_SUS256_SRVW4_TT2_128_VAW2_WG64_4_1_WGM15
    SolutionIndex: 369
    SolutionNameMin: Cijk_Ailk_Bjlk_HBH_MT128x256x32_MI32x32x8x1_SE_AF0EM8_EPS1_GRVW2_GSU1_PGR1_SU0_SUS256_SRVW4_TT2_128_VAW2_WG64_4_1_WGM1
    SolutionIndex: 370
    SolutionNameMin: Cijk_Ailk_Bjlk_HBH_MT128x64x16_MI32x32x8x1_SE_AF0EM8_EPS0_GRVW4_GSU1_PGR2_SU0_SUS256_SRVW4_TT2_32_VAW2_WG64_4_1_WGM15
    SolutionIndex: 371
    SolutionNameMin: Cijk_Ailk_Bjlk_HBH_MT128x64x16_MI32x32x8x1_SE_AF0EM8_EPS0_GRVW8_GSU1_PGR2_SU0_SUS256_SRVW4_TT2_32_VAW2_WG64_4_1_WGM15
    SolutionIndex: 372
    SolutionNameMin: Cijk_Ailk_Bjlk_HBH_MT64x64x32_MI32x32x8x1_SE_AF0EM8_EPS0_GRVW2_GSU1_PGR2_SU32_SUS128_SRVW4_TT1_32_VAW2_WG64_4_1_WGM1
    SolutionIndex: 373
    SolutionNameMin: Cijk_Ailk_Bjlk_HBH_MT128x256x16_MI32x32x8x1_SE_AF0EM8_EPS0_GRVW8_GSU1_PGR2_SU32_SUS256_SRVW4_TT2_128_VAW2_WG64_4_1_WGM1
    SolutionIndex: 374
    SolutionNameMin: Cijk_Ailk_Bjlk_HBH_MT64x128x16_MI32x32x8x1_SE_AF0EM8_EPS0_GRVW2_GSU1_PGR2_SU32_SUS256_SRVW4_TT1_64_VAW2_WG64_4_1_WGM2
    SolutionIndex: 375
    SolutionNameMin: Cijk_Ailk_Bjlk_HBH_MT128x64x16_MI32x32x8x1_SE_AF0EM8_EPS0_GRVW2_GSU1_PGR2_SU32_SUS256_SRVW4_TT2_32_VAW2_WG64_4_1_WGM1
    SolutionIndex: 376
    SolutionNameMin: Cijk_Ailk_Bjlk_HBH_MT256x256x32_MI32x32x8x1_SE_AF0EM8_EPS1_GRVW8_GSU1_PGR1_SU0_SUS256_SRVW4_TT4_128_VAW2_WG64_4_1_WGM15
    SolutionIndex: 377
    SolutionNameMin: Cijk_Ailk_Bjlk_HBH_MT4x64x32_MI4x4x4x16_SE_AF0EM8_EPS0_GRVW2_GSU1_PGR2_SU0_SUS256_SRVW0_TT1_4_VAW2_WG4_16_1_WGM1
    SolutionIndex: 378
    SolutionNameMin: Cijk_Ailk_Bjlk_HBH_MT128x64x16_MI32x32x8x1_SE_AF0EM8_EPS0_GRVW2_GSU1_PGR2_SU32_SUS256_SRVW4_TT2_32_VAW2_WG64_4_1_WGM2
    SolutionIndex: 379
    SolutionNameMin: Cijk_Ailk_Bjlk_HBH_MT64x128x16_MI32x32x8x1_SE_AF0EM8_EPS0_GRVW2_GSU1_PGR2_SU0_SUS256_SRVW4_TT1_64_VAW2_WG64_4_1_WGM1
    SolutionIndex: 380
    SolutionNameMin: Cijk_Ailk_Bjlk_HBH_MT128x128x32_MI32x32x8x1_SE_AF0EM8_EPS0_GRVW2_GSU1_PGR2_SU32_SUS128_SRVW4_TT2_64_VAW2_WG64_4_1_WGM15
    SolutionIndex: 381
    SolutionNameMin: Cijk_Ailk_Bjlk_HBH_MT128x128x32_MI32x32x8x1_SE_AF0EM8_EPS0_GRVW2_GSU1_PGR2_SU0_SUS256_SRVW4_TT2_64_VAW2_WG64_4_1_WGM1
    SolutionIndex: 382
    SolutionNameMin: Cijk_Ailk_Bjlk_HBH_MT128x256x16_MI32x32x8x1_SE_AF0EM8_EPS0_GRVW2_GSU1_PGR2_SU0_SUS256_SRVW4_TT2_128_VAW2_WG64_4_1_WGM1
    SolutionIndex: 383
    SolutionNameMin: Cijk_Ailk_Bjlk_HBH_MT128x256x16_MI32x32x8x1_SE_AF0EM8_EPS0_GRVW2_GSU1_PGR2_SU0_SUS256_SRVW4_TT2_128_VAW2_WG64_4_1_WGM2
    SolutionIndex: 384
    SolutionNameMin: Cijk_Ailk_Bjlk_HBH_MT128x64x16_MI32x32x8x1_SE_AF0EM8_EPS0_GRVW2_GSU1_PGR2_SU0_SUS256_SRVW4_TT2_32_VAW2_WG64_4_1_WGM15
    SolutionIndex: 385
    SolutionNameMin: Cijk_Ailk_Bjlk_HBH_MT64x128x16_MI32x32x8x1_SE_AF0EM8_EPS0_GRVW8_GSU1_PGR2_SU32_SUS256_SRVW4_TT1_64_VAW2_WG64_4_1_WGM1
    SolutionIndex: 386
    SolutionNameMin: Cijk_Ailk_Bjlk_HBH_MT128x64x16_MI32x32x8x1_SE_AF0EM8_EPS0_GRVW8_GSU1_PGR2_SU32_SUS256_SRVW4_TT2_32_VAW2_WG64_4_1_WGM1
    SolutionIndex: 387
    SolutionNameMin: Cijk_Ailk_Bjlk_HBH_MT32x32x64_MI16x16x16x1_SE_AF0EM8_EPS0_GRVW2_GSU5_PGR2_SU0_SUS256_SRVW4_TT1_16_VAW1_WG32_8_1_WGM2
    SolutionIndex: 388
    SolutionNameMin: Cijk_Ailk_Bjlk_HBH_MT64x128x16_MI32x32x8x1_SE_AF0EM8_EPS1_GRVW4_GSU1_PGR1_SU32_SUS256_SRVW4_TT1_64_VAW2_WG64_4_1_WGM1
    SolutionIndex: 389
    SolutionNameMin: Cijk_Ailk_Bjlk_HBH_MT128x64x32_MI32x32x8x1_SE_AF0EM8_EPS1_GRVW8_GSU1_PGR1_SU0_SUS256_SRVW4_TT2_32_VAW2_WG64_4_1_WGM15
    SolutionIndex: 390
    SolutionNameMin: Cijk_Ailk_Bjlk_HBH_MT64x16x32_MI16x16x16x1_SE_AF0EM8_EPS0_GRVW8_GSU15_PGR2_SU32_SUS128_SRVW0_TT1_16_VAW1_WG64_4_1_WGM2
    SolutionIndex: 391
    SolutionNameMin: Cijk_Ailk_Bjlk_HBH_MT128x128x32_MI32x32x8x1_SE_AF0EM8_EPS0_GRVW8_GSU3_PGR2_SU0_SUS256_SRVW4_TT2_64_VAW1_WG64_4_1_WGM1
    SolutionIndex: 392
    SolutionNameMin: Cijk_Ailk_Bjlk_HBH_MT128x64x16_MI32x32x8x1_SE_AF0EM8_EPS0_GRVW8_GSU1_PGR2_SU32_SUS128_SRVW4_TT2_32_VAW2_WG64_4_1_WGM2
    SolutionIndex: 393
    SolutionNameMin: Cijk_Ailk_Bjlk_HBH_MT64x128x16_MI32x32x8x1_SE_AF0EM8_EPS1_GRVW4_GSU1_PGR1_SU32_SUS128_SRVW4_TT1_64_VAW2_WG64_4_1_WGM2
    SolutionIndex: 394
    SolutionNameMin: Cijk_Ailk_Bjlk_HBH_MT128x64x16_MI32x32x8x1_SE_AF0EM8_EPS1_GRVW4_GSU1_PGR1_SU0_SUS256_SRVW4_TT2_32_VAW2_WG64_4_1_WGM1
    SolutionIndex: 395
    SolutionNameMin: Cijk_Ailk_Bjlk_HBH_MT128x64x16_MI32x32x8x1_SE_AF0EM8_EPS1_GRVW8_GSU1_PGR1_SU0_SUS256_SRVW4_TT2_32_VAW2_WG64_4_1_WGM1
    SolutionIndex: 396
    SolutionNameMin: Cijk_Ailk_Bjlk_HBH_MT128x256x16_MI32x32x8x1_SE_AF0EM8_EPS0_GRVW8_GSU1_PGR2_SU0_SUS256_SRVW4_TT2_128_VAW2_WG64_4_1_WGM2
    SolutionIndex: 397
    SolutionNameMin: Cijk_Ailk_Bjlk_HBH_MT128x128x16_MI32x32x8x1_SE_AF0EM8_EPS0_GRVW8_GSU1_PGR2_SU32_SUS256_SRVW4_TT2_64_VAW2_WG64_4_1_WGM15
    SolutionIndex: 398
    SolutionNameMin: Cijk_Ailk_Bjlk_HBH_MT256x128x16_MI32x32x8x1_SE_AF0EM8_EPS0_GRVW8_GSU1_PGR2_SU0_SUS256_SRVW4_TT4_64_VAW2_WG64_4_1_WGM15
    SolutionIndex: 399
    SolutionNameMin: Cijk_Ailk_Bjlk_HBH_MT128x128x16_MI32x32x8x1_SE_AF0EM8_EPS0_GRVW8_GSU1_PGR2_SU32_SUS256_SRVW4_TT2_64_VAW2_WG64_4_1_WGM1
    SolutionIndex: 400
    SolutionNameMin: Cijk_Ailk_Bjlk_HBH_MT128x128x16_MI32x32x8x1_SE_AF0EM8_EPS0_GRVW8_GSU1_PGR2_SU0_SUS256_SRVW4_TT2_64_VAW2_WG64_4_1_WGM15
    SolutionIndex: 401
    SolutionNameMin: Cijk_Ailk_Bjlk_HBH_MT128x64x32_MI32x32x8x1_SE_AF0EM8_EPS0_GRVW8_GSU1_PGR2_SU0_SUS256_SRVW4_TT2_32_VAW2_WG64_4_1_WGM2
    SolutionIndex: 402
    SolutionNameMin: Cijk_Ailk_Bjlk_HBH_MT192x128x32_MI32x32x8x1_SE_AF0EM8_EPS0_GRVW8_GSU1_PGR2_SU0_SUS256_SRVW0_TT3_64_VAW2_WG64_4_1_WGM15
    SolutionIndex: 403
    SolutionNameMin: Cijk_Ailk_Bjlk_HBH_MT128x256x16_MI32x32x8x1_SE_AF0EM8_EPS0_GRVW2_GSU1_PGR2_SU0_SUS256_SRVW4_TT2_128_VAW2_WG64_4_1_WGM15
    SolutionIndex: 404
    SolutionNameMin: Cijk_Ailk_Bjlk_HBH_MT128x128x32_MI32x32x8x1_SE_AF0EM8_EPS0_GRVW8_GSU1_PGR2_SU32_SUS256_SRVW4_TT2_64_VAW2_WG64_4_1_WGM1
    SolutionIndex: 405
    SolutionNameMin: Cijk_Ailk_Bjlk_HBH_MT128x128x32_MI32x32x8x1_SE_AF0EM8_EPS1_GRVW8_GSU1_PGR1_SU32_SUS128_SRVW4_TT2_64_VAW2_WG64_4_1_WGM15
    SolutionIndex: 406
    SolutionNameMin: Cijk_Ailk_Bjlk_HBH_MT128x128x16_MI32x32x8x1_SE_AF0EM8_EPS0_GRVW4_GSU1_PGR2_SU0_SUS256_SRVW4_TT2_64_VAW2_WG64_4_1_WGM15
    SolutionIndex: 407
    SolutionNameMin: Cijk_Ailk_Bjlk_HBH_MT128x128x16_MI32x32x8x1_SE_AF0EM8_EPS0_GRVW2_GSU1_PGR2_SU32_SUS128_SRVW4_TT2_64_VAW2_WG64_4_1_WGM2
    SolutionIndex: 408
    SolutionNameMin: Cijk_Ailk_Bjlk_HBH_MT64x128x64_MI32x32x8x1_SE_AF0EM8_EPS0_GRVW8_GSU1_PGR2_SU0_SUS256_SRVW4_TT1_64_VAW2_WG64_4_1_WGM15
    SolutionIndex: 409
    SolutionNameMin: Cijk_Ailk_Bjlk_HBH_MT128x256x16_MI32x32x8x1_SE_AF0EM8_EPS0_GRVW4_GSU1_PGR2_SU32_SUS128_SRVW4_TT2_128_VAW2_WG64_4_1_WGM2
    SolutionIndex: 410
    SolutionNameMin: Cijk_Ailk_Bjlk_HBH_MT256x128x16_MI32x32x8x1_SE_AF0EM8_EPS0_GRVW4_GSU1_PGR2_SU0_SUS256_SRVW4_TT4_64_VAW2_WG64_4_1_WGM15
    SolutionIndex: 411
    SolutionNameMin: Cijk_Ailk_Bjlk_HBH_MT128x128x32_MI32x32x8x1_SE_AF0EM8_EPS1_GRVW4_GSU1_PGR1_SU0_SUS256_SRVW4_TT2_64_VAW2_WG64_4_1_WGM15
    SolutionIndex: 412
    SolutionNameMin: Cijk_Ailk_Bjlk_HBH_MT96x128x64_MI32x32x8x1_SE_AF0EM8_EPS0_GRVW8_GSU1_PGR2_SU0_SUS256_SRVW0_TT3_32_VAW2_WG32_8_1_WGM15
    SolutionIndex: 413
    SolutionNameMin: Cijk_Ailk_Bjlk_HBH_MT128x128x32_MI32x32x8x1_SE_AF0EM8_EPS0_GRVW8_GSU1_PGR2_SU32_SUS256_SRVW4_TT2_64_VAW2_WG64_4_1_WGM15
    SolutionIndex: 414
    SolutionNameMin: Cijk_Ailk_Bjlk_HBH_MT160x128x32_MI32x32x8x1_SE_AF0EM8_EPS0_GRVW4_GSU1_PGR2_SU0_SUS256_SRVW0_TT5_32_VAW2_WG32_8_1_WGM1
    SolutionIndex: 415
    SolutionNameMin: Cijk_Ailk_Bjlk_HBH_MT128x128x16_MI32x32x8x1_SE_AF0EM8_EPS0_GRVW4_GSU1_PGR2_SU0_SUS256_SRVW4_TT2_64_VAW2_WG64_4_1_WGM2
    SolutionIndex: 416
    SolutionNameMin: Cijk_Ailk_Bjlk_HBH_MT256x144x32_MI16x16x16x1_SE_AF0EM8_EPS0_GRVW2_GSU1_PGR2_SU0_SUS256_SRVW4_TT4_144_VAW2_WG64_4_1_WGM2
    SolutionIndex: 417
    SolutionNameMin: Cijk_Ailk_Bjlk_HBH_MT128x256x16_MI32x32x8x1_SE_AF0EM8_EPS0_GRVW8_GSU1_PGR2_SU32_SUS128_SRVW4_TT2_128_VAW2_WG64_4_1_WGM1
    SolutionIndex: 418
    SolutionNameMin: Cijk_Ailk_Bjlk_HBH_MT128x128x32_MI32x32x8x1_SE_AF0EM8_EPS0_GRVW8_GSU1_PGR2_SU32_SUS128_SRVW4_TT2_64_VAW2_WG64_4_1_WGM2
    SolutionIndex: 419
    SolutionNameMin: Cijk_Ailk_Bjlk_HBH_MT128x128x32_MI32x32x8x1_SE_AF0EM8_EPS0_GRVW8_GSU1_PGR2_SU32_SUS128_SRVW4_TT2_64_VAW2_WG64_4_1_WGM1
    SolutionIndex: 420
    SolutionNameMin: Cijk_Ailk_Bjlk_HBH_MT128x128x16_MI32x32x8x1_SE_AF0EM8_EPS0_GRVW8_GSU1_PGR2_SU0_SUS256_SRVW4_TT2_64_VAW2_WG64_4_1_WGM2
    SolutionIndex: 421
    SolutionNameMin: Cijk_Ailk_Bjlk_HBH_MT128x128x16_MI32x32x8x1_SE_AF0EM8_EPS0_GRVW8_GSU1_PGR2_SU32_SUS128_SRVW4_TT2_64_VAW2_WG64_4_1_WGM1
    SolutionIndex: 422
    SolutionNameMin: Cijk_Ailk_Bjlk_HBH_MT128x256x16_MI32x32x8x1_SE_AF0EM8_EPS0_GRVW2_GSU1_PGR2_SU32_SUS256_SRVW4_TT2_128_VAW2_WG64_4_1_WGM15
    SolutionIndex: 423
    SolutionNameMin: Cijk_Ailk_Bjlk_HBH_MT128x128x32_MI32x32x8x1_SE_AF0EM8_EPS0_GRVW4_GSU1_PGR2_SU32_SUS128_SRVW4_TT2_64_VAW2_WG64_4_1_WGM1
    SolutionIndex: 424
    SolutionNameMin: Cijk_Ailk_Bjlk_HBH_MT192x64x32_MI32x32x8x1_SE_AF0EM8_EPS0_GRVW8_GSU1_PGR2_SU0_SUS256_SRVW0_TT3_32_VAW2_WG64_4_1_WGM1
    SolutionIndex: 425
    SolutionNameMin: Cijk_Ailk_Bjlk_HBH_MT256x192x32_MI32x32x8x1_SE_AF0EM8_EPS1_GRVW8_GSU1_PGR1_SU32_SUS128_SRVW4_TT4_96_VAW2_WG64_4_1_WGM15
    SolutionIndex: 426
    SolutionNameMin: Cijk_Ailk_Bjlk_HBH_MT64x128x16_MI32x32x8x1_SE_AF0EM8_EPS0_GRVW8_GSU1_PGR2_SU32_SUS256_SRVW4_TT1_64_VAW2_WG64_4_1_WGM2
    SolutionIndex: 427
    SolutionNameMin: Cijk_Ailk_Bjlk_HBH_MT256x192x16_MI32x32x8x1_SE_AF0EM8_EPS0_GRVW4_GSU1_PGR2_SU0_SUS256_SRVW4_TT4_96_VAW2_WG64_4_1_WGM1
    SolutionIndex: 428
    SolutionNameMin: Cijk_Ailk_Bjlk_HBH_MT96x96x64_MI16x16x16x1_SE_AF0EM8_EPS0_GRVW8_GSU1_PGR2_SU0_SUS256_SRVW0_TT3_48_VAW2_WG32_8_1_WGM1
    SolutionIndex: 429
    SolutionNameMin: Cijk_Ailk_Bjlk_HBH_MT64x64x16_MI32x32x8x1_SE_AF0EM8_EPS1_GRVW2_GSU1_PGR1_SU32_SUS256_SRVW4_TT1_32_VAW2_WG64_4_1_WGM1
    SolutionIndex: 430
    SolutionNameMin: Cijk_Ailk_Bjlk_HBH_MT256x192x16_MI32x32x8x1_SE_AF0EM8_EPS0_GRVW4_GSU1_PGR2_SU32_SUS256_SRVW4_TT4_96_VAW2_WG64_4_1_WGM1
    SolutionIndex: 431
    SolutionNameMin: Cijk_Ailk_Bjlk_HBH_MT64x128x16_MI32x32x8x1_SE_AF0EM8_EPS0_GRVW2_GSU1_PGR2_SU32_SUS128_SRVW4_TT1_64_VAW2_WG64_4_1_WGM1
    SolutionIndex: 432
    SolutionNameMin: Cijk_Ailk_Bjlk_HBH_MT64x64x16_MI32x32x8x1_SE_AF0EM8_EPS0_GRVW2_GSU1_PGR2_SU0_SUS256_SRVW4_TT1_32_VAW2_WG64_4_1_WGM1
    SolutionIndex: 433
    SolutionNameMin: Cijk_Ailk_Bjlk_HBH_MT32x64x16_MI16x16x16x1_SE_AF0EM8_EPS0_GRVW2_GSU1_PGR2_SU0_SUS256_SRVW4_TT1_32_VAW2_WG32_8_1_WGM15
    SolutionIndex: 434
    SolutionNameMin: Cijk_Ailk_Bjlk_HBH_MT32x32x16_MI16x16x16x1_SE_AF0EM8_EPS1_GRVW2_GSU1_PGR1_SU0_SUS256_SRVW4_TT1_16_VAW2_WG32_8_1_WGM15
    SolutionIndex: 435
    SolutionNameMin: Cijk_Ailk_Bjlk_HBH_MT32x32x16_MI16x16x16x1_SE_AF0EM8_EPS0_GRVW4_GSU1_PGR2_SU0_SUS256_SRVW4_TT1_16_VAW2_WG32_8_1_WGM1
    SolutionIndex: 436
    SolutionNameMin: Cijk_Ailk_Bjlk_HBH_MT32x64x16_MI16x16x16x1_SE_AF0EM8_EPS1_GRVW2_GSU1_PGR1_SU0_SUS256_SRVW4_TT1_32_VAW2_WG32_8_1_WGM15
    SolutionIndex: 437
    SolutionNameMin: Cijk_Ailk_Bjlk_HBH_MT32x32x16_MI16x16x16x1_SE_AF0EM8_EPS1_GRVW8_GSU1_PGR1_SU32_SUS128_SRVW4_TT1_16_VAW2_WG32_8_1_WGM15
    SolutionIndex: 438
    SolutionNameMin: Cijk_Ailk_Bjlk_HBH_MT64x256x16_MI32x32x8x1_SE_AF0EM8_EPS0_GRVW8_GSU1_PGR2_SU32_SUS256_SRVW4_TT1_128_VAW2_WG64_4_1_WGM15
    SolutionIndex: 439
    SolutionNameMin: Cijk_Ailk_Bjlk_HBH_MT32x32x64_MI16x16x16x1_SE_AF0EM8_EPS0_GRVW4_GSU1_PGR2_SU32_SUS128_SRVW4_TT1_16_VAW2_WG32_8_1_WGM1
    SolutionIndex: 440
    SolutionNameMin: Cijk_Ailk_Bjlk_HBH_MT32x32x16_MI16x16x16x1_SE_AF0EM8_EPS0_GRVW2_GSU1_PGR2_SU32_SUS128_SRVW4_TT1_16_VAW2_WG32_8_1_WGM1
    SolutionIndex: 441
    SolutionNameMin: Cijk_Ailk_Bjlk_HBH_MT32x32x16_MI16x16x16x1_SE_AF0EM8_EPS1_GRVW4_GSU1_PGR1_SU0_SUS256_SRVW4_TT1_16_VAW2_WG32_8_1_WGM15
    SolutionIndex: 442
    SolutionNameMin: Cijk_Ailk_Bjlk_HBH_MT128x256x16_MI32x32x8x1_SE_AF0EM8_EPS1_GRVW4_GSU1_PGR1_SU0_SUS256_SRVW4_TT2_128_VAW2_WG64_4_1_WGM2
    SolutionIndex: 443
    SolutionNameMin: Cijk_Ailk_Bjlk_HBH_MT96x128x32_MI32x32x8x1_SE_AF0EM8_EPS0_GRVW4_GSU1_PGR2_SU32_SUS256_SRVW0_TT3_32_VAW2_WG32_8_1_WGM2
    SolutionIndex: 444
    SolutionNameMin: Cijk_Ailk_Bjlk_HBH_MT96x128x32_MI32x32x8x1_SE_AF0EM8_EPS0_GRVW4_GSU1_PGR2_SU0_SUS256_SRVW0_TT3_32_VAW2_WG32_8_1_WGM1
    SolutionIndex: 445
    SolutionNameMin: Cijk_Ailk_Bjlk_HBH_MT128x256x16_MI32x32x8x1_SE_AF0EM8_EPS0_GRVW4_GSU1_PGR2_SU32_SUS128_SRVW4_TT2_128_VAW2_WG64_4_1_WGM1
    SolutionIndex: 446
    SolutionNameMin: Cijk_Ailk_Bjlk_HBH_MT96x128x32_MI32x32x8x1_SE_AF0EM8_EPS0_GRVW2_GSU1_PGR2_SU0_SUS256_SRVW0_TT3_32_VAW2_WG32_8_1_WGM1
    SolutionIndex: 447
    SolutionNameMin: Cijk_Ailk_Bjlk_HBH_MT64x64x16_MI32x32x8x1_SE_AF0EM8_EPS0_GRVW2_GSU1_PGR2_SU32_SUS128_SRVW4_TT1_32_VAW2_WG64_4_1_WGM1
    SolutionIndex: 448
    SolutionNameMin: Cijk_Ailk_Bjlk_HBH_MT128x128x32_MI32x32x8x1_SE_AF0EM8_EPS0_GRVW2_GSU1_PGR2_SU32_SUS128_SRVW4_TT2_64_VAW2_WG64_4_1_WGM1
    SolutionIndex: 449
    SolutionNameMin: Cijk_Ailk_Bjlk_HBH_MT128x128x32_MI32x32x8x1_SE_AF0EM8_EPS0_GRVW4_GSU1_PGR2_SU32_SUS256_SRVW4_TT2_64_VAW2_WG64_4_1_WGM15
    SolutionIndex: 450
    SolutionNameMin: Cijk_Ailk_Bjlk_HBH_MT64x256x32_MI32x32x8x1_SE_AF0EM8_EPS0_GRVW4_GSU1_PGR2_SU32_SUS128_SRVW4_TT1_128_VAW2_WG64_4_1_WGM2
    SolutionIndex: 451
    SolutionNameMin: Cijk_Ailk_Bjlk_HBH_MT128x128x16_MI32x32x8x1_SE_AF0EM8_EPS0_GRVW2_GSU1_PGR2_SU32_SUS128_SRVW4_TT2_64_VAW2_WG64_4_1_WGM1
    SolutionIndex: 452
    SolutionNameMin: Cijk_Ailk_Bjlk_HBH_MT128x256x16_MI32x32x8x1_SE_AF0EM8_EPS1_GRVW4_GSU1_PGR1_SU32_SUS128_SRVW4_TT2_128_VAW2_WG64_4_1_WGM15
    SolutionIndex: 453
    SolutionNameMin: Cijk_Ailk_Bjlk_HBH_MT128x128x16_MI32x32x8x1_SE_AF0EM8_EPS1_GRVW2_GSU1_PGR1_SU32_SUS256_SRVW4_TT2_64_VAW2_WG64_4_1_WGM1
    SolutionIndex: 454
    SolutionNameMin: Cijk_Ailk_Bjlk_HBH_MT256x256x16_MI32x32x8x1_SE_AF0EM8_EPS0_GRVW8_GSU1_PGR2_SU0_SUS256_SRVW4_TT4_128_VAW2_WG64_4_1_WGM2
    SolutionIndex: 455
    SolutionNameMin: Cijk_Ailk_Bjlk_HBH_MT128x256x16_MI32x32x8x1_SE_AF0EM8_EPS1_GRVW8_GSU1_PGR1_SU32_SUS256_SRVW4_TT2_128_VAW2_WG64_4_1_WGM2
    SolutionIndex: 456
    SolutionNameMin: Cijk_Ailk_Bjlk_HBH_MT128x128x16_MI32x32x8x1_SE_AF0EM8_EPS0_GRVW2_GSU1_PGR2_SU0_SUS256_SRVW4_TT2_64_VAW2_WG64_4_1_WGM1
    SolutionIndex: 457
    SolutionNameMin: Cijk_Ailk_Bjlk_HBH_MT128x128x32_MI32x32x8x1_SE_AF0EM8_EPS0_GRVW4_GSU1_PGR2_SU0_SUS256_SRVW4_TT2_64_VAW2_WG64_4_1_WGM1
    SolutionIndex: 458
    SolutionNameMin: Cijk_Ailk_Bjlk_HBH_MT128x128x16_MI32x32x8x1_SE_AF0EM8_EPS0_GRVW2_GSU1_PGR2_SU32_SUS256_SRVW4_TT2_64_VAW2_WG64_4_1_WGM1
    SolutionIndex: 459
    SolutionNameMin: Cijk_Ailk_Bjlk_HBH_MT96x128x32_MI32x32x8x1_SE_AF0EM8_EPS0_GRVW4_GSU1_PGR2_SU32_SUS256_SRVW0_TT3_32_VAW2_WG32_8_1_WGM15
    SolutionIndex: 460
    SolutionNameMin: Cijk_Ailk_Bjlk_HBH_MT128x128x32_MI32x32x8x1_SE_AF0EM8_EPS0_GRVW4_GSU1_PGR2_SU32_SUS256_SRVW4_TT2_64_VAW2_WG64_4_1_WGM2
    SolutionIndex: 461
    SolutionNameMin: Cijk_Ailk_Bjlk_HBH_MT128x128x32_MI32x32x8x1_SE_AF0EM8_EPS0_GRVW8_GSU1_PGR2_SU32_SUS256_SRVW4_TT2_64_VAW2_WG64_4_1_WGM2
    SolutionIndex: 462
    SolutionNameMin: Cijk_Ailk_Bjlk_HBH_MT128x128x32_MI32x32x8x1_SE_AF0EM8_EPS0_GRVW2_GSU1_PGR2_SU32_SUS256_SRVW4_TT2_64_VAW2_WG64_4_1_WGM15
    SolutionIndex: 463
    SolutionNameMin: Cijk_Ailk_Bjlk_HBH_MT256x128x32_MI32x32x8x1_SE_AF0EM8_EPS1_GRVW4_GSU1_PGR1_SU0_SUS256_SRVW4_TT4_64_VAW2_WG64_4_1_WGM15
    SolutionIndex: 464
    SolutionNameMin: Cijk_Ailk_Bjlk_HBH_MT128x256x32_MI32x32x8x1_SE_AF0EM8_EPS1_GRVW8_GSU1_PGR1_SU32_SUS256_SRVW4_TT2_128_VAW2_WG64_4_1_WGM2
    SolutionIndex: 465
    SolutionNameMin: Cijk_Ailk_Bjlk_HBH_MT128x128x16_MI32x32x8x1_SE_AF0EM8_EPS0_GRVW4_GSU1_PGR2_SU0_SUS256_SRVW4_TT2_64_VAW2_WG64_4_1_WGM1
    SolutionIndex: 466
    SolutionNameMin: Cijk_Ailk_Bjlk_HBH_MT128x128x64_MI32x32x8x1_SE_AF0EM8_EPS0_GRVW4_GSU1_PGR2_SU0_SUS256_SRVW4_TT2_64_VAW2_WG64_4_1_WGM15
    SolutionIndex: 467
    SolutionNameMin: Cijk_Ailk_Bjlk_HBH_MT64x64x64_MI32x32x8x1_SE_AF0EM8_EPS0_GRVW8_GSU1_PGR2_SU0_SUS256_SRVW4_TT1_32_VAW2_WG64_4_1_WGM15
    SolutionIndex: 468
    SolutionNameMin: Cijk_Ailk_Bjlk_HBH_MT64x64x16_MI32x32x8x1_SE_AF0EM8_EPS0_GRVW2_GSU1_PGR2_SU32_SUS256_SRVW4_TT1_32_VAW2_WG64_4_1_WGM1
    SolutionIndex: 469
    SolutionNameMin: Cijk_Ailk_Bjlk_HBH_MT64x64x16_MI32x32x8x1_SE_AF0EM8_EPS0_GRVW4_GSU1_PGR2_SU32_SUS256_SRVW4_TT1_32_VAW2_WG64_4_1_WGM1
    SolutionIndex: 470
    SolutionNameMin: Cijk_Ailk_Bjlk_HBH_MT16x64x64_MI16x16x16x1_SE_AF0EM1_EPS0_GRVW8_GSU15_PGR2_SU32_SUS128_SRVW0_TT1_16_VAW1_WG16_16_1_WGM1
    SolutionIndex: 471
    SolutionNameMin: Cijk_Ailk_Bjlk_HBH_MT128x256x32_MI32x32x8x1_SE_AF0EM1_EPS0_GRVW8_GSU7_PGR2_SU0_SUS256_SRVW4_TT2_128_VAW1_WG64_4_1_WGM1
    SolutionIndex: 472
    SolutionNameMin: Cijk_Ailk_Bjlk_HBH_MT16x16x16_MI16x16x16x1_SE_AF0EM1_EPS1_GRVW4_GSU1_PGR1_SU0_SUS256_SRVW0_TT1_16_VAW2_WG16_4_1_WGM1
    SolutionIndex: 473
    SolutionNameMin: Cijk_Ailk_Bjlk_HBH_MT16x16x16_MI16x16x16x1_SE_AF0EM1_EPS1_GRVW2_GSU1_PGR1_SU32_SUS128_SRVW0_TT1_16_VAW2_WG16_4_1_WGM15
    SolutionIndex: 474
    SolutionNameMin: Cijk_Ailk_Bjlk_HBH_MT16x16x16_MI16x16x16x1_SE_AF0EM1_EPS0_GRVW2_GSU1_PGR2_SU32_SUS256_SRVW4_TT1_16_VAW2_WG16_4_1_WGM1
    SolutionIndex: 475
    SolutionNameMin: Cijk_Ailk_Bjlk_HBH_MT16x16x16_MI16x16x16x1_SE_AF0EM1_EPS1_GRVW2_GSU1_PGR1_SU0_SUS256_SRVW4_TT1_16_VAW2_WG16_4_1_WGM1
    SolutionIndex: 476
    SolutionNameMin: Cijk_Ailk_Bjlk_HBH_MT32x64x16_MI16x16x16x1_SE_AF0EM1_EPS1_GRVW2_GSU1_PGR1_SU0_SUS256_SRVW4_TT1_32_VAW2_WG32_8_1_WGM1
    SolutionIndex: 477
    SolutionNameMin: Cijk_Ailk_Bjlk_HBH_MT32x64x16_MI16x16x16x1_SE_AF0EM1_EPS0_GRVW8_GSU1_PGR2_SU32_SUS256_SRVW4_TT1_32_VAW2_WG32_8_1_WGM2
    SolutionIndex: 478
    SolutionNameMin: Cijk_Ailk_Bjlk_HBH_MT32x64x16_MI16x16x16x1_SE_AF0EM1_EPS0_GRVW4_GSU1_PGR2_SU32_SUS256_SRVW4_TT1_32_VAW2_WG32_8_1_WGM2
    SolutionIndex: 479
    SolutionNameMin: Cijk_Ailk_Bjlk_HBH_MT32x64x16_MI16x16x16x1_SE_AF0EM1_EPS1_GRVW2_GSU1_PGR1_SU32_SUS256_SRVW4_TT1_32_VAW2_WG32_8_1_WGM2
    SolutionIndex: 480
    SolutionNameMin: Cijk_Ailk_Bjlk_HBH_MT32x64x16_MI16x16x16x1_SE_AF0EM1_EPS1_GRVW2_GSU1_PGR1_SU32_SUS128_SRVW4_TT1_32_VAW2_WG32_8_1_WGM2
    SolutionIndex: 481
    SolutionNameMin: Cijk_Ailk_Bjlk_HBH_MT32x64x16_MI16x16x16x1_SE_AF0EM1_EPS1_GRVW2_GSU1_PGR1_SU0_SUS256_SRVW4_TT1_32_VAW2_WG32_8_1_WGM15
    SolutionIndex: 482
    SolutionNameMin: Cijk_Ailk_Bjlk_HBH_MT32x64x16_MI16x16x16x1_SE_AF0EM1_EPS0_GRVW2_GSU1_PGR2_SU0_SUS256_SRVW4_TT1_32_VAW2_WG32_8_1_WGM2
    SolutionIndex: 483
    SolutionNameMin: Cijk_Ailk_Bjlk_HBH_MT32x32x16_MI16x16x16x1_SE_AF0EM1_EPS1_GRVW2_GSU1_PGR1_SU32_SUS128_SRVW4_TT1_16_VAW2_WG32_8_1_WGM1
    SolutionIndex: 484
    SolutionNameMin: Cijk_Ailk_Bjlk_HBH_MT64x64x16_MI32x32x8x1_SE_AF0EM1_EPS0_GRVW2_GSU1_PGR2_SU32_SUS128_SRVW4_TT1_32_VAW2_WG64_4_1_WGM2
    SolutionIndex: 485
    SolutionNameMin: Cijk_Ailk_Bjlk_HBH_MT32x64x16_MI16x16x16x1_SE_AF0EM1_EPS0_GRVW8_GSU1_PGR2_SU0_SUS256_SRVW4_TT1_32_VAW2_WG32_8_1_WGM2
    SolutionIndex: 486
    SolutionNameMin: Cijk_Ailk_Bjlk_HBH_MT64x64x16_MI32x32x8x1_SE_AF0EM1_EPS1_GRVW2_GSU1_PGR1_SU32_SUS128_SRVW4_TT1_32_VAW2_WG64_4_1_WGM1
    SolutionIndex: 487
    SolutionNameMin: Cijk_Ailk_Bjlk_HBH_MT32x32x32_MI16x16x16x1_SE_AF0EM1_EPS0_GRVW8_GSU1_PGR2_SU0_SUS256_SRVW4_TT1_16_VAW2_WG32_8_1_WGM1
    SolutionIndex: 488
    SolutionNameMin: Cijk_Ailk_Bjlk_HBH_MT32x32x16_MI16x16x16x1_SE_AF0EM1_EPS1_GRVW2_GSU1_PGR1_SU0_SUS256_SRVW4_TT1_16_VAW2_WG32_8_1_WGM1
    SolutionIndex: 489
    SolutionNameMin: Cijk_Ailk_Bjlk_HBH_MT32x64x16_MI16x16x16x1_SE_AF0EM1_EPS0_GRVW2_GSU1_PGR2_SU32_SUS256_SRVW4_TT1_32_VAW2_WG32_8_1_WGM15
    SolutionIndex: 490
    SolutionNameMin: Cijk_Ailk_Bjlk_HBH_MT64x32x16_MI16x16x16x1_SE_AF0EM1_EPS0_GRVW2_GSU1_PGR2_SU0_SUS256_SRVW4_TT2_16_VAW2_WG32_8_1_WGM1
    SolutionIndex: 491
    SolutionNameMin: Cijk_Ailk_Bjlk_HBH_MT64x32x16_MI16x16x16x1_SE_AF0EM1_EPS1_GRVW2_GSU1_PGR1_SU0_SUS256_SRVW4_TT2_16_VAW2_WG32_8_1_WGM1
    SolutionIndex: 492
    SolutionNameMin: Cijk_Ailk_Bjlk_HBH_MT32x32x32_MI16x16x16x1_SE_AF0EM1_EPS0_GRVW4_GSU1_PGR2_SU0_SUS256_SRVW4_TT1_16_VAW2_WG32_8_1_WGM1
    SolutionIndex: 493
    SolutionNameMin: Cijk_Ailk_Bjlk_HBH_MT32x64x64_MI16x16x16x1_SE_AF0EM1_EPS0_GRVW8_GSU1_PGR2_SU0_SUS256_SRVW4_TT1_32_VAW2_WG32_8_1_WGM15
    SolutionIndex: 494
    SolutionNameMin: Cijk_Ailk_Bjlk_HBH_MT32x32x32_MI16x16x16x1_SE_AF0EM1_EPS0_GRVW8_GSU1_PGR2_SU0_SUS256_SRVW4_TT1_16_VAW2_WG32_8_1_WGM2
    SolutionIndex: 495
    SolutionNameMin: Cijk_Ailk_Bjlk_HBH_MT96x128x64_MI32x32x8x1_SE_AF0EM1_EPS0_GRVW8_GSU1_PGR2_SU32_SUS256_SRVW0_TT3_32_VAW2_WG32_8_1_WGM15
    SolutionIndex: 496
    SolutionNameMin: Cijk_Ailk_Bjlk_HBH_MT32x32x64_MI16x16x16x1_SE_AF0EM1_EPS0_GRVW8_GSU7_PGR2_SU32_SUS256_SRVW4_TT1_16_VAW1_WG32_8_1_WGM1
    SolutionIndex: 497
    SolutionNameMin: Cijk_Ailk_Bjlk_HBH_MT32x32x64_MI16x16x16x1_SE_AF0EM1_EPS0_GRVW8_GSU7_PGR2_SU0_SUS256_SRVW4_TT1_16_VAW1_WG32_8_1_WGM1
    SolutionIndex: 498
    SolutionNameMin: Cijk_Ailk_Bjlk_HBH_MT16x64x64_MI16x16x16x1_SE_AF0EM1_EPS0_GRVW8_GSU15_PGR2_SU32_SUS128_SRVW0_TT1_16_VAW1_WG16_16_1_WGM2
    SolutionIndex: 499
    SolutionNameMin: Cijk_Ailk_Bjlk_HBH_MT16x64x64_MI16x16x16x1_SE_AF0EM1_EPS0_GRVW8_GSU15_PGR2_SU32_SUS256_SRVW0_TT1_16_VAW1_WG16_16_1_WGM1
    SolutionIndex: 500
    SolutionNameMin: Cijk_Ailk_Bjlk_HBH_MT64x16x32_MI16x16x16x1_SE_AF0EM1_EPS0_GRVW8_GSU3_PGR2_SU32_SUS256_SRVW0_TT1_16_VAW1_WG64_4_1_WGM1
    SolutionIndex: 501
    SolutionNameMin: Cijk_Ailk_Bjlk_HBH_MT128x128x32_MI32x32x8x1_SE_AF0EM1_EPS0_GRVW4_GSU1_PGR2_SU0_SUS256_SRVW4_TT2_64_VAW2_WG64_4_1_WGM15
    SolutionIndex: 502
    SolutionNameMin: Cijk_Ailk_Bjlk_HBH_MT128x128x16_MI32x32x8x1_SE_AF0EM1_EPS0_GRVW8_GSU1_PGR2_SU0_SUS256_SRVW4_TT2_64_VAW2_WG64_4_1_WGM2
    SolutionIndex: 503
    SolutionNameMin: Cijk_Ailk_Bjlk_HBH_MT64x128x32_MI32x32x8x1_SE_AF0EM1_EPS0_GRVW4_GSU1_PGR2_SU0_SUS256_SRVW4_TT1_64_VAW2_WG64_4_1_WGM2
    SolutionIndex: 504
    SolutionNameMin: Cijk_Ailk_Bjlk_HBH_MT64x128x32_MI32x32x8x1_SE_AF0EM1_EPS0_GRVW2_GSU1_PGR2_SU32_SUS256_SRVW4_TT1_64_VAW2_WG64_4_1_WGM1
    SolutionIndex: 505
    SolutionNameMin: Cijk_Ailk_Bjlk_HBH_MT128x128x32_MI32x32x8x1_SE_AF0EM1_EPS0_GRVW8_GSU1_PGR2_SU0_SUS256_SRVW4_TT2_64_VAW2_WG64_4_1_WGM15
    SolutionIndex: 506
    SolutionNameMin: Cijk_Ailk_Bjlk_HBH_MT128x128x16_MI32x32x8x1_SE_AF0EM1_EPS0_GRVW4_GSU1_PGR2_SU0_SUS256_SRVW4_TT2_64_VAW2_WG64_4_1_WGM2
    SolutionIndex: 507
    SolutionNameMin: Cijk_Ailk_Bjlk_HBH_MT128x128x32_MI32x32x8x1_SE_AF0EM1_EPS0_GRVW4_GSU1_PGR2_SU0_SUS256_SRVW4_TT2_64_VAW2_WG64_4_1_WGM2
    SolutionIndex: 508
    SolutionNameMin: Cijk_Ailk_Bjlk_HBH_MT64x128x16_MI32x32x8x1_SE_AF0EM1_EPS0_GRVW8_GSU1_PGR2_SU32_SUS128_SRVW4_TT1_64_VAW2_WG64_4_1_WGM2
    SolutionIndex: 509
    SolutionNameMin: Cijk_Ailk_Bjlk_HBH_MT64x192x32_MI32x32x8x1_SE_AF0EM1_EPS0_GRVW4_GSU1_PGR2_SU0_SUS256_SRVW4_TT1_96_VAW2_WG64_4_1_WGM2
    SolutionIndex: 510
    SolutionNameMin: Cijk_Ailk_Bjlk_HBH_MT64x256x16_MI32x32x8x1_SE_AF0EM1_EPS0_GRVW8_GSU1_PGR2_SU0_SUS256_SRVW4_TT1_128_VAW2_WG64_4_1_WGM1
    SolutionIndex: 511
    SolutionNameMin: Cijk_Ailk_Bjlk_HBH_MT128x96x32_MI32x32x8x1_SE_AF0EM1_EPS0_GRVW2_GSU1_PGR2_SU0_SUS256_SRVW4_TT1_96_VAW2_WG128_2_1_WGM2
    SolutionIndex: 512
    SolutionNameMin: Cijk_Ailk_Bjlk_HBH_MT64x192x16_MI32x32x8x1_SE_AF0EM1_EPS1_GRVW4_GSU1_PGR1_SU32_SUS128_SRVW4_TT1_96_VAW2_WG64_4_1_WGM15
    SolutionIndex: 513
    SolutionNameMin: Cijk_Ailk_Bjlk_HBH_MT64x192x32_MI32x32x8x1_SE_AF0EM1_EPS0_GRVW8_GSU1_PGR2_SU0_SUS256_SRVW4_TT1_96_VAW2_WG64_4_1_WGM1
    SolutionIndex: 514
    SolutionNameMin: Cijk_Ailk_Bjlk_HBH_MT128x128x16_MI32x32x8x1_SE_AF0EM1_EPS0_GRVW8_GSU1_PGR2_SU0_SUS256_SRVW4_TT2_64_VAW2_WG64_4_1_WGM15
    SolutionIndex: 515
    SolutionNameMin: Cijk_Ailk_Bjlk_HBH_MT64x192x16_MI32x32x8x1_SE_AF0EM1_EPS0_GRVW2_GSU1_PGR2_SU0_SUS256_SRVW4_TT1_96_VAW2_WG64_4_1_WGM1
    SolutionIndex: 516
    SolutionNameMin: Cijk_Ailk_Bjlk_HBH_MT64x128x16_MI32x32x8x1_SE_AF0EM1_EPS0_GRVW4_GSU1_PGR2_SU0_SUS256_SRVW4_TT1_64_VAW2_WG64_4_1_WGM15
    SolutionIndex: 517
    SolutionNameMin: Cijk_Ailk_Bjlk_HBH_MT64x64x16_MI32x32x8x1_SE_AF0EM1_EPS0_GRVW2_GSU1_PGR2_SU32_SUS128_SRVW4_TT1_32_VAW2_WG64_4_1_WGM15
    SolutionIndex: 518
    SolutionNameMin: Cijk_Ailk_Bjlk_HBH_MT64x192x16_MI32x32x8x1_SE_AF0EM1_EPS1_GRVW2_GSU1_PGR1_SU0_SUS256_SRVW4_TT1_96_VAW2_WG64_4_1_WGM2
    SolutionIndex: 519
    SolutionNameMin: Cijk_Ailk_Bjlk_HBH_MT64x128x16_MI32x32x8x1_SE_AF0EM1_EPS0_GRVW8_GSU1_PGR2_SU0_SUS256_SRVW4_TT1_64_VAW2_WG64_4_1_WGM1
    SolutionIndex: 520
    SolutionNameMin: Cijk_Ailk_Bjlk_HBH_MT128x128x16_MI32x32x8x1_SE_AF0EM1_EPS1_GRVW2_GSU1_PGR1_SU0_SUS256_SRVW4_TT2_64_VAW2_WG64_4_1_WGM2
    SolutionIndex: 521
    SolutionNameMin: Cijk_Ailk_Bjlk_HBH_MT128x96x16_MI32x32x8x1_SE_AF0EM1_EPS1_GRVW2_GSU1_PGR1_SU32_SUS256_SRVW4_TT1_96_VAW2_WG128_2_1_WGM15
    SolutionIndex: 522
    SolutionNameMin: Cijk_Ailk_Bjlk_HBH_MT128x96x16_MI32x32x8x1_SE_AF0EM1_EPS1_GRVW2_GSU1_PGR1_SU0_SUS256_SRVW4_TT1_96_VAW2_WG128_2_1_WGM15
    SolutionIndex: 523
    SolutionNameMin: Cijk_Ailk_Bjlk_HBH_MT128x64x16_MI32x32x8x1_SE_AF0EM1_EPS0_GRVW2_GSU1_PGR2_SU32_SUS256_SRVW4_TT2_32_VAW2_WG64_4_1_WGM2
    SolutionIndex: 524
    SolutionNameMin: Cijk_Ailk_Bjlk_HBH_MT128x128x16_MI32x32x8x1_SE_AF0EM1_EPS0_GRVW8_GSU1_PGR2_SU32_SUS256_SRVW4_TT2_64_VAW2_WG64_4_1_WGM1
    SolutionIndex: 525
    SolutionNameMin: Cijk_Ailk_Bjlk_HBH_MT128x256x16_MI32x32x8x1_SE_AF0EM1_EPS0_GRVW8_GSU1_PGR2_SU32_SUS256_SRVW4_TT2_128_VAW2_WG64_4_1_WGM1
    SolutionIndex: 526
    SolutionNameMin: Cijk_Ailk_Bjlk_HBH_MT128x256x16_MI32x32x8x1_SE_AF0EM1_EPS0_GRVW8_GSU1_PGR2_SU32_SUS256_SRVW4_TT2_128_VAW2_WG64_4_1_WGM2
    SolutionIndex: 527
    SolutionNameMin: Cijk_Ailk_Bjlk_HBH_MT64x64x32_MI32x32x8x1_SE_AF0EM1_EPS0_GRVW8_GSU1_PGR2_SU0_SUS256_SRVW4_TT1_32_VAW2_WG64_4_1_WGM1
    SolutionIndex: 528
    SolutionNameMin: Cijk_Ailk_Bjlk_HBH_MT64x64x16_MI32x32x8x1_SE_AF0EM1_EPS1_GRVW8_GSU1_PGR1_SU0_SUS256_SRVW4_TT1_32_VAW2_WG64_4_1_WGM1
    SolutionIndex: 529
    SolutionNameMin: Cijk_Ailk_Bjlk_HBH_MT128x64x16_MI32x32x8x1_SE_AF0EM1_EPS0_GRVW8_GSU1_PGR2_SU0_SUS256_SRVW4_TT2_32_VAW2_WG64_4_1_WGM2
    SolutionIndex: 530
    SolutionNameMin: Cijk_Ailk_Bjlk_HBH_MT64x128x16_MI32x32x8x1_SE_AF0EM1_EPS1_GRVW8_GSU1_PGR1_SU32_SUS128_SRVW4_TT1_64_VAW2_WG64_4_1_WGM2
    SolutionIndex: 531
    SolutionNameMin: Cijk_Ailk_Bjlk_HBH_MT64x128x16_MI32x32x8x1_SE_AF0EM1_EPS0_GRVW8_GSU1_PGR2_SU32_SUS128_SRVW4_TT1_64_VAW2_WG64_4_1_WGM1
    SolutionIndex: 532
    SolutionNameMin: Cijk_Ailk_Bjlk_HBH_MT128x96x16_MI32x32x8x1_SE_AF0EM1_EPS0_GRVW2_GSU1_PGR2_SU0_SUS256_SRVW4_TT1_96_VAW2_WG128_2_1_WGM1
    SolutionIndex: 533
    SolutionNameMin: Cijk_Ailk_Bjlk_HBH_MT128x128x16_MI32x32x8x1_SE_AF0EM1_EPS0_GRVW2_GSU1_PGR2_SU0_SUS256_SRVW4_TT2_64_VAW2_WG64_4_1_WGM1
    SolutionIndex: 534
    SolutionNameMin: Cijk_Ailk_Bjlk_HBH_MT128x128x16_MI32x32x8x1_SE_AF0EM1_EPS0_GRVW8_GSU1_PGR2_SU0_SUS256_SRVW4_TT2_64_VAW2_WG64_4_1_WGM1
    SolutionIndex: 535
    SolutionNameMin: Cijk_Ailk_Bjlk_HBH_MT128x128x16_MI32x32x8x1_SE_AF0EM1_EPS0_GRVW8_GSU1_PGR2_SU32_SUS256_SRVW4_TT2_64_VAW2_WG64_4_1_WGM2
    SolutionIndex: 536
    SolutionNameMin: Cijk_Ailk_Bjlk_HBH_MT64x64x32_MI32x32x8x1_SE_AF0EM1_EPS0_GRVW4_GSU1_PGR2_SU0_SUS256_SRVW4_TT1_32_VAW2_WG64_4_1_WGM1
    SolutionIndex: 537
    SolutionNameMin: Cijk_Ailk_Bjlk_HBH_MT32x64x64_MI16x16x16x1_SE_AF0EM1_EPS0_GRVW8_GSU1_PGR2_SU32_SUS128_SRVW4_TT1_32_VAW2_WG32_8_1_WGM2
    SolutionIndex: 538
    SolutionNameMin: Cijk_Ailk_Bjlk_HBH_MT128x256x16_MI32x32x8x1_SE_AF0EM1_EPS1_GRVW8_GSU1_PGR1_SU0_SUS256_SRVW4_TT2_128_VAW2_WG64_4_1_WGM2
    SolutionIndex: 539
    SolutionNameMin: Cijk_Ailk_Bjlk_HBH_MT128x256x16_MI32x32x8x1_SE_AF0EM1_EPS1_GRVW8_GSU1_PGR1_SU0_SUS256_SRVW4_TT2_128_VAW2_WG64_4_1_WGM2
    SolutionIndex: 540
    SolutionNameMin: Cijk_Ailk_Bjlk_HBH_MT128x128x32_MI32x32x8x1_SE_AF0EM1_EPS0_GRVW8_GSU1_PGR2_SU0_SUS256_SRVW4_TT2_64_VAW2_WG64_4_1_WGM2
    SolutionIndex: 541
    SolutionNameMin: Cijk_Ailk_Bjlk_HBH_MT64x128x32_MI32x32x8x1_SE_AF0EM1_EPS0_GRVW2_GSU1_PGR2_SU0_SUS256_SRVW4_TT1_64_VAW2_WG64_4_1_WGM15
    SolutionIndex: 542
    SolutionNameMin: Cijk_Ailk_Bjlk_HBH_MT64x128x32_MI32x32x8x1_SE_AF0EM1_EPS0_GRVW2_GSU1_PGR2_SU0_SUS256_SRVW4_TT1_64_VAW2_WG64_4_1_WGM1
    SolutionIndex: 543
    SolutionNameMin: Cijk_Ailk_Bjlk_HBH_MT64x128x32_MI32x32x8x1_SE_AF0EM1_EPS0_GRVW4_GSU1_PGR2_SU0_SUS256_SRVW4_TT1_64_VAW2_WG64_4_1_WGM15
    SolutionIndex: 544
    SolutionNameMin: Cijk_Ailk_Bjlk_HBH_MT128x256x16_MI32x32x8x1_SE_AF0EM1_EPS0_GRVW8_GSU1_PGR2_SU0_SUS256_SRVW4_TT2_128_VAW2_WG64_4_1_WGM2
    SolutionIndex: 545
    SolutionNameMin: Cijk_Ailk_Bjlk_HBH_MT128x256x16_MI32x32x8x1_SE_AF0EM1_EPS0_GRVW8_GSU1_PGR2_SU0_SUS256_SRVW4_TT2_128_VAW2_WG64_4_1_WGM15
    SolutionIndex: 546
    SolutionNameMin: Cijk_Ailk_Bjlk_HBH_MT256x144x32_MI16x16x16x1_SE_AF0EM1_EPS0_GRVW2_GSU1_PGR2_SU0_SUS256_SRVW4_TT4_144_VAW2_WG64_4_1_WGM1
    SolutionIndex: 547
    SolutionNameMin: Cijk_Ailk_Bjlk_HBH_MT128x128x32_MI32x32x8x1_SE_AF0EM1_EPS0_GRVW8_GSU1_PGR2_SU32_SUS128_SRVW4_TT2_64_VAW2_WG64_4_1_WGM1
    SolutionIndex: 548
    SolutionNameMin: Cijk_Ailk_Bjlk_HBH_MT128x128x32_MI32x32x8x1_SE_AF0EM1_EPS0_GRVW8_GSU1_PGR2_SU0_SUS256_SRVW4_TT2_64_VAW2_WG64_4_1_WGM1
    SolutionIndex: 549
    SolutionNameMin: Cijk_Ailk_Bjlk_HBH_MT128x128x32_MI32x32x8x1_SE_AF0EM1_EPS0_GRVW2_GSU1_PGR2_SU32_SUS128_SRVW4_TT2_64_VAW2_WG64_4_1_WGM15
    SolutionIndex: 550
    SolutionNameMin: Cijk_Ailk_Bjlk_HBH_MT128x64x64_MI32x32x8x1_SE_AF0EM1_EPS0_GRVW8_GSU1_PGR2_SU32_SUS256_SRVW4_TT2_32_VAW2_WG64_4_1_WGM15
    SolutionIndex: 551
    SolutionNameMin: Cijk_Ailk_Bjlk_HBH_MT128x128x32_MI32x32x8x1_SE_AF0EM1_EPS1_GRVW8_GSU1_PGR1_SU0_SUS256_SRVW4_TT2_64_VAW2_WG64_4_1_WGM2
    SolutionIndex: 552
    SolutionNameMin: Cijk_Ailk_Bjlk_HBH_MT64x128x64_MI32x32x8x1_SE_AF0EM1_EPS0_GRVW4_GSU1_PGR2_SU0_SUS256_SRVW4_TT1_64_VAW2_WG64_4_1_WGM15
    SolutionIndex: 553
    SolutionNameMin: Cijk_Ailk_Bjlk_HBH_MT128x64x64_MI32x32x8x1_SE_AF0EM1_EPS0_GRVW2_GSU1_PGR2_SU0_SUS256_SRVW4_TT2_32_VAW2_WG64_4_1_WGM15
    SolutionIndex: 554
    SolutionNameMin: Cijk_Ailk_Bjlk_HBH_MT128x128x32_MI32x32x8x1_SE_AF0EM1_EPS0_GRVW2_GSU1_PGR2_SU32_SUS256_SRVW4_TT2_64_VAW2_WG64_4_1_WGM2
    SolutionIndex: 555
    SolutionNameMin: Cijk_Ailk_Bjlk_HBH_MT128x64x32_MI32x32x8x1_SE_AF0EM1_EPS0_GRVW4_GSU1_PGR2_SU0_SUS256_SRVW4_TT2_32_VAW2_WG64_4_1_WGM15
    SolutionIndex: 556
    SolutionNameMin: Cijk_Ailk_Bjlk_HBH_MT128x128x32_MI32x32x8x1_SE_AF0EM1_EPS0_GRVW4_GSU1_PGR2_SU0_SUS256_SRVW4_TT2_64_VAW2_WG64_4_1_WGM1
    SolutionIndex: 557
    SolutionNameMin: Cijk_Ailk_Bjlk_HBH_MT128x128x32_MI32x32x8x1_SE_AF0EM1_EPS0_GRVW8_GSU1_PGR2_SU32_SUS128_SRVW4_TT2_64_VAW2_WG64_4_1_WGM15
    SolutionIndex: 558
    SolutionNameMin: Cijk_Ailk_Bjlk_HBH_MT128x64x32_MI32x32x8x1_SE_AF0EM1_EPS0_GRVW8_GSU1_PGR2_SU32_SUS256_SRVW4_TT2_32_VAW2_WG64_4_1_WGM1
    SolutionIndex: 559
    SolutionNameMin: Cijk_Ailk_Bjlk_HBH_MT32x32x16_MI16x16x16x1_SE_AF0EM1_EPS0_GRVW8_GSU1_PGR2_SU32_SUS128_SRVW4_TT1_16_VAW2_WG32_8_1_WGM1
    SolutionIndex: 560
    SolutionNameMin: Cijk_Ailk_Bjlk_HBH_MT32x32x16_MI16x16x16x1_SE_AF0EM1_EPS0_GRVW4_GSU1_PGR2_SU0_SUS256_SRVW4_TT1_16_VAW2_WG32_8_1_WGM2
    SolutionIndex: 561
    SolutionNameMin: Cijk_Ailk_Bjlk_HBH_MT32x32x16_MI16x16x16x1_SE_AF0EM1_EPS0_GRVW2_GSU1_PGR2_SU0_SUS256_SRVW4_TT1_16_VAW2_WG32_8_1_WGM2
    SolutionIndex: 562
    SolutionNameMin: Cijk_Ailk_Bjlk_HBH_MT32x32x16_MI16x16x16x1_SE_AF0EM1_EPS1_GRVW8_GSU1_PGR1_SU0_SUS256_SRVW4_TT1_16_VAW2_WG32_8_1_WGM1
    SolutionIndex: 563
    SolutionNameMin: Cijk_Ailk_Bjlk_HBH_MT32x32x16_MI16x16x16x1_SE_AF0EM1_EPS1_GRVW4_GSU1_PGR1_SU0_SUS256_SRVW4_TT1_16_VAW2_WG32_8_1_WGM1
    SolutionIndex: 564
    SolutionNameMin: Cijk_Ailk_Bjlk_HBH_MT32x32x16_MI16x16x16x1_SE_AF0EM1_EPS1_GRVW2_GSU1_PGR1_SU0_SUS256_SRVW4_TT1_16_VAW2_WG32_8_1_WGM15
    SolutionIndex: 565
    SolutionNameMin: Cijk_Ailk_Bjlk_HBH_MT32x32x16_MI16x16x16x1_SE_AF0EM1_EPS0_GRVW2_GSU1_PGR2_SU0_SUS256_SRVW4_TT1_16_VAW2_WG32_8_1_WGM1
    SolutionIndex: 566
    SolutionNameMin: Cijk_Ailk_Bjlk_HBH_MT128x128x64_MI32x32x8x1_SE_AF0EM1_EPS0_GRVW4_GSU1_PGR2_SU32_SUS256_SRVW4_TT2_64_VAW2_WG64_4_1_WGM2
    SolutionIndex: 567
    SolutionNameMin: Cijk_Ailk_Bjlk_HBH_MT128x128x32_MI32x32x8x1_SE_AF0EM1_EPS0_GRVW8_GSU1_PGR2_SU32_SUS256_SRVW4_TT2_64_VAW2_WG64_4_1_WGM1
    SolutionIndex: 568
    SolutionNameMin: Cijk_Ailk_Bjlk_HBH_MT128x128x32_MI32x32x8x1_SE_AF0EM1_EPS0_GRVW4_GSU1_PGR2_SU32_SUS256_SRVW4_TT2_64_VAW2_WG64_4_1_WGM15
    SolutionIndex: 569
    SolutionNameMin: Cijk_Ailk_Bjlk_HBH_MT64x32x16_MI16x16x16x1_SE_AF0EM1_EPS1_GRVW2_GSU1_PGR1_SU32_SUS256_SRVW4_TT2_16_VAW2_WG32_8_1_WGM15
    SolutionIndex: 570
    SolutionNameMin: Cijk_Ailk_Bjlk_HBH_MT32x32x16_MI16x16x16x1_SE_AF0EM1_EPS0_GRVW4_GSU1_PGR2_SU0_SUS256_SRVW4_TT1_16_VAW2_WG32_8_1_WGM15
    SolutionIndex: 571
    SolutionNameMin: Cijk_Ailk_Bjlk_HBH_MT32x32x16_MI16x16x16x1_SE_AF0EM1_EPS0_GRVW8_GSU1_PGR2_SU0_SUS256_SRVW4_TT1_16_VAW2_WG32_8_1_WGM1
    SolutionIndex: 572
    SolutionNameMin: Cijk_Ailk_Bjlk_HBH_MT32x32x16_MI16x16x16x1_SE_AF0EM1_EPS0_GRVW4_GSU1_PGR2_SU0_SUS256_SRVW4_TT1_16_VAW2_WG32_8_1_WGM1
    SolutionIndex: 573
    SolutionNameMin: Cijk_Ailk_Bjlk_HBH_MT128x128x16_MI32x32x8x1_SE_AF0EM1_EPS0_GRVW8_GSU1_PGR2_SU32_SUS128_SRVW4_TT2_64_VAW2_WG64_4_1_WGM1
    SolutionIndex: 574
    SolutionNameMin: Cijk_Ailk_Bjlk_HBH_MT64x128x32_MI32x32x8x1_SE_AF0EM1_EPS0_GRVW8_GSU1_PGR2_SU32_SUS256_SRVW4_TT1_64_VAW2_WG64_4_1_WGM15
    SolutionIndex: 575
    SolutionNameMin: Cijk_Ailk_Bjlk_HBH_MT128x128x32_MI32x32x8x1_SE_AF0EM1_EPS1_GRVW2_GSU1_PGR1_SU0_SUS256_SRVW4_TT2_64_VAW2_WG64_4_1_WGM1
    SolutionIndex: 576
    SolutionNameMin: Cijk_Ailk_Bjlk_HBH_MT128x128x32_MI32x32x8x1_SE_AF0EM1_EPS1_GRVW8_GSU1_PGR1_SU32_SUS128_SRVW4_TT2_64_VAW2_WG64_4_1_WGM1
    SolutionIndex: 577
    SolutionNameMin: Cijk_Ailk_Bjlk_HBH_MT128x64x16_MI32x32x8x1_SE_AF0EM1_EPS0_GRVW4_GSU1_PGR2_SU32_SUS256_SRVW4_TT2_32_VAW2_WG64_4_1_WGM15
    SolutionIndex: 578
    SolutionNameMin: Cijk_Ailk_Bjlk_HBH_MT128x256x16_MI32x32x8x1_SE_AF0EM1_EPS0_GRVW8_GSU1_PGR2_SU0_SUS256_SRVW4_TT2_128_VAW2_WG64_4_1_WGM1
    SolutionIndex: 579
    SolutionNameMin: Cijk_Ailk_Bjlk_HBH_MT96x128x32_MI32x32x8x1_SE_AF0EM1_EPS0_GRVW4_GSU1_PGR2_SU0_SUS256_SRVW0_TT3_32_VAW2_WG32_8_1_WGM1
    SolutionIndex: 580
    SolutionNameMin: Cijk_Ailk_Bjlk_HBH_MT256x64x32_MI32x32x8x1_SE_AF0EM1_EPS0_GRVW8_GSU1_PGR2_SU0_SUS256_SRVW4_TT4_32_VAW2_WG64_4_1_WGM1
    SolutionIndex: 581
    SolutionNameMin: Cijk_Ailk_Bjlk_HBH_MT128x128x32_MI32x32x8x1_SE_AF0EM1_EPS0_GRVW2_GSU1_PGR2_SU0_SUS256_SRVW4_TT2_64_VAW2_WG64_4_1_WGM1
    SolutionIndex: 582
    SolutionNameMin: Cijk_Ailk_Bjlk_HBH_MT128x256x16_MI32x32x8x1_SE_AF0EM1_EPS0_GRVW8_GSU1_PGR2_SU0_SUS256_SRVW4_TT2_128_VAW2_WG64_4_1_WGM15
    SolutionIndex: 583
    SolutionNameMin: Cijk_Ailk_Bjlk_HBH_MT128x128x32_MI32x32x8x1_SE_AF0EM1_EPS0_GRVW8_GSU1_PGR2_SU32_SUS256_SRVW4_TT2_64_VAW2_WG64_4_1_WGM2
    SolutionIndex: 584
    SolutionNameMin: Cijk_Ailk_Bjlk_HBH_MT128x128x32_MI32x32x8x1_SE_AF0EM1_EPS0_GRVW4_GSU1_PGR2_SU32_SUS128_SRVW4_TT2_64_VAW2_WG64_4_1_WGM1
    SolutionIndex: 585
    SolutionNameMin: Cijk_Ailk_Bjlk_HBH_MT128x64x16_MI32x32x8x1_SE_AF0EM1_EPS0_GRVW4_GSU1_PGR2_SU0_SUS256_SRVW4_TT2_32_VAW2_WG64_4_1_WGM2
    SolutionIndex: 586
    SolutionNameMin: Cijk_Ailk_Bjlk_HBH_MT128x64x16_MI32x32x8x1_SE_AF0EM1_EPS0_GRVW4_GSU1_PGR2_SU0_SUS256_SRVW4_TT2_32_VAW2_WG64_4_1_WGM15
    SolutionIndex: 587
    SolutionNameMin: Cijk_Ailk_Bjlk_HBH_MT128x128x64_MI32x32x8x1_SE_AF0EM1_EPS0_GRVW8_GSU1_PGR2_SU32_SUS256_SRVW4_TT2_64_VAW2_WG64_4_1_WGM15
    SolutionIndex: 588
    SolutionNameMin: Cijk_Ailk_Bjlk_HBH_MT64x256x16_MI32x32x8x1_SE_AF0EM1_EPS0_GRVW8_GSU1_PGR2_SU32_SUS256_SRVW4_TT1_128_VAW2_WG64_4_1_WGM15
    SolutionIndex: 589
    SolutionNameMin: Cijk_Ailk_Bjlk_HBH_MT64x64x16_MI32x32x8x1_SE_AF0EM1_EPS0_GRVW2_GSU1_PGR2_SU32_SUS256_SRVW4_TT1_32_VAW2_WG64_4_1_WGM15
    SolutionIndex: 590
    SolutionNameMin: Cijk_Ailk_Bjlk_HBH_MT32x64x32_MI16x16x16x1_SE_AF0EM1_EPS0_GRVW2_GSU1_PGR2_SU32_SUS128_SRVW4_TT1_32_VAW2_WG32_8_1_WGM1
    SolutionIndex: 591
    SolutionNameMin: Cijk_Ailk_Bjlk_HBH_MT32x32x32_MI16x16x16x1_SE_AF0EM1_EPS0_GRVW2_GSU1_PGR2_SU0_SUS256_SRVW4_TT1_16_VAW2_WG32_8_1_WGM1
    SolutionIndex: 592
    SolutionNameMin: Cijk_Ailk_Bjlk_HBH_MT128x256x16_MI32x32x8x1_SE_AF0EM1_EPS0_GRVW8_GSU1_PGR2_SU0_SUS256_SRVW4_TT2_128_VAW2_WG64_4_1_WGM1
    SolutionIndex: 593
    SolutionNameMin: Cijk_Ailk_Bjlk_HBH_MT128x128x16_MI32x32x8x1_SE_AF0EM1_EPS0_GRVW4_GSU1_PGR2_SU0_SUS256_SRVW4_TT2_64_VAW2_WG64_4_1_WGM15
    SolutionIndex: 594
    SolutionNameMin: Cijk_Ailk_Bjlk_HBH_MT64x256x16_MI32x32x8x1_SE_AF0EM1_EPS0_GRVW8_GSU1_PGR2_SU32_SUS256_SRVW4_TT1_128_VAW2_WG64_4_1_WGM1
    SolutionIndex: 595
    SolutionNameMin: Cijk_Ailk_Bjlk_HBH_MT16x64x32_MI16x16x16x1_SE_AF0EM1_EPS1_GRVW8_GSU1_PGR1_SU0_SUS256_SRVW0_TT1_16_VAW2_WG16_16_1_WGM1
    SolutionIndex: 596
    SolutionNameMin: Cijk_Ailk_Bjlk_HBH_MT16x16x32_MI16x16x16x1_SE_AF0EM1_EPS0_GRVW4_GSU1_PGR2_SU32_SUS128_SRVW0_TT1_16_VAW2_WG16_4_1_WGM1
    SolutionIndex: 597
    SolutionNameMin: Cijk_Ailk_Bjlk_HBH_MT16x16x32_MI16x16x16x1_SE_AF0EM1_EPS0_GRVW8_GSU1_PGR2_SU0_SUS256_SRVW0_TT1_16_VAW2_WG16_4_1_WGM1
    SolutionIndex: 598
    SolutionNameMin: Cijk_Ailk_Bjlk_HBH_MT32x32x64_MI16x16x16x1_SE_AF0EM1_EPS0_GRVW8_GSU1_PGR2_SU0_SUS256_SRVW4_TT1_16_VAW2_WG32_8_1_WGM1
    SolutionIndex: 599
    SolutionNameMin: Cijk_Ailk_Bjlk_HBH_MT64x128x64_MI32x32x8x1_SE_AF0EM1_EPS0_GRVW2_GSU1_PGR2_SU32_SUS256_SRVW4_TT1_64_VAW2_WG64_4_1_WGM15
    SolutionIndex: 600
    SolutionNameMin: Cijk_Ailk_Bjlk_HBH_MT64x64x16_MI32x32x8x1_SE_AF0EM1_EPS0_GRVW4_GSU1_PGR2_SU0_SUS256_SRVW4_TT1_32_VAW2_WG64_4_1_WGM1
    SolutionIndex: 601
    SolutionNameMin: Cijk_Ailk_Bjlk_HBH_MT64x16x32_MI16x16x16x1_SE_AF0EM1_EPS0_GRVW8_GSU1_PGR2_SU0_SUS256_SRVW0_TT1_16_VAW2_WG64_4_1_WGM1
- - - [24, 64, 1, 24]
    - [8, 0.004]
  - - [24, 64, 4736, 24]
    - [182, 4.095]
  - - [32, 64, 1, 32]
    - [8, 0.011]
  - - [32, 64, 4608, 32]
    - [183, 7.577]
  - - [32, 64, 1, 35]
    - [1, 0.008]
  - - [32, 64, 4608, 35]
    - [182, 5.693]
  - - [64, 4, 32768, 4]
    - [149, 0.202]
  - - [64, 4, 38400, 4]
    - [149, 0.203]
  - - [64, 14, 1, 14]
    - [0, 0.001]
  - - [64, 14, 10880, 14]
    - [149, 2.143]
  - - [64, 15, 1, 14]
    - [0, 0.001]
  - - [64, 15, 10880, 14]
    - [184, 2.221]
  - - [64, 15, 1, 15]
    - [89, 0.002]
  - - [64, 15, 7680, 15]
    - [149, 2.24]
  - - [64, 15, 10880, 15]
    - [149, 2.342]
  - - [64, 17, 1, 15]
    - [1, 0.002]
  - - [64, 17, 7680, 15]
    - [185, 2.444]
  - - [64, 17, 1, 17]
    - [1, 0.002]
  - - [64, 17, 6144, 17]
    - [186, 2.157]
  - - [64, 17, 7680, 17]
    - [187, 2.426]
  - - [64, 21, 1, 17]
    - [20, 0.003]
  - - [64, 21, 6144, 17]
    - [188, 2.612]
  - - [64, 21, 1, 21]
    - [1, 0.003]
  - - [64, 21, 6144, 21]
    - [189, 3.103]
  - - [64, 24, 1, 24]
    - [2, 0.004]
  - - [64, 24, 4736, 24]
    - [190, 4.211]
  - - [64, 27, 1920, 27]
    - [12, 4.436]
  - - [64, 27, 1920, 33]
    - [35, 4.595]
  - - [64, 30, 1, 30]
    - [14, 0.007]
  - - [64, 30, 2048, 30]
    - [191, 4.842]
  - - [64, 30, 1, 31]
    - [2, 0.007]
  - - [64, 30, 2048, 31]
    - [192, 4.96]
  - - [64, 31, 1, 31]
    - [1, 0.007]
  - - [64, 31, 2048, 31]
    - [193, 5.081]
  - - [64, 32, 1, 32]
    - [8, 0.011]
  - - [64, 32, 4608, 32]
    - [194, 7.597]
  - - [64, 32, 1, 35]
    - [3, 0.008]
  - - [64, 32, 4608, 35]
    - [195, 5.693]
  - - [64, 33, 1920, 33]
    - [30, 4.621]
  - - [64, 34, 1, 24]
    - [2, 0.006]
  - - [64, 34, 4736, 24]
    - [107, 4.592]
  - - [64, 34, 1, 34]
    - [1, 0.008]
  - - [64, 34, 4736, 34]
    - [165, 5.221]
  - - [64, 35, 1, 35]
    - [2, 0.009]
  - - [64, 35, 4608, 35]
    - [132, 5.349]
  - - [64, 64, 1, 256]
    - [10, 0.097]
  - - [64, 64, 1, 1280]
    - [60, 0.353]
  - - [64, 64, 1, 3328]
    - [72, 0.729]
  - - [64, 128, 1, 256]
    - [29, 0.269]
  - - [64, 128, 1, 1280]
    - [57, 0.749]
  - - [64, 128, 1, 3328]
    - [72, 1.636]
  - - [64, 256, 1, 256]
    - [28, 0.478]
  - - [64, 256, 1, 1280]
    - [53, 1.636]
  - - [64, 256, 1, 3328]
    - [74, 3.424]
  - - [64, 448, 1, 256]
    - [6, 0.818]
  - - [64, 448, 1, 1280]
    - [53, 2.793]
  - - [64, 448, 1, 3328]
    - [78, 5.513]
  - - [64, 704, 1, 256]
    - [34, 1.27]
  - - [64, 704, 1, 1280]
    - [67, 3.482]
  - - [64, 704, 1, 3328]
    - [65, 6.527]
  - - [64, 1024, 1, 256]
    - [34, 1.892]
  - - [64, 1024, 1, 1280]
    - [51, 5.34]
  - - [64, 1024, 1, 3328]
    - [71, 10.8]
  - - [64, 1408, 1, 256]
    - [34, 2.601]
  - - [64, 1408, 1, 1280]
    - [63, 7.055]
  - - [64, 1408, 1, 3328]
    - [56, 13.301]
  - - [64, 1856, 1, 256]
    - [10, 3.898]
  - - [64, 1856, 1, 1280]
    - [52, 8.225]
  - - [64, 1856, 1, 3328]
    - [79, 15.544]
  - - [64, 2368, 1, 256]
    - [6, 4.539]
  - - [64, 2368, 1, 1280]
    - [46, 8.813]
  - - [64, 2368, 1, 3328]
    - [52, 16.22]
  - - [64, 2944, 1, 256]
    - [34, 5.505]
  - - [64, 2944, 1, 1280]
    - [59, 10.354]
  - - [64, 2944, 1, 3328]
    - [66, 19.431]
  - - [64, 3584, 1, 256]
    - [24, 6.621]
  - - [64, 3584, 1, 1280]
    - [10, 12.49]
  - - [64, 3584, 1, 3328]
    - [50, 19.9]
  - - [64, 4288, 1, 256]
    - [23, 6.994]
  - - [64, 4288, 1, 1280]
    - [9, 13.418]
  - - [64, 4288, 1, 3328]
    - [43, 22.029]
  - - [64, 5056, 1, 256]
    - [10, 8.075]
  - - [64, 5056, 1, 1280]
    - [22, 15.886]
  - - [64, 5056, 1, 3328]
    - [48, 26.875]
  - - [64, 5888, 1, 256]
    - [7, 9.028]
  - - [64, 5888, 1, 1280]
    - [9, 18.202]
  - - [64, 5888, 1, 3328]
    - [70, 25.851]
  - - [64, 6784, 1, 256]
    - [18, 12.095]
  - - [64, 6784, 1, 1280]
    - [33, 22.912]
  - - [64, 6784, 1, 3328]
    - [42, 28.113]
  - - [128, 64, 1, 256]
    - [32, 0.234]
  - - [128, 64, 1, 1280]
    - [55, 0.761]
  - - [128, 64, 1, 3328]
    - [77, 1.615]
  - - [256, 64, 1, 256]
    - [10, 0.467]
  - - [256, 64, 1, 1280]
    - [60, 1.454]
  - - [256, 64, 1, 3328]
    - [76, 3.15]
  - - [448, 64, 1, 256]
    - [10, 0.808]
  - - [448, 64, 1, 1280]
    - [61, 2.704]
  - - [448, 64, 1, 3328]
    - [74, 5.479]
  - - [480, 512, 1, 512]
    - [93, 11.659]
  - - [512, 16, 1, 512]
    - [87, 0.381]
  - - [512, 32, 1, 512]
    - [34, 0.671]
  - - [512, 480, 1, 512]
    - [98, 11.659]
  - - [512, 512, 1, 512]
    - [102, 9.662]
  - - [704, 64, 1, 256]
    - [34, 1.285]
  - - [704, 64, 1, 1280]
    - [69, 4.217]
  - - [704, 64, 1, 3328]
    - [58, 7.544]
  - - [960, 1024, 1, 1024]
    - [92, 40.958]
  - - [1024, 16, 1, 512]
    - [88, 0.762]
  - - [1024, 32, 1, 512]
    - [10, 1.414]
  - - [1024, 64, 1, 256]
    - [34, 1.915]
  - - [1024, 64, 1, 1280]
    - [54, 5.234]
  - - [1024, 64, 1, 3328]
    - [73, 10.8]
  - - [1024, 960, 1, 1024]
    - [97, 41.684]
  - - [1024, 1024, 1, 16]
    - [132, 3.019]
  - - [1024, 1024, 1, 3240]
    - [25, 40.92]
  - - [1024, 1024, 1, 3960]
    - [38, 43.37]
  - - [1024, 4096, 1, 3240]
    - [5, 68.633]
  - - [1024, 4096, 1, 3960]
    - [31, 71.466]
  - - [1024, 42720, 1, 3960]
    - [31, 88.392]
  - - [1408, 64, 1, 256]
    - [34, 2.665]
  - - [1408, 64, 1, 1280]
    - [56, 5.931]
  - - [1408, 64, 1, 3328]
    - [68, 12.993]
  - - [1760, 7133, 1, 1760]
    - [4, 72.401]
  - - [1856, 64, 1, 256]
    - [10, 3.846]
  - - [1856, 64, 1, 1280]
    - [26, 7.187]
  - - [1856, 64, 1, 3328]
    - [75, 14.34]
  - - [1920, 2048, 1, 2048]
    - [91, 84.964]
  - - [2048, 1920, 1, 2048]
    - [96, 84.869]
  - - [2048, 2048, 1, 2]
    - [269, 0.793]
  - - [2048, 2048, 1, 2048]
    - [100, 76.926]
  - - [2048, 7133, 1, 2048]
    - [21, 81.297]
  - - [2368, 64, 1, 256]
    - [34, 4.539]
  - - [2368, 64, 1, 1280]
    - [49, 8.855]
  - - [2368, 64, 1, 3328]
    - [68, 16.389]
  - - [2560, 2560, 1, 4]
    - [143, 1.777]
  - - [2560, 7133, 1, 2560]
    - [17, 82.466]
  - - [2944, 64, 1, 256]
    - [6, 5.438]
  - - [2944, 64, 1, 1280]
    - [16, 10.259]
  - - [2944, 64, 1, 3328]
    - [64, 20.736]
  - - [3072, 7435, 1, 1024]
    - [40, 78.763]
  - - [3584, 64, 1, 256]
    - [27, 6.701]
  - - [3584, 64, 1, 1280]
    - [37, 12.78]
  - - [3584, 64, 1, 3328]
    - [47, 19.36]
  - - [3840, 4096, 1, 4096]
    - [90, 93.214]
  - - [4096, 1024, 1, 3240]
    - [31, 69.269]
  - - [4096, 1024, 1, 3960]
    - [13, 68.687]
  - - [4096, 3840, 1, 4096]
    - [95, 93.17]
  - - [4096, 4096, 1, 4096]
    - [99, 86.415]
  - - [4096, 7133, 1, 4096]
    - [39, 85.839]
  - - [4288, 64, 1, 256]
    - [16, 6.921]
  - - [4288, 64, 1, 1280]
    - [36, 13.529]
  - - [4288, 64, 1, 3328]
    - [45, 21.748]
  - - [5056, 64, 1, 256]
    - [11, 8.075]
  - - [5056, 64, 1, 1280]
    - [33, 15.886]
  - - [5056, 64, 1, 3328]
    - [44, 24.641]
  - - [5888, 64, 1, 256]
    - [19, 9.213]
  - - [5888, 64, 1, 1280]
    - [36, 18.5]
  - - [5888, 64, 1, 3328]
    - [62, 25.349]
  - - [6784, 64, 1, 256]
    - [15, 11.956]
  - - [6784, 64, 1, 1280]
    - [15, 23.116]
  - - [6784, 64, 1, 3328]
    - [41, 27.154]
  - - [7680, 5481, 1, 2560]
    - [31, 85.887]
  - - [7680, 8192, 1, 8192]
    - [90, 95.574]
  - - [8192, 7680, 1, 8192]
    - [94, 95.496]
  - - [8192, 8192, 1, 8192]
    - [99, 93.09]
  - - [4, 64, 32768, 4]
    - [472, 0.201]
  - - [4, 64, 38400, 4]
    - [472, 0.202]
  - - [14, 64, 1, 14]
    - [80, 0.001]
  - - [14, 64, 10880, 14]
    - [473, 1.875]
  - - [15, 64, 1, 14]
    - [80, 0.001]
  - - [15, 64, 10880, 14]
    - [474, 1.941]
  - - [15, 64, 1, 15]
    - [80, 0.001]
  - - [15, 64, 7680, 15]
    - [475, 1.986]
  - - [15, 64, 10880, 15]
    - [475, 2.068]
  - - [17, 64, 1, 15]
    - [80, 0.001]
  - - [17, 64, 7680, 15]
    - [476, 1.939]
  - - [17, 64, 1, 17]
    - [83, 0.002]
  - - [17, 64, 6144, 17]
    - [477, 1.843]
  - - [17, 64, 7680, 17]
    - [478, 1.975]
  - - [21, 64, 1, 17]
    - [80, 0.002]
  - - [21, 64, 6144, 17]
    - [479, 2.227]
  - - [21, 64, 1, 21]
    - [80, 0.003]
  - - [21, 64, 6144, 21]
    - [480, 2.669]
  - - [27, 64, 1920, 27]
    - [86, 3.552]
  - - [27, 64, 1920, 33]
    - [86, 3.686]
  - - [30, 64, 1, 30]
    - [80, 0.006]
  - - [30, 64, 2048, 30]
    - [481, 3.929]
  - - [30, 64, 1, 31]
    - [80, 0.006]
  - - [30, 64, 2048, 31]
    - [482, 4.002]
  - - [31, 64, 1, 31]
    - [85, 0.007]
  - - [31, 64, 2048, 31]
    - [483, 3.982]
  - - [33, 64, 1920, 33]
    - [84, 3.63]
  - - [34, 64, 1, 24]
    - [81, 0.006]
  - - [34, 64, 4736, 24]
    - [484, 3.534]
  - - [34, 64, 1, 34]
    - [80, 0.007]
  - - [34, 64, 4736, 34]
    - [485, 4.242]
  - - [35, 64, 1, 35]
    - [82, 0.008]
  - - [35, 64, 4608, 35]
    - [486, 4.301]
  - - [1024, 1024, 1, 1024]
    - [101, 37.079]
  - - [64, 512, 16, 512]
    - [103, 18.204]
  - - [1024, 2, 1, 1]
    - [104, 0.001]
  - - [1024, 2, 1, 512]
    - [105, 0.101]
  - - [1024, 1024, 1, 1]
    - [106, 0.192]
  - - [1024, 1024, 1, 77]
    - [107, 8.89]
  - - [1024, 1024, 1, 512]
    - [108, 25.765]
  - - [1024, 4096, 1, 512]
    - [109, 57.093]
  - - [1024, 30522, 1, 77]
    - [110, 28.764]
  - - [4096, 1024, 1, 512]
    - [111, 49.5]
  - - [64, 128, 160, 128]
    - [112, 14.812]
  - - [1024, 2, 1, 10]
    - [113, 0.004]
  - - [1024, 2, 1, 1280]
    - [114, 0.219]
  - - [1024, 1024, 1, 10]
    - [115, 1.558]
  - - [1024, 1024, 1, 200]
    - [116, 16.492]
  - - [1024, 1024, 1, 1280]
    - [117, 37.494]
  - - [1024, 4096, 1, 1280]
    - [118, 68.544]
  - - [1024, 30522, 1, 200]
    - [119, 51.677]
  - - [4096, 1024, 1, 1280]
    - [120, 64.166]
  - - [64, 128, 624, 128]
    - [121, 18.612]
  - - [1024, 2, 1, 39]
    - [113, 0.011]
  - - [1024, 2, 1, 4992]
    - [122, 0.638]
  - - [1024, 1024, 1, 39]
    - [123, 5.242]
  - - [1024, 1024, 1, 780]
    - [124, 27.239]
  - - [1024, 1024, 1, 4992]
    - [125, 52.787]
  - - [1024, 4096, 1, 4992]
    - [126, 80.503]
  - - [1024, 30522, 1, 780]
    - [127, 73.594]
  - - [4096, 1024, 1, 4992]
    - [128, 76.871]
  - - [64, 512, 64, 512]
    - [129, 28.958]
  - - [1024, 2, 1, 4]
    - [130, 0.001]
  - - [1024, 2, 1, 2048]
    - [131, 0.344]
  - - [1024, 1024, 1, 4]
    - [132, 0.654]
  - - [1024, 1024, 1, 308]
    - [116, 20.284]
  - - [1024, 1024, 1, 2048]
    - [133, 43.879]
  - - [1024, 4096, 1, 2048]
    - [126, 76.125]
  - - [1024, 30522, 1, 308]
    - [119, 61.788]
  - - [4096, 1024, 1, 2048]
    - [120, 70.764]
  - - [64, 128, 640, 128]
    - [134, 18.747]
  - - [1024, 2, 1, 40]
    - [113, 0.012]
  - - [1024, 2, 1, 5120]
    - [135, 0.642]
  - - [1024, 1024, 1, 40]
    - [121, 5.377]
  - - [1024, 1024, 1, 800]
    - [136, 31.152]
  - - [1024, 1024, 1, 5120]
    - [137, 51.69]
  - - [1024, 4096, 1, 5120]
    - [126, 80.259]
  - - [1024, 30522, 1, 800]
    - [138, 77.635]
  - - [4096, 1024, 1, 5120]
    - [120, 77.684]
  - - [64, 128, 656, 128]
    - [139, 18.768]
  - - [1024, 2, 1, 41]
    - [113, 0.012]
  - - [1024, 2, 1, 5248]
    - [122, 0.662]
  - - [1024, 1024, 1, 41]
    - [140, 5.225]
  - - [1024, 1024, 1, 820]
    - [141, 27.184]
  - - [1024, 1024, 1, 5248]
    - [142, 52.603]
  - - [1024, 4096, 1, 5248]
    - [126, 77.441]
  - - [1024, 30522, 1, 820]
    - [143, 74.974]
  - - [4096, 1024, 1, 5248]
    - [120, 77.88]
  - - [64, 512, 80, 512]
    - [144, 31.245]
  - - [1024, 2, 1, 5]
    - [130, 0.001]
  - - [1024, 2, 1, 2560]
    - [145, 0.413]
  - - [1024, 1024, 1, 5]
    - [132, 0.818]
  - - [1024, 1024, 1, 385]
    - [146, 21.713]
  - - [1024, 1024, 1, 2560]
    - [133, 46.009]
  - - [1024, 4096, 1, 2560]
    - [126, 76.589]
  - - [1024, 30522, 1, 385]
    - [147, 66.241]
  - - [4096, 1024, 1, 2560]
    - [120, 73.027]
  - - [64, 512, 96, 512]
    - [148, 31.533]
  - - [1024, 2, 1, 6]
    - [149, 0.002]
  - - [1024, 2, 1, 3072]
    - [150, 0.463]
  - - [1024, 1024, 1, 6]
    - [151, 0.982]
  - - [1024, 1024, 1, 462]
    - [108, 23.013]
  - - [1024, 1024, 1, 3072]
    - [152, 47.398]
  - - [1024, 4096, 1, 3072]
    - [126, 77.745]
  - - [1024, 30522, 1, 462]
    - [94, 67.769]
  - - [4096, 1024, 1, 3072]
    - [120, 75.316]
  - - [64, 128, 128, 128]
    - [112, 13.084]
  - - [1024, 2, 1, 8]
    - [113, 0.003]
  - - [1024, 2, 1, 1024]
    - [153, 0.189]
  - - [1024, 1024, 1, 8]
    - [140, 1.33]
  - - [1024, 1024, 1, 160]
    - [108, 16.527]
  - - [1024, 4096, 1, 1024]
    - [126, 68.708]
  - - [1024, 30522, 1, 160]
    - [154, 51.314]
  - - [4096, 1024, 1, 1024]
    - [155, 60.351]
  - - [64, 128, 144, 128]
    - [156, 14.13]
  - - [1024, 2, 1, 9]
    - [130, 0.003]
  - - [1024, 2, 1, 1152]
    - [157, 0.208]
  - - [1024, 1024, 1, 9]
    - [158, 1.402]
  - - [1024, 1024, 1, 180]
    - [116, 16.057]
  - - [1024, 1024, 1, 1152]
    - [117, 35.661]
  - - [1024, 4096, 1, 1152]
    - [126, 71.21]
  - - [1024, 30522, 1, 180]
    - [119, 49.482]
  - - [4096, 1024, 1, 1152]
    - [120, 62.284]
  - - [256, 128, 1, 32768]
    - [159, 26.305]
  - - [256, 32768, 1, 1]
    - [160, 0.467]
  - - [512, 256, 1, 32768]
    - [161, 54.316]
  - - [1024, 512, 1, 32768]
    - [162, 74.883]
  - - [1024, 1024, 1, 32768]
    - [163, 76.944]
  - - [64, 128, 512, 128]
    - [164, 18.608]
  - - [128, 64, 512, 128]
    - [165, 18.27]
  - - [1024, 2, 1, 32]
    - [166, 0.013]
  - - [1024, 1024, 1, 32]
    - [167, 5.414]
  - - [1024, 1024, 1, 4096]
    - [133, 50.117]
  - - [1024, 4096, 1, 4096]
    - [126, 80.227]
  - - [1024, 30528, 1, 4096]
    - [168, 91.346]
  - - [4096, 1024, 1, 4096]
    - [169, 76.487]
  - - [512, 64, 64, 512]
    - [170, 29.729]
  - - [1024, 30528, 1, 2048]
    - [119, 87.313]
  - - [1024, 1024, 1, 8192]
    - [171, 58.126]
  - - [1024, 1024, 1, 9600]
    - [171, 60.041]
  - - [1024, 4096, 1, 8192]
    - [126, 80.791]
  - - [1024, 4096, 1, 9600]
    - [172, 78.064]
  - - [1024, 33712, 1, 8192]
    - [173, 92.779]
  - - [1024, 33712, 1, 9600]
    - [127, 92.758]
  - - [4096, 1024, 1, 8192]
    - [174, 77.221]
  - - [4096, 1024, 1, 9600]
    - [120, 78.931]
  - - [1024, 1024, 1, 10064]
    - [175, 58.995]
  - - [1024, 1024, 1, 10080]
    - [176, 59.948]
  - - [1024, 1024, 1, 10200]
    - [177, 58.705]
  - - [1024, 1024, 1, 3840]
    - [178, 49.581]
  - - [1024, 1024, 1, 3968]
    - [152, 49.226]
  - - [1024, 1024, 1, 6528]
    - [125, 55.8]
  - - [1024, 1024, 1, 7104]
    - [171, 56.953]
  - - [1024, 1024, 1, 7200]
    - [125, 56.298]
  - - [1024, 1024, 1, 8064]
    - [171, 58.616]
  - - [1024, 1024, 1, 8160]
    - [171, 58.662]
  - - [1024, 1024, 1, 9216]
    - [125, 60.051]
  - - [1024, 1024, 1, 9520]
    - [171, 58.717]
  - - [1024, 4096, 1, 10064]
    - [179, 78.864]
  - - [1024, 4096, 1, 10080]
    - [179, 81.21]
  - - [1024, 4096, 1, 10200]
    - [126, 81.227]
  - - [1024, 4096, 1, 3840]
    - [118, 78.873]
  - - [1024, 4096, 1, 3968]
    - [126, 77.219]
  - - [1024, 4096, 1, 6528]
    - [126, 79.256]
  - - [1024, 4096, 1, 7104]
    - [179, 80.059]
  - - [1024, 4096, 1, 7200]
    - [179, 81.024]
  - - [1024, 4096, 1, 8064]
    - [126, 82.023]
  - - [1024, 4096, 1, 8160]
    - [126, 81.582]
  - - [1024, 4096, 1, 9216]
    - [126, 80.352]
  - - [1024, 4096, 1, 9520]
    - [126, 80.778]
  - - [1024, 42720, 1, 10080]
    - [180, 93.473]
  - - [1024, 42720, 1, 3968]
    - [172, 91.62]
  - - [1024, 42720, 1, 6528]
    - [172, 92.836]
  - - [1024, 42720, 1, 7104]
    - [172, 93.225]
  - - [1024, 42720, 1, 7200]
    - [172, 93.461]
  - - [1024, 42720, 1, 9520]
    - [172, 92.556]
  - - [4096, 1024, 1, 10064]
    - [120, 78.88]
  - - [4096, 1024, 1, 10080]
    - [120, 78.488]
  - - [4096, 1024, 1, 10200]
    - [120, 78.968]
  - - [4096, 1024, 1, 3840]
    - [120, 76.862]
  - - [4096, 1024, 1, 3968]
    - [120, 75.791]
  - - [4096, 1024, 1, 6528]
    - [120, 78.696]
  - - [4096, 1024, 1, 7104]
    - [169, 76.965]
  - - [4096, 1024, 1, 7200]
    - [120, 79.252]
  - - [4096, 1024, 1, 8064]
    - [120, 79.689]
  - - [4096, 1024, 1, 8160]
    - [120, 80.456]
  - - [4096, 1024, 1, 9216]
    - [120, 79.312]
  - - [4096, 1024, 1, 9520]
    - [181, 76.951]
  - - [512, 64, 1, 512]
    - [196, 1.688]
  - - [64, 512, 1, 512]
    - [197, 1.707]
  - - [64, 128, 1, 128]
    - [198, 0.149]
  - - [128, 64, 1, 128]
    - [198, 0.153]
  - - [2048, 2048, 1, 512]
    - [199, 56.771]
  - - [1024, 64, 1, 512]
    - [200, 3.271]
  - - [2048, 512, 1, 1]
    - [140, 0.185]
  - - [1600, 1024, 1, 512]
    - [201, 33.984]
  - - [512, 32, 1, 1600]
    - [202, 1.962]
  - - [560, 1024, 1, 1600]
    - [203, 28.152]
  - - [1024, 1600, 1, 1]
    - [204, 0.264]
  - - [1024, 1024, 1, 1600]
    - [133, 40.675]
  - - [512, 512, 1, 1600]
    - [205, 17.761]
  - - [256, 1280, 1, 8976]
    - [206, 45.952]
  - - [256, 2560, 1, 8976]
    - [207, 58.378]
  - - [256, 2816, 1, 8976]
    - [208, 59.896]
  - - [256, 3328, 1, 8976]
    - [209, 60.393]
  - - [256, 3584, 1, 8976]
    - [210, 64.549]
  - - [256, 3840, 1, 8976]
    - [211, 69.685]
  - - [256, 4096, 1, 8976]
    - [125, 58.839]
  - - [256, 4352, 1, 8976]
    - [137, 64.32]
  - - [256, 4864, 1, 8976]
    - [212, 69.361]
  - - [256, 5120, 1, 8976]
    - [213, 72.008]
  - - [256, 5632, 1, 8976]
    - [214, 71.749]
  - - [256, 5888, 1, 8976]
    - [215, 66.535]
  - - [256, 6144, 1, 8976]
    - [215, 68.885]
  - - [256, 7168, 1, 8976]
    - [216, 75.523]
  - - [256, 8192, 1, 8976]
    - [217, 70.748]
  - - [256, 8960, 1, 8976]
    - [218, 77.009]
  - - [256, 9728, 1, 8976]
    - [219, 73.894]
  - - [256, 9984, 1, 8976]
    - [220, 76.269]
  - - [256, 10240, 1, 8976]
    - [219, 77.673]
  - - [256, 10496, 1, 8976]
    - [221, 79.671]
  - - [256, 11008, 1, 8976]
    - [219, 83.322]
  - - [256, 11264, 1, 8976]
    - [219, 85.229]
  - - [256, 11520, 1, 8976]
    - [219, 89.239]
  - - [256, 11776, 1, 8976]
    - [222, 69.646]
  - - [256, 12544, 1, 8976]
    - [223, 73.863]
  - - [256, 12800, 1, 8976]
    - [223, 75.329]
  - - [256, 13312, 1, 8976]
    - [224, 80.095]
  - - [256, 13568, 1, 8976]
    - [223, 81.477]
  - - [256, 14336, 1, 8976]
    - [225, 86.136]
  - - [256, 14848, 1, 8976]
    - [226, 89.213]
  - - [256, 15104, 1, 8976]
    - [225, 90.574]
  - - [256, 15872, 1, 8976]
    - [227, 83.125]
  - - [256, 16128, 1, 8976]
    - [228, 84.672]
  - - [256, 17152, 1, 8976]
    - [228, 89.48]
  - - [256, 17408, 1, 8976]
    - [155, 82.165]
  - - [256, 18688, 1, 8976]
    - [229, 87.956]
  - - [256, 19968, 1, 8976]
    - [230, 81.463]
  - - [256, 20480, 1, 8976]
    - [231, 81.165]
  - - [256, 20992, 1, 8976]
    - [232, 83.363]
  - - [256, 21248, 1, 8976]
    - [233, 84.023]
  - - [256, 22016, 1, 8976]
    - [234, 86.917]
  - - [256, 26112, 1, 8976]
    - [235, 80.25]
  - - [256, 32512, 1, 8976]
    - [236, 86.485]
  - - [256, 33536, 1, 8976]
    - [236, 89.33]
  - - [256, 44505, 1, 8976]
    - [237, 90.176]
  - - [480, 1024, 1, 32768]
    - [238, 71.775]
  - - [512, 32, 1, 200]
    - [198, 0.344]
  - - [512, 512, 1, 200]
    - [239, 5.392]
  - - [512, 2048, 1, 256]
    - [146, 20.424]
  - - [560, 1024, 1, 200]
    - [240, 10.031]
  - - [768, 2048, 1, 256]
    - [241, 28.121]
  - - [1024, 64, 1, 960]
    - [242, 4.71]
  - - [1024, 256, 1, 1024]
    - [243, 13.434]
  - - [1024, 256, 1, 1280]
    - [244, 15.17]
  - - [1024, 256, 1, 2304]
    - [245, 22.609]
  - - [1024, 256, 1, 2816]
    - [246, 26.367]
  - - [1024, 256, 1, 3072]
    - [247, 27.707]
  - - [1024, 256, 1, 3328]
    - [248, 28.952]
  - - [1024, 256, 1, 3584]
    - [249, 30.215]
  - - [1024, 256, 1, 4096]
    - [249, 32.946]
  - - [1024, 256, 1, 4352]
    - [250, 33.574]
  - - [1024, 256, 1, 4608]
    - [251, 34.783]
  - - [1024, 256, 1, 5120]
    - [252, 36.513]
  - - [1024, 256, 1, 5376]
    - [253, 35.264]
  - - [1024, 256, 1, 5632]
    - [251, 36.075]
  - - [1024, 256, 1, 6144]
    - [254, 37.966]
  - - [1024, 256, 1, 6400]
    - [253, 42.093]
  - - [1024, 256, 1, 7680]
    - [255, 42.917]
  - - [1024, 256, 1, 7936]
    - [256, 44.047]
  - - [1024, 256, 1, 8192]
    - [257, 44.96]
  - - [1024, 256, 1, 8448]
    - [257, 46.364]
  - - [1024, 256, 1, 9728]
    - [252, 48.804]
  - - [1024, 256, 1, 9984]
    - [258, 47.932]
  - - [1024, 256, 1, 10496]
    - [257, 49.234]
  - - [1024, 256, 1, 11520]
    - [257, 50.02]
  - - [1024, 256, 1, 12032]
    - [257, 52.059]
  - - [1024, 256, 1, 13568]
    - [257, 52.336]
  - - [1024, 256, 1, 14336]
    - [258, 52.026]
  - - [1024, 256, 1, 14848]
    - [258, 52.487]
  - - [1024, 256, 1, 15104]
    - [259, 54.251]
  - - [1024, 256, 1, 15872]
    - [258, 55.153]
  - - [1024, 256, 1, 16128]
    - [260, 56.122]
  - - [1024, 256, 1, 17152]
    - [261, 57.093]
  - - [1024, 256, 1, 17408]
    - [262, 56.865]
  - - [1024, 256, 1, 18944]
    - [263, 58.828]
  - - [1024, 256, 1, 19712]
    - [258, 59.335]
  - - [1024, 256, 1, 19968]
    - [263, 59.377]
  - - [1024, 256, 1, 21248]
    - [264, 61.542]
  - - [1024, 256, 1, 21504]
    - [264, 61.629]
  - - [1024, 256, 1, 22016]
    - [263, 61.868]
  - - [1024, 256, 1, 28672]
    - [263, 67.895]
  - - [1024, 256, 1, 33536]
    - [263, 70.498]
  - - [1024, 1024, 1, 960]
    - [117, 33.765]
  - - [1600, 1024, 1, 960]
    - [265, 44.876]
  - - [2048, 256, 1, 1024]
    - [266, 23.699]
  - - [2048, 960, 1, 1]
    - [123, 0.307]
  - - [2048, 2048, 1, 960]
    - [100, 67.049]
  - - [2048, 2048, 1, 1024]
    - [100, 66.989]
  - - [3200, 2048, 1, 1024]
    - [267, 68.938]
  - - [4096, 4096, 1, 1024]
    - [268, 75.694]
  - - [2048, 2, 1, 2]
    - [130, 0.001]
  - - [2048, 30592, 1, 1024]
    - [173, 84.563]
  - - [2048, 6144, 1, 1024]
    - [270, 71.732]
  - - [2048, 8192, 1, 1024]
    - [271, 75.234]
  - - [8192, 2048, 1, 1024]
    - [272, 75.304]
  - - [1024, 2, 1, 16]
    - [273, 0.006]
  - - [1024, 30592, 1, 8192]
    - [168, 94.061]
  - - [1024, 3072, 1, 8192]
    - [274, 73.257]
  - - [512, 64, 256, 512]
    - [275, 33.919]
  - - [64, 512, 256, 512]
    - [276, 33.579]
  - - [1024, 30592, 1, 2048]
    - [90, 87.584]
  - - [1024, 3072, 1, 2048]
    - [277, 63.0]
  - - [1024, 30592, 1, 4096]
    - [95, 91.824]
  - - [1024, 3072, 1, 4096]
    - [226, 69.459]
  - - [512, 64, 128, 512]
    - [278, 30.221]
  - - [64, 512, 128, 512]
    - [279, 30.496]
  - - [2560, 1920, 1, 2048]
    - [155, 86.985]
  - - [2560, 2, 1, 4]
    - [280, 0.004]
  - - [2560, 2560, 1, 2048]
    - [281, 74.944]
  - - [2560, 7680, 1, 2048]
    - [271, 91.305]
  - - [640, 2560, 1, 2048]
    - [282, 60.738]
  - - [512, 64, 40, 512]
    - [283, 27.305]
  - - [64, 512, 40, 512]
    - [284, 27.789]
  - - [1536, 1536, 1, 4096]
    - [285, 77.495]
  - - [1536, 4608, 1, 4096]
    - [286, 84.153]
  - - [1536, 50304, 1, 4096]
    - [281, 93.491]
  - - [1536, 6144, 1, 4096]
    - [229, 85.64]
  - - [6144, 1536, 1, 4096]
    - [287, 85.377]
  - - [1024, 96, 64, 1024]
    - [288, 50.835]
  - - [96, 1024, 64, 1024]
    - [289, 48.31]
  - - [1536, 1536, 1, 8192]
    - [285, 80.173]
  - - [1536, 4608, 1, 8192]
    - [90, 85.898]
  - - [1536, 50304, 1, 8192]
    - [94, 94.267]
  - - [1536, 6144, 1, 8192]
    - [229, 89.176]
  - - [6144, 1536, 1, 8192]
    - [287, 89.001]
  - - [1024, 96, 128, 1024]
    - [136, 54.835]
  - - [96, 1024, 128, 1024]
    - [290, 52.794]
  - - [1024, 1024, 1, 16384]
    - [291, 68.24]
  - - [1024, 3072, 1, 16384]
    - [274, 75.576]
  - - [1024, 4096, 1, 16384]
    - [126, 83.184]
  - - [1024, 50304, 1, 16384]
    - [292, 93.287]
  - - [4096, 1024, 1, 16384]
    - [293, 79.209]
  - - [1024, 64, 256, 1024]
    - [241, 41.738]
  - - [64, 1024, 256, 1024]
    - [294, 41.437]
  - - [1024, 50304, 1, 2048]
    - [281, 87.337]
  - - [1024, 64, 32, 1024]
    - [295, 35.887]
  - - [64, 1024, 32, 1024]
    - [296, 37.147]
  - - [1024, 50304, 1, 4096]
    - [297, 90.582]
  - - [1024, 64, 64, 1024]
    - [298, 37.355]
  - - [64, 1024, 64, 1024]
    - [279, 37.811]
  - - [1024, 50304, 1, 8192]
    - [299, 92.308]
  - - [1024, 64, 128, 1024]
    - [300, 40.951]
  - - [64, 1024, 128, 1024]
    - [301, 40.436]
  - - [1024, 2, 1, 64]
    - [166, 0.022]
  - - [1024, 30528, 1, 8192]
    - [95, 93.945]
  - - [1024, 1024, 1, 64]
    - [302, 9.102]
  - - [64, 128, 1024, 128]
    - [303, 19.858]
  - - [128, 64, 1024, 128]
    - [304, 19.626]
  - - [1024, 1024, 1, 3456]
    - [152, 48.657]
  - - [1024, 1024, 1, 6912]
    - [125, 56.664]
  - - [1024, 1024, 1, 864]
    - [305, 32.115]
  - - [1024, 512, 1, 3456]
    - [306, 35.4]
  - - [1024, 512, 1, 4096]
    - [307, 39.405]
  - - [1024, 512, 1, 6912]
    - [308, 49.581]
  - - [1024, 512, 1, 864]
    - [309, 22.67]
  - - [256, 128, 1, 3456]
    - [310, 6.022]
  - - [256, 128, 1, 4096]
    - [311, 8.21]
  - - [256, 128, 1, 55296]
    - [312, 29.135]
  - - [256, 128, 1, 6912]
    - [313, 12.252]
  - - [256, 128, 1, 864]
    - [314, 2.038]
  - - [256, 3456, 1, 1]
    - [315, 0.159]
  - - [256, 4096, 1, 1]
    - [316, 0.178]
  - - [256, 6912, 1, 1]
    - [160, 0.263]
  - - [256, 864, 1, 1]
    - [130, 0.055]
  - - [480, 1024, 1, 3456]
    - [317, 36.048]
  - - [480, 1024, 1, 4096]
    - [318, 39.008]
  - - [480, 1024, 1, 6912]
    - [319, 48.764]
  - - [480, 1024, 1, 864]
    - [320, 20.917]
  - - [512, 256, 1, 3456]
    - [321, 19.996]
  - - [512, 256, 1, 4096]
    - [322, 21.94]
  - - [512, 256, 1, 55296]
    - [323, 61.271]
  - - [512, 256, 1, 6912]
    - [324, 28.547]
  - - [512, 256, 1, 864]
    - [325, 7.065]
  - - [30528, 1024, 1, 640]
    - [94, 74.952]
  - - [30528, 1024, 1, 1280]
    - [326, 84.376]
  - - [4096, 1024, 1, 10240]
    - [169, 78.472]
  - - [1024, 4096, 1, 10240]
    - [126, 80.516]
  - - [30528, 1024, 1, 1600]
    - [326, 86.488]
  - - [1024, 2, 1, 80]
    - [273, 0.025]
  - - [1024, 1024, 1, 10240]
    - [291, 60.351]
  - - [1024, 1024, 1, 80]
    - [108, 10.904]
  - - [64, 128, 1280, 128]
    - [327, 20.259]
  - - [128, 64, 1280, 128]
    - [328, 19.906]
  - - [1024, 4096, 1, 10496]
    - [126, 81.63]
  - - [30528, 1024, 1, 1640]
    - [154, 84.498]
  - - [4096, 1024, 1, 10496]
    - [169, 78.458]
  - - [1024, 1024, 1, 10496]
    - [162, 60.586]
  - - [1024, 1024, 1, 82]
    - [107, 9.467]
  - - [1024, 2, 1, 82]
    - [329, 0.022]
  - - [128, 64, 1312, 128]
    - [330, 20.148]
  - - [64, 128, 1312, 128]
    - [331, 20.403]
  - - [30528, 1024, 1, 160]
    - [127, 47.376]
  - - [1024, 4096, 1, 6144]
    - [126, 79.539]
  - - [30528, 1024, 1, 240]
    - [332, 58.122]
  - - [4096, 1024, 1, 6144]
    - [120, 79.487]
  - - [1024, 1024, 1, 12]
    - [132, 1.869]
  - - [1024, 2, 1, 12]
    - [130, 0.004]
  - - [1024, 1024, 1, 6144]
    - [137, 55.363]
  - - [64, 512, 192, 512]
    - [333, 32.982]
  - - [512, 64, 192, 512]
    - [334, 32.001]
  - - [3136, 64, 64, 128]
    - [335, 25.265]
  - - [3136, 64, 64, 256]
    - [300, 31.66]
  - - [3136, 128, 64, 256]
    - [336, 50.739]
  - - [784, 256, 64, 512]
    - [337, 60.998]
  - - [3136, 256, 64, 128]
    - [265, 49.998]
  - - [3136, 256, 64, 256]
    - [127, 69.426]
  - - [784, 512, 64, 256]
    - [338, 59.465]
  - - [784, 512, 64, 512]
    - [338, 67.522]
  - - [3136, 64, 32, 128]
    - [339, 23.103]
  - - [3136, 64, 32, 256]
    - [295, 29.647]
  - - [3136, 128, 32, 256]
    - [340, 48.234]
  - - [784, 256, 32, 512]
    - [341, 53.057]
  - - [3136, 256, 32, 128]
    - [342, 46.068]
  - - [3136, 256, 32, 256]
    - [127, 62.421]
  - - [784, 512, 32, 256]
    - [337, 53.612]
  - - [784, 512, 32, 512]
    - [119, 63.581]
  - - [3136, 256, 32, 64]
    - [343, 29.877]
  - - [3136, 64, 32, 64]
    - [309, 17.564]
  - - [784, 512, 32, 128]
    - [344, 40.491]
  - - [784, 128, 32, 512]
    - [341, 46.626]
  - - [3136, 64, 64, 64]
    - [345, 19.931]
  - - [3136, 256, 64, 64]
    - [343, 32.056]
  - - [784, 128, 64, 512]
    - [201, 50.698]
  - - [784, 512, 64, 128]
    - [173, 46.346]
  - - [64, 1280, 64, 192]
    - [346, 30.786]
  - - [64, 1280, 64, 320]
    - [347, 34.66]
  - - [64, 1280, 64, 384]
    - [348, 35.086]
  - - [64, 1280, 64, 448]
    - [349, 36.453]
  - - [64, 2048, 64, 192]
    - [350, 29.847]
  - - [64, 2048, 64, 320]
    - [351, 34.085]
  - - [64, 2048, 64, 384]
    - [352, 35.382]
  - - [64, 2048, 64, 448]
    - [353, 36.408]
  - - [64, 1280, 32, 192]
    - [354, 26.915]
  - - [64, 1280, 32, 320]
    - [355, 32.306]
  - - [64, 1280, 32, 384]
    - [356, 33.525]
  - - [64, 1280, 32, 448]
    - [357, 35.568]
  - - [64, 2048, 32, 192]
    - [358, 28.655]
  - - [64, 2048, 32, 320]
    - [358, 33.406]
  - - [64, 2048, 32, 384]
    - [359, 35.053]
  - - [64, 2048, 32, 448]
    - [360, 35.669]
  - - [1024, 1024, 1, 10224]
    - [125, 61.664]
  - - [1024, 1024, 1, 10192]
    - [175, 59.39]
  - - [1024, 1024, 1, 10208]
    - [125, 60.673]
  - - [1024, 4096, 1, 10224]
    - [126, 81.155]
  - - [4096, 1024, 1, 10224]
    - [293, 77.042]
  - - [1024, 3072, 1, 10224]
    - [224, 72.983]
  - - [1024, 3072, 1, 10240]
    - [361, 73.795]
  - - [4096, 1024, 1, 10192]
    - [169, 77.26]
  - - [1024, 3072, 1, 10192]
    - [224, 72.825]
  - - [1024, 4096, 1, 10192]
    - [126, 81.295]
  - - [1024, 3072, 1, 10200]
    - [274, 72.688]
  - - [1024, 1024, 1, 10184]
    - [125, 60.53]
  - - [4096, 1024, 1, 10208]
    - [181, 79.705]
  - - [1024, 3072, 1, 10208]
    - [274, 74.329]
  - - [1024, 4096, 1, 10208]
    - [126, 81.142]
  - - [1024, 2048, 1, 10224]
    - [362, 68.694]
  - - [1024, 2048, 1, 10240]
    - [362, 68.217]
  - - [1024, 1024, 1, 10120]
    - [125, 61.112]
  - - [1024, 2048, 1, 10192]
    - [363, 68.904]
  - - [64, 24, 6816, 24]
    - [364, 4.184]
  - - [1024, 1024, 1, 10152]
    - [291, 59.689]
  - - [1024, 3072, 1, 10080]
    - [274, 74.334]
  - - [64, 26, 6272, 26]
    - [192, 4.494]
  - - [100352, 256, 1, 512]
    - [271, 74.063]
  - - [12544, 1024, 1, 2048]
    - [169, 75.797]
  - - [12544, 147, 1, 64]
    - [106, 11.875]
  - - [200704, 256, 1, 512]
    - [365, 77.515]
  - - [25088, 512, 1, 1024]
    - [236, 74.197]
  - - [3136, 576, 1, 64]
    - [366, 13.034]
  - - [50176, 512, 1, 1024]
    - [94, 83.595]
  - - [6272, 1024, 1, 2048]
    - [272, 73.096]
  - - [784, 1152, 1, 128]
    - [367, 12.728]
  - - [3136, 256, 128, 128]
    - [368, 52.739]
  - - [3136, 256, 256, 128]
    - [369, 53.965]
  - - [3136, 256, 128, 64]
    - [341, 33.54]
  - - [3136, 256, 256, 64]
    - [341, 34.335]
  - - [3136, 64, 128, 256]
    - [370, 33.34]
  - - [3136, 64, 256, 256]
    - [371, 33.623]
  - - [3136, 64, 128, 64]
    - [240, 21.61]
  - - [3136, 64, 256, 64]
    - [372, 22.611]
  - - [784, 128, 128, 512]
    - [290, 53.472]
  - - [784, 128, 256, 512]
    - [340, 55.447]
  - - [784, 512, 128, 128]
    - [373, 50.823]
  - - [784, 512, 256, 128]
    - [173, 53.87]
  - - [784, 512, 128, 256]
    - [337, 63.352]
  - - [784, 512, 256, 256]
    - [338, 67.264]
  - - [64, 128, 2048, 128]
    - [374, 20.424]
  - - [128, 64, 2048, 128]
    - [375, 20.57]
  - - [30528, 1024, 1, 2560]
    - [376, 89.264]
  - - [1024, 1024, 1, 128]
    - [116, 14.777]
  - - [1024, 2, 1, 128]
    - [377, 0.036]
  - - [128, 64, 1536, 128]
    - [378, 20.097]
  - - [64, 128, 1536, 128]
    - [379, 20.15]
  - - [1024, 4096, 1, 12288]
    - [126, 82.675]
  - - [30528, 1024, 1, 1920]
    - [326, 87.888]
  - - [1024, 1024, 1, 96]
    - [116, 12.56]
  - - [1024, 1024, 1, 12288]
    - [176, 63.8]
  - - [4096, 1024, 1, 12288]
    - [169, 78.708]
  - - [1024, 2, 1, 96]
    - [166, 0.03]
  - - [25600, 128, 25, 128]
    - [380, 45.262]
  - - [12544, 128, 36, 128]
    - [381, 44.385]
  - - [9216, 128, 49, 128]
    - [381, 44.728]
  - - [6400, 128, 64, 128]
    - [381, 44.228]
  - - [6400, 256, 25, 256]
    - [382, 69.056]
  - - [4096, 256, 36, 256]
    - [373, 66.351]
  - - [2304, 256, 49, 256]
    - [383, 65.014]
  - - [2304, 256, 64, 256]
    - [383, 67.997]
  - - [2304, 512, 25, 512]
    - [173, 78.504]
  - - [1024, 512, 36, 512]
    - [338, 74.988]
  - - [1024, 512, 49, 512]
    - [338, 76.266]
  - - [1024, 512, 64, 512]
    - [337, 78.198]
  - - [92416, 64, 25, 64]
    - [300, 23.423]
  - - [50176, 64, 36, 64]
    - [295, 23.567]
  - - [36864, 64, 49, 64]
    - [295, 23.696]
  - - [25600, 64, 64, 64]
    - [384, 23.789]
  - - [64, 128, 192, 128]
    - [385, 15.833]
  - - [128, 64, 192, 128]
    - [386, 15.833]
  - - [768, 2, 1, 2048]
    - [387, 0.261]
  - - [3072, 768, 1, 2048]
    - [285, 71.775]
  - - [768, 3072, 1, 2048]
    - [285, 72.581]
  - - [768, 768, 1, 2048]
    - [307, 34.049]
  - - [64, 384, 144, 384]
    - [388, 32.777]
  - - [384, 64, 144, 384]
    - [389, 29.995]
  - - [768, 2, 1, 4608]
    - [390, 0.469]
  - - [3072, 768, 1, 4608]
    - [285, 77.428]
  - - [768, 3072, 1, 4608]
    - [285, 77.962]
  - - [768, 768, 1, 4608]
    - [391, 48.172]
  - - [64, 512, 48, 512]
    - [385, 29.325]
  - - [512, 64, 48, 512]
    - [392, 29.439]
  - - [64, 128, 256, 128]
    - [393, 17.325]
  - - [128, 64, 256, 128]
    - [394, 17.089]
  - - [64, 384, 192, 384]
    - [346, 30.719]
  - - [384, 64, 192, 384]
    - [395, 31.518]
  - - [1024, 2, 1, 4608]
    - [145, 0.605]
  - - [4096, 1024, 1, 4608]
    - [120, 78.029]
  - - [1024, 4096, 1, 4608]
    - [126, 77.761]
  - - [1024, 1024, 1, 4608]
    - [125, 50.579]
  - - [4880, 256, 49, 256]
    - [119, 68.916]
  - - [3128, 256, 64, 256]
    - [119, 66.367]
  - - [4680, 256, 49, 256]
    - [119, 67.715]
  - - [5280, 256, 36, 256]
    - [127, 69.682]
  - - [2640, 256, 64, 256]
    - [127, 66.087]
  - - [5304, 256, 49, 256]
    - [396, 68.528]
  - - [2760, 256, 64, 256]
    - [173, 64.793]
  - - [6440, 256, 36, 256]
    - [119, 67.293]
  - - [5704, 256, 36, 256]
    - [127, 66.776]
  - - [2128, 256, 64, 256]
    - [338, 63.183]
  - - [1160, 256, 49, 256]
    - [143, 49.872]
  - - [4056, 256, 49, 256]
    - [338, 64.153]
  - - [6144, 256, 36, 256]
    - [127, 71.585]
  - - [6336, 256, 36, 256]
    - [127, 71.084]
  - - [13600, 512, 2, 128]
    - [397, 38.886]
  - - [15200, 512, 2, 128]
    - [236, 42.278]
  - - [15200, 128, 2, 512]
    - [398, 62.777]
  - - [13600, 128, 2, 512]
    - [399, 49.946]
  - - [5632, 256, 36, 256]
    - [127, 71.26]
  - - [12288, 128, 2, 512]
    - [400, 49.744]
  - - [12880, 128, 2, 512]
    - [341, 48.167]
  - - [768, 512, 2, 2048]
    - [401, 39.875]
  - - [11408, 128, 2, 512]
    - [402, 47.275]
  - - [13824, 512, 2, 128]
    - [403, 46.078]
  - - [13824, 128, 2, 512]
    - [361, 58.674]
  - - [10560, 128, 2, 512]
    - [402, 45.291]
  - - [10752, 128, 2, 512]
    - [404, 45.012]
  - - [13600, 512, 2, 256]
    - [342, 54.075]
  - - [15200, 512, 2, 256]
    - [342, 56.843]
  - - [768, 2048, 2, 512]
    - [405, 47.102]
  - - [12880, 512, 2, 128]
    - [406, 38.254]
  - - [11616, 128, 2, 512]
    - [265, 46.716]
  - - [14208, 512, 2, 128]
    - [400, 46.351]
  - - [11408, 512, 2, 128]
    - [407, 37.117]
  - - [6912, 256, 36, 256]
    - [127, 73.054]
  - - [672, 512, 2, 2048]
    - [408, 36.432]
  - - [13824, 512, 2, 256]
    - [365, 62.92]
  - - [11616, 512, 2, 128]
    - [236, 38.302]
  - - [12288, 512, 2, 128]
    - [409, 42.699]
  - - [14208, 128, 2, 512]
    - [410, 59.077]
  - - [11968, 128, 2, 512]
    - [381, 46.902]
  - - [864, 2048, 2, 512]
    - [411, 49.437]
  - - [1008, 512, 2, 2048]
    - [412, 42.728]
  - - [10560, 512, 2, 128]
    - [337, 38.437]
  - - [672, 2048, 2, 512]
    - [413, 41.086]
  - - [9408, 128, 2, 512]
    - [414, 41.511]
  - - [10752, 512, 2, 128]
    - [397, 44.257]
  - - [11968, 512, 2, 128]
    - [415, 38.94]
  - - [1240, 256, 49, 256]
    - [383, 52.783]
  - - [4032, 256, 2, 1024]
    - [414, 47.67]
  - - [888, 2048, 2, 512]
    - [416, 48.545]
  - - [12880, 512, 2, 256]
    - [417, 51.715]
  - - [12288, 512, 2, 256]
    - [147, 56.558]
  - - [13440, 128, 2, 512]
    - [418, 54.052]
  - - [864, 2048, 2, 256]
    - [341, 40.373]
  - - [12672, 128, 2, 512]
    - [419, 51.469]
  - - [11264, 128, 2, 512]
    - [419, 47.156]
  - - [11776, 128, 2, 512]
    - [420, 48.149]
  - - [16128, 128, 2, 512]
    - [399, 49.334]
  - - [4032, 1024, 2, 256]
    - [421, 50.725]
  - - [14000, 128, 2, 512]
    - [400, 51.109]
  - - [13440, 512, 2, 128]
    - [422, 45.415]
  - - [864, 512, 2, 2048]
    - [298, 40.278]
  - - [768, 2048, 2, 256]
    - [420, 38.648]
  - - [3264, 1024, 2, 256]
    - [423, 47.102]
  - - [888, 512, 2, 2048]
    - [424, 38.557]
  - - [4200, 256, 2, 1024]
    - [414, 53.387]
  - - [2352, 1024, 2, 256]
    - [425, 44.903]
  - - [56, 512, 64, 512]
    - [426, 26.403]
  - - [2400, 1024, 2, 256]
    - [427, 45.642]
  - - [15200, 256, 2, 12]
    - [333, 4.937]
  - - [840, 512, 2, 2048]
    - [428, 36.554]
  - - [12880, 256, 2, 12]
    - [429, 4.6]
  - - [2520, 1024, 2, 256]
    - [430, 47.013]
  - - [13600, 256, 2, 12]
    - [431, 4.6]
  - - [15200, 256, 2, 3]
    - [333, 1.278]
  - - [12880, 256, 2, 3]
    - [432, 1.194]
  - - [4200, 1024, 2, 256]
    - [421, 47.049]
  - - [12288, 256, 2, 12]
    - [107, 4.618]
  - - [768, 256, 2, 12]
    - [433, 0.818]
  - - [13824, 256, 2, 12]
    - [143, 4.907]
  - - [864, 256, 2, 3]
    - [434, 0.234]
  - - [176, 256, 2, 3]
    - [435, 0.045]
  - - [864, 256, 2, 12]
    - [436, 0.903]
  - - [13600, 256, 2, 3]
    - [379, 1.214]
  - - [768, 256, 2, 3]
    - [437, 0.216]
  - - [7600, 512, 1, 256]
    - [338, 49.587]
  - - [6144, 512, 1, 256]
    - [438, 39.048]
  - - [12544, 1024, 1, 1024]
    - [127, 72.75]
  - - [1024, 81, 1, 1024]
    - [439, 6.067]
  - - [176, 256, 2, 12]
    - [434, 0.18]
  - - [216, 256, 2, 3]
    - [440, 0.078]
  - - [192, 256, 2, 12]
    - [441, 0.201]
  - - [3800, 256, 2, 3]
    - [160, 0.748]
  - - [13824, 256, 2, 3]
    - [403, 1.361]
  - - [12288, 256, 2, 3]
    - [442, 1.289]
  - - [192, 256, 2, 3]
    - [435, 0.05]
  - - [216, 256, 2, 12]
    - [130, 0.259]
  - - [2688, 256, 2, 1024]
    - [443, 42.82]
  - - [3072, 256, 2, 12]
    - [160, 2.42]
  - - [3800, 256, 2, 12]
    - [160, 2.837]
  - - [3072, 256, 2, 3]
    - [140, 0.659]
  - - [2520, 256, 2, 1024]
    - [288, 44.798]
  - - [16128, 512, 2, 128]
    - [400, 46.879]
  - - [2400, 256, 2, 1024]
    - [101, 41.03]
  - - [2352, 256, 2, 1024]
    - [444, 41.362]
  - - [2944, 256, 2, 1024]
    - [201, 44.173]
  - - [2992, 1024, 2, 256]
    - [445, 47.355]
  - - [2816, 256, 2, 1024]
    - [446, 43.042]
  - - [2904, 1024, 2, 256]
    - [419, 42.66]
  - - [3456, 256, 2, 3]
    - [333, 0.731]
  - - [3400, 256, 2, 3]
    - [447, 0.688]
  - - [2816, 1024, 2, 256]
    - [344, 47.156]
  - - [3456, 256, 2, 12]
    - [447, 2.65]
  - - [2944, 1024, 2, 256]
    - [373, 48.8]
  - - [3168, 256, 2, 1024]
    - [201, 46.124]
  - - [2992, 256, 2, 1024]
    - [201, 44.351]
  - - [51520, 256, 2, 12]
    - [160, 5.376]
  - - [3072, 256, 2, 1024]
    - [265, 45.953]
  - - [2640, 1024, 2, 256]
    - [448, 42.609]
  - - [2688, 1024, 2, 256]
    - [449, 45.635]
  - - [2904, 256, 2, 1024]
    - [270, 42.66]
  - - [3264, 256, 2, 1024]
    - [450, 49.89]
  - - [54400, 256, 2, 12]
    - [451, 5.814]
  - - [55296, 256, 2, 3]
    - [373, 1.593]
  - - [60800, 256, 2, 12]
    - [452, 5.885]
  - - [51520, 256, 2, 3]
    - [160, 1.455]
  - - [55296, 256, 2, 12]
    - [453, 5.888]
  - - [3600, 1024, 2, 256]
    - [454, 52.413]
  - - [60800, 256, 2, 3]
    - [455, 1.649]
  - - [952, 256, 64, 256]
    - [127, 51.541]
  - - [49152, 256, 2, 12]
    - [456, 5.664]
  - - [3360, 256, 2, 1024]
    - [457, 47.924]
  - - [736, 256, 64, 256]
    - [290, 54.099]
  - - [600, 256, 64, 256]
    - [127, 48.559]
  - - [1440, 256, 49, 256]
    - [419, 56.792]
  - - [3168, 1024, 2, 256]
    - [423, 46.261]
  - - [1368, 256, 49, 256]
    - [338, 53.881]
  - - [49152, 256, 2, 3]
    - [458, 1.539]
  - - [3600, 256, 2, 1024]
    - [457, 52.413]
  - - [3360, 1024, 2, 256]
    - [419, 48.487]
  - - [54400, 256, 2, 3]
    - [173, 1.589]
  - - [3072, 1024, 2, 256]
    - [338, 50.579]
  - - [2640, 256, 2, 1024]
    - [459, 44.976]
  - - [616, 256, 64, 256]
    - [338, 47.975]
  - - [3008, 256, 64, 256]
    - [338, 69.208]
  - - [896, 256, 64, 256]
    - [456, 57.467]
  - - [768, 256, 64, 256]
    - [290, 56.878]
  - - [3552, 256, 2, 1024]
    - [423, 60.724]
  - - [3552, 1024, 2, 256]
    - [94, 52.812]
  - - [800, 256, 64, 256]
    - [290, 52.776]
  - - [1120, 256, 49, 256]
    - [290, 56.191]
  - - [2408, 256, 64, 256]
    - [119, 64.298]
  - - [3456, 256, 2, 1024]
    - [460, 58.071]
  - - [672, 256, 64, 256]
    - [456, 49.581]
  - - [3456, 1024, 2, 256]
    - [373, 56.522]
  - - [1064, 256, 49, 256]
    - [119, 50.197]
  - - [3400, 256, 2, 1024]
    - [461, 48.353]
  - - [704, 256, 64, 256]
    - [340, 51.942]
  - - [3400, 1024, 2, 256]
    - [154, 47.392]
  - - [3264, 256, 64, 256]
    - [173, 69.895]
  - - [3800, 1024, 2, 256]
    - [445, 55.325]
  - - [3800, 256, 2, 1024]
    - [462, 58.447]
  - - [6440, 512, 1, 256]
    - [456, 36.572]
  - - [6912, 512, 1, 256]
    - [337, 46.078]
  - - [6800, 512, 1, 256]
    - [451, 38.261]
  - - [6800, 512, 1, 1024]
    - [463, 56.358]
  - - [6440, 512, 1, 1024]
    - [361, 53.829]
  - - [6912, 512, 1, 1024]
    - [464, 71.097]
  - - [1728, 1024, 1, 512]
    - [465, 41.561]
  - - [1536, 1024, 1, 512]
    - [290, 33.2]
  - - [7600, 512, 1, 1024]
    - [281, 75.484]
  - - [6144, 512, 1, 1024]
    - [466, 55.11]
  - - [1728, 1024, 1, 2048]
    - [282, 61.886]
  - - [1536, 1024, 1, 2048]
    - [457, 53.927]
  - - [1024, 320, 1, 1024]
    - [467, 16.882]
  - - [173280, 64, 1, 128]
    - [468, 23.596]
  - - [25992, 64, 1, 128]
    - [469, 16.468]
  - - [13, 512, 1, 32768]
    - [470, 6.521]
  - - [479, 1024, 1, 32768]
    - [471, 67.571]
  - - [74, 2048, 1, 512]
    - [487, 5.952]
  - - [5, 64, 1, 5]
    - [488, 0.0]
  - - [33, 32, 1, 33]
    - [488, 0.004]
  - - [3, 64, 512, 3]
    - [280, 0.045]
  - - [5, 64, 512, 5]
    - [280, 0.118]
  - - [5, 64, 960, 5]
    - [472, 0.163]
  - - [9, 64, 512, 9]
    - [280, 0.355]
  - - [27, 128, 32768, 27]
    - [489, 5.307]
  - - [33, 32, 200, 33]
    - [490, 0.893]
  - - [33, 32, 1600, 33]
    - [491, 2.718]
  - - [67, 2048, 1, 512]
    - [492, 5.434]
  - - [74, 2048, 1, 960]
    - [493, 8.009]
  - - [100, 2048, 1, 512]
    - [494, 7.111]
  - - [257, 4096, 1, 1024]
    - [495, 28.1]
  - - [13, 512, 1, 3456]
    - [496, 1.708]
  - - [13, 512, 1, 4096]
    - [497, 1.933]
  - - [13, 512, 1, 55296]
    - [498, 7.553]
  - - [13, 512, 1, 6912]
    - [499, 2.89]
  - - [13, 512, 1, 864]
    - [500, 0.503]
  - - [196, 512, 64, 1024]
    - [501, 47.09]
  - - [196, 1024, 64, 512]
    - [502, 44.925]
  - - [196, 1024, 64, 1024]
    - [502, 52.048]
  - - [49, 1024, 64, 2048]
    - [503, 30.454]
  - - [49, 2048, 64, 1024]
    - [504, 30.697]
  - - [196, 512, 32, 1024]
    - [505, 39.302]
  - - [196, 1024, 32, 512]
    - [506, 39.914]
  - - [196, 1024, 32, 1024]
    - [507, 47.526]
  - - [49, 1024, 32, 2048]
    - [508, 30.111]
  - - [49, 2048, 32, 1024]
    - [509, 28.923]
  - - [196, 1024, 32, 256]
    - [510, 30.897]
  - - [196, 256, 32, 1024]
    - [511, 32.325]
  - - [49, 2048, 32, 512]
    - [512, 25.307]
  - - [49, 512, 32, 2048]
    - [513, 23.93]
  - - [196, 256, 64, 1024]
    - [514, 38.419]
  - - [196, 1024, 64, 256]
    - [506, 35.089]
  - - [49, 512, 64, 2048]
    - [515, 27.501]
  - - [49, 2048, 64, 512]
    - [516, 26.552]
  - - [1225, 192, 64, 32]
    - [517, 13.104]
  - - [1225, 192, 64, 48]
    - [518, 17.338]
  - - [1225, 192, 64, 64]
    - [513, 20.87]
  - - [1225, 256, 64, 48]
    - [519, 19.021]
  - - [1225, 256, 64, 64]
    - [520, 23.206]
  - - [1225, 288, 64, 48]
    - [521, 19.246]
  - - [1225, 288, 64, 64]
    - [522, 24.192]
  - - [5329, 64, 64, 80]
    - [523, 21.032]
  - - [289, 768, 64, 128]
    - [524, 31.279]
  - - [289, 768, 64, 160]
    - [525, 35.041]
  - - [289, 768, 64, 192]
    - [526, 38.094]
  - - [1225, 192, 32, 32]
    - [527, 11.214]
  - - [1225, 192, 32, 48]
    - [528, 14.828]
  - - [1225, 192, 32, 64]
    - [529, 18.104]
  - - [1225, 256, 32, 48]
    - [530, 16.947]
  - - [1225, 256, 32, 64]
    - [531, 20.584]
  - - [1225, 288, 32, 48]
    - [532, 15.848]
  - - [1225, 288, 32, 64]
    - [532, 20.552]
  - - [5329, 64, 32, 80]
    - [517, 18.697]
  - - [289, 768, 32, 128]
    - [533, 26.422]
  - - [289, 768, 32, 160]
    - [534, 30.042]
  - - [289, 768, 32, 192]
    - [535, 33.147]
  - - [196, 2304, 1, 256]
    - [536, 10.403]
  - - [49, 4608, 1, 512]
    - [537, 7.213]
  - - [196, 1024, 128, 256]
    - [510, 38.086]
  - - [196, 1024, 256, 256]
    - [514, 39.708]
  - - [196, 1024, 128, 512]
    - [538, 48.102]
  - - [196, 1024, 256, 512]
    - [539, 48.875]
  - - [196, 256, 128, 1024]
    - [540, 46.626]
  - - [196, 256, 256, 1024]
    - [505, 51.916]
  - - [49, 2048, 128, 512]
    - [541, 28.001]
  - - [49, 2048, 256, 512]
    - [542, 29.42]
  - - [49, 512, 128, 2048]
    - [543, 28.56]
  - - [49, 512, 256, 2048]
    - [543, 31.234]
  - - [4524, 256, 49, 256]
    - [544, 64.13]
  - - [2666, 256, 64, 256]
    - [545, 61.018]
  - - [950, 2048, 2, 512]
    - [546, 43.562]
  - - [3220, 1024, 2, 256]
    - [547, 41.907]
  - - [782, 128, 64, 128]
    - [548, 25.837]
  - - [850, 2048, 2, 512]
    - [549, 43.33]
  - - [713, 512, 2, 2048]
    - [550, 33.238]
  - - [805, 2048, 2, 512]
    - [551, 40.93]
  - - [713, 2048, 2, 512]
    - [524, 38.338]
  - - [660, 512, 2, 2048]
    - [552, 32.545]
  - - [726, 512, 2, 2048]
    - [553, 33.29]
  - - [660, 2048, 2, 512]
    - [554, 37.874]
  - - [726, 2048, 2, 512]
    - [540, 39.36]
  - - [748, 512, 2, 2048]
    - [555, 33.748]
  - - [805, 2048, 2, 256]
    - [556, 30.618]
  - - [1251, 256, 49, 256]
    - [557, 47.71]
  - - [805, 512, 2, 2048]
    - [542, 34.722]
  - - [850, 512, 2, 2048]
    - [558, 36.423]
  - - [850, 256, 2, 3]
    - [488, 0.21]
  - - [805, 256, 2, 12]
    - [559, 0.759]
  - - [228, 256, 2, 12]
    - [560, 0.262]
  - - [228, 256, 2, 3]
    - [561, 0.073]
  - - [805, 256, 2, 3]
    - [562, 0.203]
  - - [850, 256, 2, 12]
    - [563, 0.788]
  - - [187, 256, 2, 12]
    - [564, 0.176]
  - - [247, 256, 2, 12]
    - [565, 0.254]
  - - [950, 256, 2, 12]
    - [491, 0.895]
  - - [950, 256, 2, 3]
    - [562, 0.231]
  - - [1900, 1024, 1, 2048]
    - [566, 56.584]
  - - [1610, 1024, 1, 2048]
    - [567, 50.882]
  - - [1900, 1024, 1, 512]
    - [568, 41.804]
  - - [3220, 256, 2, 12]
    - [569, 2.128]
  - - [187, 256, 2, 3]
    - [570, 0.043]
  - - [221, 256, 2, 3]
    - [565, 0.066]
  - - [221, 256, 2, 12]
    - [571, 0.235]
  - - [247, 256, 2, 3]
    - [572, 0.074]
  - - [3220, 256, 2, 3]
    - [569, 0.564]
  - - [3036, 1024, 2, 256]
    - [573, 39.408]
  - - [3036, 256, 2, 1024]
    - [574, 37.522]
  - - [850, 2048, 2, 256]
    - [575, 32.205]
  - - [2852, 1024, 2, 256]
    - [576, 38.979]
  - - [950, 2048, 2, 256]
    - [577, 31.601]
  - - [3700, 1024, 2, 256]
    - [578, 44.604]
  - - [2852, 256, 2, 1024]
    - [579, 41.036]
  - - [3700, 256, 2, 1024]
    - [580, 47.523]
  - - [1269, 256, 49, 256]
    - [540, 46.114]
  - - [1467, 256, 49, 256]
    - [578, 49.703]
  - - [3500, 256, 2, 1024]
    - [581, 52.038]
  - - [1449, 256, 49, 256]
    - [582, 50.752]
  - - [1278, 256, 49, 256]
    - [557, 46.61]
  - - [1413, 256, 49, 256]
    - [545, 52.231]
  - - [1341, 256, 49, 256]
    - [548, 49.086]
  - - [1287, 256, 49, 256]
    - [544, 48.958]
  - - [1332, 256, 49, 256]
    - [547, 49.419]
  - - [1359, 256, 49, 256]
    - [578, 48.105]
  - - [1395, 256, 49, 256]
    - [583, 48.466]
  - - [1323, 256, 49, 256]
    - [583, 48.251]
  - - [1404, 256, 49, 256]
    - [557, 49.815]
  - - [1386, 256, 49, 256]
    - [548, 49.645]
  - - [1350, 256, 49, 256]
    - [581, 48.471]
  - - [3500, 1024, 2, 256]
    - [584, 44.374]
  - - [3220, 256, 2, 1024]
    - [583, 45.011]
  - - [690, 256, 64, 256]
    - [533, 43.403]
  - - [660, 256, 64, 256]
    - [567, 43.983]
  - - [782, 256, 64, 256]
    - [533, 46.507]
  - - [884, 256, 64, 256]
    - [583, 46.953]
  - - [1610, 1024, 1, 512]
    - [585, 29.697]
  - - [1700, 1024, 1, 512]
    - [586, 31.475]
  - - [1700, 1024, 1, 2048]
    - [587, 57.13]
  - - [100, 512, 120, 128]
    - [588, 19.216]
  - - [100, 512, 18, 128]
    - [589, 10.128]
  - - [100, 512, 19, 128]
    - [484, 10.498]
  - - [1444, 128, 120, 256]
    - [540, 45.416]
  - - [1444, 128, 18, 256]
    - [540, 36.395]
  - - [1444, 128, 19, 256]
    - [548, 38.07]
  - - [1444, 256, 120, 256]
    - [582, 59.371]
  - - [1444, 256, 18, 256]
    - [548, 43.318]
  - - [1444, 256, 19, 256]
    - [545, 44.515]
  - - [25, 256, 120, 128]
    - [590, 6.865]
  - - [25, 256, 18, 128]
    - [591, 2.0]
  - - [25, 256, 19, 128]
    - [591, 2.111]
  - - [361, 512, 120, 256]
    - [592, 45.926]
  - - [361, 512, 18, 256]
    - [593, 30.306]
  - - [361, 512, 19, 256]
    - [594, 31.749]
  - - [9, 256, 120, 128]
    - [595, 2.855]
  - - [9, 256, 18, 128]
    - [596, 0.764]
  - - [9, 256, 19, 128]
    - [597, 0.807]
  - - [100, 2304, 1, 512]
    - [598, 7.666]
  - - [1444, 576, 1, 128]
    - [599, 9.768]
  - - [25, 1152, 1, 256]
    - [487, 0.719]
  - - [27436, 64, 1, 128]
    - [600, 14.607]
  - - [361, 2304, 1, 512]
    - [527, 23.306]
  - - [9, 1152, 1, 256]
    - [601, 0.276]
- null
